_id,headline,pub_date
nyt://article/e09f2642-863a-5bf6-9deb-c232d8f191b1,Tory Lanez Is Expected to Be Sentenced for Shooting Megan Thee Stallion,2023-08-07 15:04:43
nyt://article/b06d33ff-b06e-5f9a-96cf-d4fd41bdc539,Crypto’s Next Craze? Orbs That Scan Your Eyeballs.,2023-08-07 15:05:19
nyt://article/03723cf1-e6d9-51f4-ab6e-46ed936603f6,"Storms Sweep Across Eastern U.S., Killing 2",2023-08-07 15:06:54
nyt://article/97c8e149-e2ff-5307-9caf-a48ff19db6fe,DeSantis Bluntly Acknowledges Trump’s 2020 Defeat: ‘Of Course He Lost’,2023-08-07 15:13:10
nyt://article/a587e578-cb76-58f5-a4a9-a01b0f5f5d89,This Corn Serving Platter Is the Perfect Gift for a Summer Host,2023-08-07 15:27:17
nyt://article/357b3f7c-e63a-5fac-a334-4546bdd01ab4,U.K. Moves First Group of Asylum Seekers Onto Barge,2023-08-07 16:01:15
nyt://article/ccff6975-b663-53e6-b460-adda7ea93aa5,"Rhiannon Giddens Is a Songwriter, Too",2023-08-07 17:00:14
nyt://article/8853f895-4d99-5093-b95c-0085209da1ca,Abortion Drives Ohio Election on Amending the State Constitution,2023-08-07 17:09:15
nyt://article/6c6d28c2-6be8-51ae-b777-a1e153038edc,Judge Weighs Conservatorship for the Former Supreme Cindy Birdsong,2023-08-07 17:12:56
nyt://article/5210b1cc-103b-596c-a252-1d04dabf4cf0,Queens Doctor Charged With Drugging and Assaulting Patients on Camera,2023-08-07 17:25:52
nyt://article/7e66d644-846d-5301-84ea-42582922d806,"William Friedkin, Director of ‘French Connection’ and ‘Exorcist,’ Dies at 87",2023-08-07 17:35:56
nyt://article/f8da8a90-b84b-50a3-9ea3-2c4b36a7c204,Judge Throws Out Trump’s Countersuit Against E. Jean Carroll,2023-08-07 17:38:50
nyt://article/8f44952e-ad38-5c8a-b798-aeea07977a6b,Amazon to Meet Regulators as U.S. Considers Possible Antitrust Suit,2023-08-07 17:40:25
nyt://article/30dc7dec-13e5-580f-bcf6-86d3e7af5274,‘Toros’ Review: Why Are We Still Friends?,2023-08-07 17:42:25
nyt://article/e019ab59-e6e6-5dd0-a140-a9beb627e6cb,Even Zoom Is Making People Return to the Office,2023-08-07 17:51:02
nyt://article/d377f095-bd2c-5dd9-b9e1-0ff83a233023,What to Know About Prosecutors’ Request for Protective Order in Jan. 6 Case,2023-08-07 17:58:05
nyt://article/c3b40f9d-e436-5ebe-a64c-477d0aaed8fe,Mayor Adams and New York’s Immigration Crisis,2023-08-07 18:04:39
nyt://article/553fd188-d1a0-5bbd-93dd-e1a0deb9d73b,"Corrections: Aug. 5, 2023",2023-08-07 18:13:02
nyt://article/41bb491c-4abf-5cd6-83fa-52e192bb0beb,Gaza Protests Struggle to Gain Traction as Police Crack Down,2023-08-07 18:19:39
nyt://article/9728125c-0873-50fe-909e-fa5bb9f24305,Offshore Wind Runs Into Rising Costs and Delays,2023-08-07 18:45:12
nyt://article/a697b240-4057-52cf-ab64-843ef2b6b428,The Secret Hand Behind the Women Who Stood by Cuomo? His Sister.,2023-08-07 18:50:55
nyt://article/81254f45-a10c-5672-b0d5-94d946c171cc,What G.D.P.’s Cousin Can Tell Us About the Economy,2023-08-07 19:00:02
nyt://article/28a270e7-a4dd-55a4-b4f7-81dc29d1a330,Mostly Mozart’s Repertoire Broadens With Its Audience,2023-08-07 19:06:29
nyt://article/d6efafe3-0cc4-5496-8fb9-b504dc22ce6d,O’Shae Sibley’s ‘Expression Was Turned Into Resistance’,2023-08-07 19:38:59
nyt://article/f2b04226-9162-5493-a5e0-27cc4bde15b4,Foreign Ministers of China and Russia Confer After Jeddah Talks,2023-08-07 19:41:18
nyt://article/02b23541-1a03-5934-86b9-2d0b6cab9c37,The Wide World of Puppetry Converges on New York,2023-08-07 19:49:41
nyt://article/411177ed-ddc3-58d4-8740-45e4bea5fb39,A Quaint French Bookstore’s Violent Dog Problem Turns Deadly,2023-08-07 20:01:14
nyt://article/feeb35d4-744f-55ca-a349-af40a2904ac0,Can This Festival Keep a New York Sandwich Tradition Alive?,2023-08-07 20:03:58
nyt://article/6b752de5-d52c-54bf-a9f6-af8788c4f8d8,"Paramount Agrees to Sell Simon & Schuster to KKR, a Private Equity Firm",2023-08-07 20:13:23
nyt://article/58a478f4-0741-58df-aad2-e5f7a5c149dc,William Friedkin’s Final Film to Premiere at the Venice Film Festival,2023-08-07 20:24:13
nyt://article/5881e393-5d45-5f14-b08a-5603a3a14221,"G.O.P. Contenders Feed Voter Distrust in Courts, Schools and Military",2023-08-07 20:41:19
nyt://article/0624c440-c213-59a3-9237-b7b17f7cc28e,Tuesday Briefing: Elite Chinese Generals Ousted,2023-08-07 20:42:57
nyt://article/b6373927-3570-5f66-8dcb-4b1df8fe6c8e,A New Generation of Oriole Magic,2023-08-07 21:08:29
nyt://article/aa28189a-1a6b-5c1c-935a-f6c4c5e6dc93,"A Trucking Giant Is Bankrupt, and Finger-Pointing Begins",2023-08-07 21:13:07
nyt://article/57126c46-0617-5d54-bfcd-fe88a44702df,Ex-F.B.I. Official in Talks to Resolve Charges of Working for Oligarch,2023-08-07 21:16:56
nyt://article/5f4e462f-b4c4-55c2-94c1-85600f5cda59,Flights Delays could persist because of severe weather.,2023-08-07 21:39:15
nyt://article/8baad0b2-5d01-5717-8ff3-9186ce22655a,What Is Your Experience With the Overdose Crisis in Baltimore?,2023-08-07 22:00:14
nyt://article/b61d3806-bbe9-53e0-b5ec-0a6ab52146be,DeSantis on Trump: ‘Of Course He Lost’,2023-08-07 22:09:59
nyt://article/6ca383b3-df77-57e6-a9a1-5fb5a82447a9,"New York City Has ‘Tepid’ Plans for Fixing Rikers, Monitor Says",2023-08-07 22:15:38
nyt://article/4015153d-32dc-546e-9930-f61fcb062735,A Twitch Streamer’s Giveaway Caused Mayhem in New York,2023-08-07 22:18:53
nyt://article/35950000-0f66-55fd-ba6e-3ff51f51037d,"Ukraine Says Russian Missiles Struck Town of Pokrovsk, Killing 5",2023-08-07 22:22:28
nyt://article/0dbb6001-8a8d-5bef-9fd2-e5e594e7d3f5,"Rhoda Karpatkin, Who Led Consumer Reports for Decades, Dies at 93",2023-08-07 22:30:19
nyt://article/9b979014-df06-546c-93e4-e53a44fb784f,"Mother, Accused of Human Trafficking While Flying With Daughter, Sues Southwest Airlines",2023-08-07 22:34:19
nyt://article/0463858c-a776-5ad8-be52-d5deb74ce7be,Climate Is Now a Culture War Issue,2023-08-07 23:00:08
nyt://article/4cdc4157-a442-5cd5-92f7-cfa7416170b7,Nine Provocative William Friedkin Movies to Stream,2023-08-07 23:23:25
nyt://article/f4b9d5be-0492-5559-bf67-7cbb4c2d4b88,Trump Cheers the Defeat of Rapinoe and the U.S. Women’s Soccer Team,2023-08-07 23:23:49
nyt://article/2efc796f-a9bd-5a32-a9e7-b9854a51dd49,"First Came ‘the Great Dying,’ Then This Strange Reptile Evolved",2023-08-08 00:00:08
nyt://article/5eb26c63-a8dd-5dad-aa63-f6d8914ce027,Teenage Cousin of Uvalde Gunman Arrested Over Threats to a School,2023-08-08 01:23:46
nyt://article/7200cb95-d85f-592a-8d01-52e927231294,"Biden to Designate Monument Near Grand Canyon, Preventing Uranium Mining",2023-08-08 01:46:53
nyt://article/c83ce7aa-45f2-54f9-a428-a0ddda69ad95,Totally Wipes Out,2023-08-08 02:00:07
nyt://interactive/9684d96c-972e-5c82-b124-fed8ae55132e,How Cooking Videos Took Over the World,2023-08-08 02:05:38
nyt://article/0faec2ff-0f53-5986-9ead-c64d64fd9b65,Video Shows China Blasting Water Cannon at Philippines Coast Guard Boat,2023-08-08 02:38:03
nyt://article/a29fe717-ba76-5933-9b2f-087a6980afef,"Pence Qualifies for First G.O.P. Debate, His Campaign Says",2023-08-08 03:28:50
nyt://article/1e092bdf-e5cc-523f-8f2f-373845a61555,Your Tuesday Briefing,2023-08-08 04:01:06
nyt://article/888af449-5d32-5466-b60c-5dba43a78e2e,"Don’t Be So Picky About a Job, China’s College Graduates Are Told",2023-08-08 04:01:12
nyt://article/34e8e55b-1506-5bbd-8e6f-93a00220e50f,What Cuisine Means to Taiwan’s Identity and Its Clash With China,2023-08-08 04:01:27
nyt://article/8e74d07c-0186-5e4e-bb4d-ddc400cf6df3,Extreme Weather Is Coming. Someone Has to Tell the Chimps.,2023-08-08 04:01:36
nyt://article/f37bc8d2-84c4-5f99-93c5-f16b7ecf04fb,Why Eric Adams Likes to Raise Flags,2023-08-08 04:05:05
nyt://article/88a93948-cf40-5e79-8c10-f9c9cedda3de,Quotation of the Day: Crypto Concept Hopes to Scan 8 Billion Eyes,2023-08-08 04:43:30
nyt://article/27c81149-10af-599a-9930-6694d8b424cf,"Corrections: Aug. 8, 2023",2023-08-08 04:43:34
nyt://article/ff339103-b93e-576b-a591-472dac34c528,Typhoon Khanun Barrels Over Japan and Heads to South Korea,2023-08-08 04:54:21
nyt://article/f5566974-7f07-5e03-ab66-a5286fc6a74a,Word of the Day: bedraggled,2023-08-08 06:00:02
nyt://article/b8ea2f4f-a354-5646-8247-51d57a43d554,Today’s Wordle Review,2023-08-08 07:00:02
nyt://article/ef9c61ea-a8ea-58d6-b84d-0cbcfb893ccb,How New York Lost and Regained Control of Union Square,2023-08-08 07:00:11
nyt://article/f6e742da-ed14-56af-aac5-68dd70f957ff,Spelling Bee Forum,2023-08-08 07:00:18
nyt://article/1c20e0e3-4e6c-5e36-965c-b31968ee6a60,"Under a Hellish Ocean Habitat, Bizarre Animals Are Lurking",2023-08-08 07:00:21
nyt://article/434e4421-1517-56f6-b2cc-9824e624189c,Ireland Says Goodbye to Sinéad O’Connor,2023-08-08 07:20:25
nyt://article/85c166f5-03c9-59fb-88d3-0a7e5edbffd2,It’s France and Morocco to finish the round of 16.,2023-08-08 07:36:17
nyt://video/ac716f3e-323f-5390-85d8-c8fd5032d273,Control,2023-08-08 08:55:09
nyt://article/c0ad8a6e-4073-5bb7-8b8d-e9d52210f63e,A Conservative on How His Party Has Changed Since 2016,2023-08-08 09:00:10
nyt://article/ce04d8d2-e8b6-5c4b-a9c3-45aeacc4b8f2,Why Is Everyone Suddenly Listening to a Staple of My Angsty Adolescence?,2023-08-08 09:00:20
nyt://article/14c23848-2bd4-54ea-ae97-7e0a3ca8fe66,"In One Word, Biden and Trump Tell Us Exactly Who They Are",2023-08-08 09:00:29
nyt://article/950931bf-d516-5a14-a771-a02472cf9ab3,"To Have and to Hold, Even if You Turn Into a Literal Shark",2023-08-08 09:00:33
nyt://article/f6c9a8c5-ac39-50e1-8247-2d2abc769598,"Once Rare, Impeachments and Censures Have Become the Norm in Congress",2023-08-08 09:00:34
nyt://article/a3cb2bca-9a87-58c0-8865-745b51f10d24,What Is IJBOL?,2023-08-08 09:00:44
nyt://article/de462578-3d87-5e79-92ba-ebdbab7c6c5d,Thousands of Los Angeles City Workers Strike for One Day,2023-08-08 09:00:46
nyt://article/46e8f9f3-514f-5db2-99e2-b991db70c7f2,"Whether You Call It ‘Skiplagging’ or ‘Hidden-City Travel,’ It’s Contentious",2023-08-08 09:00:58
nyt://article/3a3fd6ad-3173-5bfa-92f3-cf63bdc762a6,"In Paris, I Get Judged on What I Speak, Not How I Look",2023-08-08 09:01:06
nyt://article/1d3105f9-fc5a-570a-8d02-66c9dec94b19,"Give Me a Home Where the Ranchers, Poets and Hippies Roam",2023-08-08 09:01:07
nyt://article/57f01c1b-ae9a-57a1-afbf-78b0c5344afd,The Prosecution of Trump May Have Terrible Consequences,2023-08-08 09:01:12
nyt://article/6a02f7ab-9fda-50eb-81e4-cff28239c7a9,"For ‘Only Murders’ Season 3, Not the Same Old Song and Dance",2023-08-08 09:01:14
nyt://article/c0c682f0-baa1-5404-a327-df3b6bfc5b41,Remembering the Rappers We Lost,2023-08-08 09:01:15
nyt://article/cebed0e7-a335-5a79-9291-a6d559294b42,He Was Tortured During the Troubles. ‘This Is the British Government That’s Doing This.’,2023-08-08 09:01:15
nyt://article/52199ef3-e024-5f96-b03d-4a8c7f52ff43,Where Did All the Broadway Sets Go?,2023-08-08 09:01:21
nyt://article/acdd8a2b-f24f-5838-a558-98550390b55c,Hoping to Stay in the Shohei Ohtani Business,2023-08-08 09:01:24
nyt://article/1ddf058d-ffaa-5595-9e86-89d71b1e6550,"According to TikTok, Americans Are Very, Very Thirsty",2023-08-08 09:01:26
nyt://article/9d7e52ec-f740-5e02-aba2-44c150031d5e,What’s at Stake in Ohio’s Referendum on Amending the State Constitution,2023-08-08 09:01:26
nyt://article/dcf08272-356f-54ef-ac3a-6107751bdad8,"In Ireland’s ‘Forgotten County,’ a Tiny Inn Does It Right",2023-08-08 09:01:26
nyt://article/eab3011d-5475-5f3e-b50a-37135a8ba234,What You Discover When You Garden at Night,2023-08-08 09:01:27
nyt://article/e9734b28-b443-5de6-9fff-f05b63e89471,Why Do I Get Constipated When I Travel?,2023-08-08 09:01:28
nyt://slideshow/5e6eaf00-6892-5859-a0c6-d125225e275d,An Apartment With Character in the West Village,2023-08-08 09:01:30
nyt://article/0960b0bb-a65f-5fe2-b987-8079334f24c3,Judy Holliday’s Old Home in the Village Deserved a Renovation,2023-08-08 09:01:33
nyt://article/76a9f38f-be14-597a-8b30-f22817096431,The Magic of Block Party Season,2023-08-08 09:01:33
nyt://article/c0bebcc2-5cf1-53ab-aff0-65261e391a3b,Repeat After Her: There Is No Dance Without Dance Education,2023-08-08 09:01:33
nyt://article/7db3bafd-1505-5045-8df8-f9cf696a3a45,An Oil-Rich Ally Tests Its Relationship With the U.S.,2023-08-08 09:01:34
nyt://article/db8e68b9-af1d-5604-89c0-3be69dc858d7,"From the Women’s World Cup to Wimbledon, a Victory Everyone Can Share",2023-08-08 09:01:34
nyt://article/006d4834-80b3-5a43-aaa8-04f5edf6dc30,A Brief History of Bling,2023-08-08 09:03:37
nyt://article/9ba6419c-8509-5e8f-80ec-88211a83ee3f,Turbulent Waters: How the Black Sea Became a Hot Spot in the War,2023-08-08 09:20:21
nyt://article/65b8fe65-c32f-55a7-9ce6-963aba227f17,The Taliban Won but These Afghans Fought On,2023-08-08 09:22:30
nyt://article/5bf82a9b-9ec8-515a-90c1-c6ea7d701977,"Today’s Top News: DeSantis Acknowledges Trump’s 2020 Loss, and More",2023-08-08 09:45:09
nyt://article/173afe8a-99ff-5f79-85b0-b022e3932470,The Legal Strategy Behind the Latest Trump Indictment,2023-08-08 10:00:18
nyt://article/b2ea0276-6910-5236-84c1-f86cedc5c586,Man Is Wounded in Knife Attack Outside British Museum in London,2023-08-08 10:45:07
nyt://article/538aa480-a6b8-5c21-a8db-48fc2951fd02,Swiss Museum Cashier Pockets Over $1 Million in Yearslong Scam,2023-08-08 10:55:33
nyt://article/0fa52139-eb80-5f38-b0af-217c4ac997e7,Ohio’s One-Issue Election,2023-08-08 10:58:20
nyt://article/57ef1a36-0d57-570c-ae48-9f8271ffde1b,Caviar Gets Even More Refined,2023-08-08 11:00:14
nyt://article/d14ddfb4-e828-5cdf-9563-6c22053c4e7a,New York Times Revenue Rises 6.3%,2023-08-08 11:10:55
nyt://article/c53707e5-9347-5742-8fcc-2a8ddddc8c67,Hopes for Dialogue Dim in Niger as Junta Clings to Power,2023-08-08 12:14:41
nyt://article/d14c1f51-da16-57a4-a128-e56e1c4a660c,Goldman Sachs’s C.E.O. Whisperer Takes a Step Back,2023-08-08 12:16:06
nyt://article/c88d66c9-800f-5dbb-9508-a960866fd8af,Woman Is Bitten by Shark in First New York City Attack in Years,2023-08-08 12:30:26
nyt://article/a7e7b829-6243-5f0d-b06d-74236c848281,G.M. Will Add Backup Power Function to Its Electric Vehicles,2023-08-08 13:00:17
nyt://article/827ea624-40aa-5175-a677-e8ff09241e12,Love Letters to California,2023-08-08 13:00:21
nyt://article/913948d7-f4d8-5b6b-98da-6beccea5cfd7,Should Bronx Parkland Be Used for a Cricket World Cup Stadium?,2023-08-08 13:00:26
nyt://article/58870937-883a-5126-94ac-df616026f1b8,"Floods, Fires and Torrential Rains Further Bedevil Europe",2023-08-08 13:16:56
nyt://article/989dd50a-c39e-5841-bd53-a1d8982c8f65,"Weight Loss Drug Cuts Risk of Heart Problems, Maker Says",2023-08-08 13:36:26
nyt://article/5f78ace9-c77e-5e7c-bed0-08e5ce2ec119,Travis Scott Debuts at No. 1 With the Year’s Biggest Week for Hip-Hop,2023-08-08 13:41:27
nyt://video/d39b3d77-7e69-59b9-9478-9c7b780da194,Irish Mourners Pay Their Respects to Sinéad O’Connor,2023-08-08 13:46:52
nyt://article/4cc4330a-1043-5402-80b3-0925fe363d26,Justin Simien on Releasing ‘Haunted Mansion’ in the Midst of a Strike,2023-08-08 14:00:12
nyt://article/da9cec3d-5fa1-5ddd-bec0-aa4c214d490f,Nigeria’s Players Have Enlisted Help to Ensure They Get Paid,2023-08-08 14:00:33
nyt://article/01c4dcb3-26c0-5265-836e-7e71e6c2b518,U.K. Sanctions Target Foreign Suppliers for Russia’s Military,2023-08-08 14:12:25
nyt://article/a66cdcaa-a937-547c-91a0-2bf06be8aea7,Making Summer Special: The Week 7 Winner of Our Summer Reading Contest,2023-08-08 14:22:38
nyt://article/856c2358-a1bf-5178-b6de-b8f55fa0e657,"China’s Exports Fall Again, Imperiling Its Economic Recovery",2023-08-08 14:30:17
nyt://article/83d139bc-cc0f-5ca0-bd9b-20e2b24c187b,Kanye West Returns to the Stage With Travis Scott,2023-08-08 14:50:10
nyt://article/7e14ad8a-43cb-506d-87e5-495556527b41,Banks Fined $549 Million Over Use of WhatsApp and Other Messaging Apps,2023-08-08 14:53:22
nyt://article/61a8232c-6f4b-5cf9-a9e2-7456f6ecde0d,Five Weeknight Tomato Dishes,2023-08-08 15:00:03
nyt://article/0cb148d6-8280-5ece-b694-c65973407d7e,DeSantis Upends Campaign Leadership as Trump Looms and Urgency Grows,2023-08-08 15:01:25
nyt://article/920beccf-1151-5525-a4d1-19d57d7189e3,Can the Dream of the Four-Day Workweek Start With Restaurants?,2023-08-08 15:16:55
nyt://article/f41ecd5d-2f97-5975-a9b1-73acfb58875e,Federal Officials May Shut Down Overdose Prevention Centers in Manhattan,2023-08-08 15:28:48
nyt://article/ee6c3e1b-c493-5af4-b8fd-c6297ad404b1,Torrent of Water From Alaska Glacier Floods Juneau,2023-08-08 15:30:46
nyt://article/af935031-8d98-5fad-ad7c-06523c13daae,Trying to Process Your Q3? Journal About It.,2023-08-08 15:46:52
nyt://article/8c3898d0-6101-50dc-98fb-ab2f81b99a1f,Taiwan’s Chip Giant Will Build a Plant in Germany,2023-08-08 15:57:52
nyt://article/c08a296e-0640-52b1-8bda-02ef0dc962da,Transcript: Jane Coaston interviews Ben Domenech,2023-08-08 15:59:58
nyt://article/b39bafee-6419-58f2-8f83-2882585a4cdd,When the Scientific Method Is an Accessory to Murder,2023-08-08 16:01:45
nyt://article/0a6dd5a7-d126-52b6-9f37-bf33f8032986,Covid Didn’t Take a Summer Vacation,2023-08-08 16:14:39
nyt://article/80c7e57f-e767-53cc-9a3e-404454b55c37,A New Bazaar From José Andrés Opens in NoMad,2023-08-08 16:23:23
nyt://video/2791c816-0a57-586f-bd90-d9eae92943de,Deadly Thunderstorms Batter Eastern U.S.,2023-08-08 16:58:37
nyt://article/f457cbd3-c281-50d6-80c9-362a587b6402,"By 5-4 Vote, Supreme Court Revives Biden’s Regulation of ‘Ghost Guns’",2023-08-08 17:06:56
nyt://interactive/32d46090-1078-537b-a718-eb40a20ef88c,Life After the Lab,2023-08-08 17:08:06
nyt://article/2f45eaaf-6028-5759-ad7f-f7dafbc4df38,"The Long, Long Reign of ‘Big Brother’",2023-08-08 17:15:33
nyt://article/98fe14ef-d30b-5f11-939c-8ba3393fbc15,Why Are Groceries So Expensive?,2023-08-08 17:28:08
nyt://article/9d33f483-b93b-5a2b-a11b-103f55e6b1e3,More Kids Are Being Exposed to Toxic E-Cigarette Nicotine,2023-08-08 17:28:19
nyt://article/237bde35-2071-55aa-8d11-e17c80540e0d,Police Investigate Alabama Riverfront Brawl,2023-08-08 17:34:45
nyt://article/4ed55b8b-9005-5c4f-84d0-e9b532fe5db6,"45-Year Sentence for Otoniel, Who Ran a Colombian Drug Cartel",2023-08-08 17:38:59
nyt://article/adf839bb-6496-5b50-9471-2f174b79b573,Portland’s Struggle to Solve Its Homeless Crisis,2023-08-08 17:38:59
nyt://article/bbe5b69b-1623-56ed-b35f-0ebe7891eed7,"At Bard, a Festival Argues for the Music of Vaughan Williams",2023-08-08 17:47:39
nyt://article/681b2bd1-c457-5e6d-9ed0-ba73f993f182,8 New Songs You Should Hear Now,2023-08-08 18:00:03
nyt://article/2303f65d-b483-567a-877d-892a74d34e32,Divers Hoping to Solve Cold Cases Find 30 Cars in Florida Lake,2023-08-08 18:02:49
nyt://video/ba653550-31ec-5782-964f-6a495f042892,House Collapses Into River After Flooding in Alaska,2023-08-08 18:10:38
nyt://article/924bfb05-46a3-57b1-8d6f-dd0e8a1520b0,Can These Three Much-Loved Musicals Ever Be Truly Revived?,2023-08-08 18:14:52
nyt://article/41f45392-471d-5605-b059-67174543d928,Back in Black and White: It’s the Hives,2023-08-08 18:25:33
nyt://article/436016b3-2dc2-50a1-9f85-296a54102b2b,Cleanup Begins After Severe Storms Tear Through Eastern U.S.,2023-08-08 18:36:05
nyt://article/02108711-270b-532d-9c09-b1916aa074b5,‘Strange Planet’ Review: An Alien’s Guide to Being Human,2023-08-08 18:41:10
nyt://article/a144c614-06ac-50f0-be05-9413738106f2,Curbing Contrails: A Climate Solution in the Skies,2023-08-08 19:06:00
nyt://article/48d23a7d-965e-5e72-a949-68cffbc7c3f6,A Closer Look at Castor Oil,2023-08-08 19:14:45
nyt://article/c15f5cd7-959f-53fc-9832-776a94a25c86,Tiny Love Stories: ‘Take a Bath With Me’,2023-08-08 19:38:07
nyt://article/607e057f-88ed-59a0-a3da-576f4b737bb0,"Michael Boyd, 68, Who Invigorated the Royal Shakespeare Company, Dies",2023-08-08 19:46:12
nyt://article/16f55d0c-6865-5292-bcff-12911a41e895,Georgia Grand Jury Likely to Hear Trump Case Next Week,2023-08-08 19:49:26
nyt://interactive/24e3c04d-abe4-55e5-ab27-6c68ff7f3620,Ohio Issue 1 Election Results: ‘No’ Wins,2023-08-08 19:51:53
nyt://video/e8d8415d-f382-5b59-aa31-a3b330088f4f,2 bil. people lack access to safe water,2023-08-08 19:55:43
nyt://video/6d810694-d390-570b-8067-e192b87fbd0b,2 bil. people lack access to safe water,2023-08-08 19:56:59
nyt://video/8d1f634d-1e06-5ab5-a13b-45d2ca27d4bf,2 bil. people lack access to safe water,2023-08-08 19:57:09
nyt://video/45fbce9c-63b8-555b-affc-92e351b0b627,2 bil. people lack access to safe water,2023-08-08 19:57:50
nyt://video/467128fc-6586-5c6d-a4c0-85ef6c43eff7,2 bil. people lack access to safe water,2023-08-08 19:57:58
nyt://article/c3e6a496-56aa-5b20-b674-0ab81b3ef21e,The State of Pizza in the Pizza State,2023-08-08 20:00:02
nyt://video/bc60beb1-ec65-52ff-a004-f91e2a8ca6e5,‘Teenage Mutant Ninja Turtles: Mutant Mayhem’ | Anatomy of a Scene,2023-08-08 20:28:29
nyt://article/26badd00-f216-5dd6-8995-9403f8c6f726,Watch the Teenage Mutant Ninja Turtles’ First Fight in ‘Mutant Mayhem’,2023-08-08 20:29:17
nyt://article/2a2d2d44-da3a-58b7-a5a5-017dcf92a537,Wednesday Briefing: Few Jobs for Chinese Graduates,2023-08-08 20:50:09
nyt://article/2466fd06-5182-5c95-abf6-4e8202119061,"DJ Casper, Whose Hit Song ‘Cha-Cha Slide’ Made You Dance, Dies at 58",2023-08-08 20:53:34
nyt://article/6340781d-bf54-5c4d-be58-bf73d429e66b,"Martin Walser, 96, Dies; Among Postwar Germany’s Last Literary Titans",2023-08-08 21:20:03
nyt://article/32915dfb-d78e-56ff-82bb-0502687c799d,The Toughest ‘Barbie’ Critics Are Barbie Collectors,2023-08-08 21:36:06
nyt://article/58ae57cc-0492-51f4-ac18-8e56d229c49e,"Amazon Countries, Led by Brazil, Sign a Rainforest Pact",2023-08-08 21:37:59
nyt://article/ce82c86b-e6dc-526b-af7b-9897c63c21b5,Georgia’s Trump case looms,2023-08-08 21:51:26
nyt://article/365b1592-bfc5-5521-8784-810a51744097,Soldier Who Called Out Torture in Iraq Is Laid to Rest at Arlington,2023-08-08 22:11:36
nyt://article/30187da2-0038-50dd-a0c5-6f5eace0f4aa,Tory Lanez Is Sentenced to 10 Years for Shooting Megan Thee Stallion,2023-08-08 22:24:45
nyt://article/fc9e545a-9b08-544d-8a30-3f4b9944315a,Former N.Y.P.D. Commissioner Bernard Kerik Interviewed by Jan. 6 Prosecutors,2023-08-08 22:46:17
nyt://article/1bbbe7ba-eeef-5da8-bba7-2c23634b67b1,The ‘Never-Again Trumper’ Sham,2023-08-08 23:00:08
nyt://article/a6335abd-423d-5da0-b0ab-42cabb587d95,A Missile Strikes the Heart of a Ukrainian City — and Then Another,2023-08-08 23:00:13
nyt://article/9ba68cba-6a3c-540c-9eb6-e1c3b50c7ba6,"Hush Little Baby, Don’t Say a Word — I Think a Crocodile Heard",2023-08-08 23:01:08
nyt://interactive/7ed96980-2779-5633-a1d4-d3ba48e683ec,Mississippi Primary Election Results,2023-08-08 23:16:26
nyt://article/3eb35f4b-fd0a-5b9c-b9e2-2246eeef3c2c,WeWork Cites ‘Substantial Doubt’ That It Can Stay in Business,2023-08-08 23:16:39
nyt://article/0d30cccf-a395-5b90-8968-1ff9a4fa2171,ESPN Enters Sports Gambling in $2 Billion Deal With Casino Company,2023-08-08 23:35:48
nyt://article/fb5953d5-4c77-5f4e-9155-c46c0ed4a825,"With National Monument Designation, Biden Tries to Balance Electoral Realities",2023-08-08 23:37:56
nyt://article/1d7acdc6-d205-580e-8b65-6ca3f8f3cd4f,Guggenheim Museum Staff Ratifies Union Contract,2023-08-08 23:39:24
nyt://article/021e1772-dc61-5977-9ec6-c07cde8e42c8,Twist in Dancer’s Killing as Key Detail About Suspect Is Corrected,2023-08-09 00:25:56
nyt://article/27d0a4ef-a576-51f2-82cc-77be8e207c1e,‘Ghost Guns’: What They Are and Why There’s a Fight Over Them,2023-08-09 00:47:13
nyt://article/8bfe508e-ca3c-56d2-9801-d8a0c5595de7,Ohio Voters Reject Constitutional Change Intended to Thwart Abortion Amendment,2023-08-09 01:02:50
nyt://article/6301dfcf-9199-5152-9eab-b8a53484056c,Previously Secret Memo Laid Out Strategy for Trump to Overturn Biden’s Win,2023-08-09 01:16:55
nyt://article/723941bf-e9a0-5f98-8a3f-3ed9a44bdd9d,Trump Tells Supporters His Criminal Indictments Are About ‘You’,2023-08-09 01:18:09
nyt://article/4a526115-321b-5081-a07c-9ad7fe15c1d8,"Biden to Restrict Investments in China, Citing National Security Threats",2023-08-09 01:38:06
nyt://article/2a0e910a-30ba-5656-b3f9-3890fc7372c8,Distinctive Flair,2023-08-09 02:00:08
nyt://article/bae26d02-1a9c-5388-b35c-361374237ccf,"Corrections: Aug. 9, 2023",2023-08-09 02:16:56
nyt://article/6adcee92-3354-5d31-827c-96fe8033a8ad,Quotation of the Day: Reinvesting in the Business of ‘a Special Player’,2023-08-09 02:17:37
nyt://article/bf33a2c8-acb7-5ede-b76d-cc356ae13870,Texas Woman Convicted in Toddler’s 2003 Death Is Exonerated,2023-08-09 02:58:06
nyt://article/fb1d33db-bf9b-5fa0-88d9-9d4c57dfd775,Wednesday Briefing,2023-08-09 04:01:39
nyt://article/51ecb579-1516-5848-b673-ecf99a9e6d48,The Concorde Is Taking a Slow Boat to Brooklyn,2023-08-09 04:07:05
nyt://article/9d081bc4-090a-579c-b918-ece689b9ccc0,Word of the Day: soiree,2023-08-09 06:00:03
nyt://article/670d8483-ff89-5c8a-a3ec-d3fd9d5f2190,Spelling Bee Forum,2023-08-09 07:00:15
nyt://article/1d5b4195-2a6d-5205-825f-1efa7514c074,Confusion in Hollywood as Some Productions Are Allowed to Continue,2023-08-09 07:00:16
nyt://article/379fcf0d-fe87-51ac-a6d7-f4e115236c9d,Union Square Melee Shows an Influencer’s Power Unleashed in Real Life,2023-08-09 07:00:16
nyt://article/48b8e62a-1b59-52ff-b7c3-ea30773ec903,How 4 Countries Are Preparing to Bring Stolen Treasures Home,2023-08-09 07:00:17
nyt://article/9aaf0510-0875-55d5-9495-054621ff96c2,"3 Deaths, and a Host of Questions, After a Family Lunch in Australia",2023-08-09 07:34:56
nyt://article/6c87894e-3fa2-5868-8344-6521405c49be,Maui Town Is Devastated by Deadliest Wildfire to Strike Hawaii,2023-08-09 08:02:08
nyt://article/bbc4f8a9-32d2-59cb-92c6-1873f2e1d60e,"Can Frozen Peas, Long Taken for Granted, Find New Appeal in the U.K.?",2023-08-09 08:48:50
nyt://interactive/f3668cbd-c5c8-5bf3-81f0-2a4b8a576680,The Future of Rap Is Female,2023-08-09 09:00:02
nyt://article/92daee91-57ba-5f97-a16b-a68bfa726d39,Travel Insurance: What It Covers and When to Buy It,2023-08-09 09:00:19
nyt://article/85657e9c-7dfa-564d-9ac0-eb98bdf7caa3,Ohio Vote Shows Abortion’s Potency to Reshape Elections,2023-08-09 09:00:20
