_id,headline,pub_date
nyt://article/75ab98e2-64d4-5122-ac4a-b1624da3f75f,Quotation of the Day: When Did Everything Turn Into a ‘Journey’?,2024-05-16
nyt://article/b489d72a-3750-5827-8041-3caa430e5d33,"At Last, Detroit Sees Population Grow, New Estimates Show",2024-05-16
nyt://article/22bbddea-81a2-5966-8cbf-6ac92d2561d2,Thursday Briefing,2024-05-16
nyt://video/ec1361f6-3467-588e-b2bb-97b9e23fec03,Xi Welcomes Putin to China,2024-05-16
nyt://article/b18c13cb-0a4e-5133-a0aa-82637666284c,Russia Has Opened Up a New Front. What Comes Next?,2024-05-16
nyt://article/01bf40b2-2c5c-593c-8e8d-76770cb7fa8a,"R.F.K. Jr. Draws Another $8 Million From His Running Mate, Nicole Shanahan",2024-05-16
nyt://article/23f7b455-eb0f-5116-a64c-f4f4b9841c42,Truck Driver Is Killed in Episode at TSMC’s Arizona Semiconductor Plant,2024-05-16
nyt://article/c979f584-825c-5236-b077-34f164e6986a,"Corrections: May 16, 2024",2024-05-16
nyt://article/fa384d42-fe1d-5f48-a50b-a7b01ce3806f,Late Night Looks Forward to the Trump-Biden Debates,2024-05-16
nyt://article/9f7d3368-3608-56ee-8b95-349f91166a51,Spelling Bee Forum,2024-05-16
nyt://article/cb018bae-55ed-5ef8-bfe5-e4a925b08057,"A Hospital’s Slow Death: As Beth Israel Shrinks, Patient Care Suffers",2024-05-16
nyt://article/270f21ff-389b-5c36-a5b5-88695b63588e,"Today’s Wordle Review No. 1,062",2024-05-16
nyt://article/9846dbc2-c9e0-5f97-965d-78bc62af20fd,Why Some New York City Residents Are Suing Over Congestion Pricing,2024-05-16
nyt://article/76e7ac5a-ffae-5c7e-9887-bb31af2601ae,The Connections Companion No. 340,2024-05-16
nyt://article/371ed43d-f3c5-5f36-be64-ed72d637d386,A Bittersweet Toast to Retirement,2024-05-16
nyt://article/bc8a01bd-afc4-5386-9b35-b31e078c9e4c,City Street,2024-05-16
nyt://article/53c77cb4-2927-519a-83b9-33294ffab8b9,Zelensky Visits Embattled North as Russia Presses Broad Assaults,2024-05-16
nyt://interactive/631925e7-b489-58ec-a260-3b48e1737c65,Read the document,2024-05-16
nyt://article/1dd2089d-911a-5f07-9e88-357488cf4979,"As Bird Flu Looms, the Lessons of Past Pandemics Take On New Urgency",2024-05-16
nyt://article/a8ebe4af-b9a2-51ab-940b-073922818947,Kara Walker’s Favorite Literary Villain Is Scarlett O’Hara,2024-05-16
nyt://article/ccf7eea7-75f7-5d82-ab20-8b54122ea1f9,"In the Corporate World, Woke Is the Rage but Greed Is Still King",2024-05-16
nyt://article/6959ddd0-f34d-596c-9310-596c862334af,They Think You Should Be Grateful,2024-05-16
nyt://article/2e69a6b9-6586-5a0e-9abd-4a7e73e2f49e,An Artist’s Collection of Eerie Spiritual Ephemera,2024-05-16
nyt://article/6ce7e190-a425-57a3-bf73-8f3ea35e00d1,"On the Belgian Coast, a Design Gallery Where You Can Spend the Night",2024-05-16
nyt://article/d1698162-f50f-5f33-b213-1ee0adce378b,Mary Cassatt’s Women Didn’t Sit Pretty,2024-05-16
nyt://video/65a21c59-dd00-51ff-8f23-1d03ddf910bc,Our Reporter on the Radicalization of Israel,2024-05-16
nyt://article/2f33481d-c0c3-5b55-83a9-6eb6eb8eca5a,How Things Went Wrong for the New York-Dublin ‘Portal’,2024-05-16
nyt://article/80897b72-d6be-5cce-a77a-1f5d2c8a3900,She Had Been Coughing for Two Years. The Cause Was a Surprise.,2024-05-16
nyt://article/322b6b4a-4392-541b-91a6-a214ca744e96,"‘Babes’ Review: Adulting, With Babies",2024-05-16
nyt://article/0a26e17f-76bd-523e-977d-821d72c4a987,I Was Shot in Vermont. What if It Had Been in the West Bank?,2024-05-16
nyt://article/375ec347-d254-5285-9cc8-d5a36d9af75d,"‘Back to Black’ Review: No, No, No",2024-05-16
nyt://article/80bb44c1-b7f6-5696-86f8-85b641231f4c,Does Your Dog Really Belong in This Restaurant?,2024-05-16
nyt://video/01247a17-db82-5f36-ba3b-d5e3981f7c7c,How to Decorate a Goth Cake,2024-05-16
nyt://article/ac219c12-e505-5c28-8954-4d3de7b58e1c,Love Dessert but Hate Cuteness? Goth Cakes May Be for You.,2024-05-16
nyt://article/8cdf82c3-00b0-57fa-a2d6-79ab8121e550,Homes for Sale in Manhattan and Brooklyn,2024-05-16
nyt://article/13dbee1e-d0f4-5ec2-847d-139207c8b967,Homes for Sale in New York and Connecticut,2024-05-16
nyt://article/0caa371e-15e1-5faa-b0ff-de4bdcbd63b9,Which Cities Are Converting the Most Commercial Spaces Into Apartments?,2024-05-16
nyt://article/a1efe12d-ab13-5758-beb5-322c19698a17,How the Language of TV is Influencing How We See Ourselves,2024-05-16
nyt://article/c45f6a51-1b0c-50a8-84c8-d73422f021f9,"Help! Our Cruise Operator Went Bankrupt and We Are Out $17,905.",2024-05-16
nyt://article/2d8ff105-f0b6-5f02-a55e-f877aa55c521,The Unpunished: How Extremists Took Over Israel,2024-05-16
nyt://article/c5500d26-d950-5c9f-86c3-449cc5bea254,​Takeaways From the Times Investigation Into ‘The Unpunished’,2024-05-16
nyt://article/1af10c4e-feae-5ecb-87e8-ff91ee42a65f,Jenny Holzer Shines New Light in Dark Places,2024-05-16
nyt://video/563bdbc1-1105-5dbb-88d5-f546f0c1af13,How Trump’s Management Style Could Work Against Him in Court,2024-05-16
nyt://article/e421396f-4313-569c-a59b-ca361b44f696,Everyone Not Named Trump or Biden Who Might Make a Difference in Trump vs. Biden,2024-05-16
nyt://article/98283540-5627-55e3-b294-4e38f4108404,How ‘Young Sheldon’ Successfully Rode the Turmoil in TV,2024-05-16
nyt://article/882b4cc7-33e1-580e-a170-0d9869f91aca,U.A.W. Effort to Organize Mercedes Workers in Alabama Has High Stakes,2024-05-16
nyt://interactive/be2a4363-538a-50d2-87a9-f2b17887876b,One Area Where Biden Is Leading Trump: His Number of Donors,2024-05-16
nyt://article/d65fc72b-cbad-5689-9096-5b91aeb45b35,A Former Prosecutor on the ‘Incredibly Strong Case’ Against Trump,2024-05-16
nyt://article/403bbe1d-ab2e-5821-8344-0882f0045b4f,‘X-Men ’97’ Revisits the Franchise’s Roots and Finds Them More Timely Than Ever,2024-05-16
nyt://article/9b1e36d1-8fb0-5682-bab1-d8cbb8c7f29e,Democrats Aim for a Breakthrough for Black Women in the Senate,2024-05-16
nyt://article/7ccbc11b-5c0f-57bb-94a6-3cae6807d145,"After Making Altars to Her Icons, an Artist Builds Her Own Legacy",2024-05-16
nyt://article/96bed868-e8ef-5881-9598-873cf22e043a,The Hard Road to ‘Furiosa’ Was Filled With Detours,2024-05-16
nyt://article/4d6d77b9-d4cb-5a60-8b55-522d8e7a82f6,"The Nerve of Madonna to Pull It Off, Again",2024-05-16
nyt://article/8297fb37-816a-5577-b58b-bf4d7ffffcde,"With Ukraine Funded, New Fight Emerges in Congress Over Pentagon Spending",2024-05-16
nyt://article/7223ccef-1f01-533e-b738-3e91bb518125,Yves Klein’s Leap Into the Blue (With Living Paintbrushes),2024-05-16
nyt://interactive/2c3a94e2-be98-5b8b-9b09-da7fe4414761,36 Hours on Minorca,2024-05-16
nyt://article/453b6069-ece9-5f69-b055-2e406e456cd5,Kristi Got Her Gun,2024-05-16
nyt://interactive/2ddcdef2-0e88-5afd-9b4d-179f8b6261ef,"A New Yorker Took Her $400,000 Budget Up to the Hudson Valley. Here’s What She Found.",2024-05-16
nyt://article/46e98878-20b0-57db-8002-c931df9cae59,Biden Asserts Executive Privilege Over Recording of Special Counsel Interview,2024-05-16
nyt://article/654332ab-fc2d-5240-a55f-207673a86143,Who’s Afraid of Double Denim?,2024-05-16
nyt://article/55479ac4-dcad-564c-9fb2-b0775a9ac55d,"With Debate Deal, Trump and Biden Sideline a Storied Campaign Institution",2024-05-16
nyt://article/b825d053-36a4-5adc-bb8c-cb05be3c01dc,U.S. Military Installs Temporary Pier in Gaza for Humanitarian Aid,2024-05-16
nyt://article/810b648e-0a91-58c0-951e-c429edc484aa,U.N. Court Hears Arguments From South Africa on Israel’s Push Into Rafah,2024-05-16
nyt://article/55591bcc-42c9-53b5-bc0b-7567e8c20648,"In Talks With Putin, Xi Hails ‘Powerful Driving Force’ of Cooperation",2024-05-16
nyt://article/28601b12-7eff-53ad-bbec-3b0952dfddfe,The Make-or-Break Testimony of Michael Cohen,2024-05-16
nyt://article/aae558cf-183b-500f-a960-9da74cec52ed,E.U. Investigates Meta Over Addictive Social Media Effects on Children,2024-05-16
nyt://article/7f7290ef-6ebb-5c96-b932-723072c563bf,"A European Leader Is Shot, and an Early Biden-Trump Debate",2024-05-16
nyt://article/8d8a7e96-d07c-5a73-9c70-aa3019a7e88c,Roger Corman Lives!,2024-05-16
nyt://article/19e610c5-58ea-5308-92a0-64e13874e2bd,What to Know About the Shooting of Slovakia’s Prime Minister,2024-05-16
nyt://article/564d635b-3568-5917-a99b-8859fb60634a,How Israeli Extremists Won,2024-05-16
nyt://article/e4e6eb71-44a6-5e48-b155-da0f69549076,Recreating Amy Winehouse’s Look Onscreen,2024-05-16
nyt://article/832f73c7-0622-519c-888c-2e53862e4c03,‘Coma’ Review: A Labyrinthine Lockdown Movie,2024-05-16
nyt://article/12553dc0-e8ae-5a69-968c-86d7e28659d1,"‘IF’ Review: Invisible Friends, but Real Celebrity Cameos",2024-05-16
nyt://article/75cd3fb9-c1ec-56b7-ac14-83abe66e3ca2,"Seeking Access to Congo’s Metals, White House Aims to Ease Sanctions",2024-05-16
nyt://article/cfbadd34-96c7-501b-b6c0-f870d5371b34,‘In Our Day’ Review: Meditations on the Spice of Life,2024-05-16
nyt://article/b4866ba3-94d8-5023-82ce-7ed908180f47,‘Film Geek’ Review: A Cinephile’s Guide to New York,2024-05-16
nyt://article/d4bd6891-def5-599d-90ec-52820eb4a4f9,"Walmart Opens Year With Strong Sales, Aided by ‘Upper-Income’ Shoppers",2024-05-16
nyt://article/74e1b6b3-c8eb-53b3-b9f1-94449880b47f,"Man Linked to ‘I Raped You’ Message Is Detained in France, Authorities Say",2024-05-16
nyt://article/5c7f83e7-1f64-52af-a0c1-38580ee7c1df,Markets Keep Rising Despite Inflation Concerns,2024-05-16
nyt://article/df3e0166-8c2f-51ff-b670-55c2ac735712,Word of the Day: demarcation,2024-05-16
nyt://article/0cf2179e-9a0e-566e-9b7e-509d27c73762,What Is Your Relationship With Fast Food?,2024-05-16
nyt://article/19debf00-57fb-541e-ab98-825cbab1b653,Israeli Military Says Tank Fire Killed 5 of Its Own Soldiers,2024-05-16
nyt://article/367f8cf0-3065-5069-b6e0-098e99a72493,Wayfarers Chapel Is Coming Down,2024-05-16
nyt://article/605efcb3-0ca0-5059-858e-0e3ceabf38f1,Chantal Joffe Paints Moments of Motherhood and Grief,2024-05-16
nyt://interactive/47afe654-7da3-5596-9a0e-c9b0693ba839,"Transcript of Trump Manhattan Trial, May 14, 2024",2024-05-16
nyt://article/b27d8d10-375a-5103-8234-850daf3f52fe,Serbia Approves Contract With Jared Kushner for Hotel Complex,2024-05-16
nyt://article/38a9a126-ecb1-50c6-8d40-a9eb8e4c4a76,Columbia Faculty Group Passes No-Confidence Resolution Against President,2024-05-16
nyt://article/be611b12-62a1-5a27-9a6c-9f3fcc812b92,The Itsy Bitsy Spider Inspired a Microphone,2024-05-16
nyt://article/93452464-f0cb-5198-9cdd-4cac7b619489,Dancing Past the Venus de Milo,2024-05-16
nyt://article/c70e54df-f6b2-5fae-b1ba-cc9c1b9c41e9,Calls to Pause Slovakia’s E.U. Election Campaigning Raise Questions,2024-05-16
nyt://article/5a7b122c-08ec-5527-a765-af832f13c917,Supreme Court Rejects Challenge to Consumer Watchdog’s Funding,2024-05-16
nyt://article/8cfb404e-4277-5a43-9f25-1463b977d045,The Pill Makes Some Women Miserable. But Are They Really Quitting It en Masse?,2024-05-16
nyt://article/80fa52b5-ef63-5e69-bf02-93e2339153e3,"Portishead’s Beth Gibbons Returns Solo, Doleful Yet Determined",2024-05-16
nyt://article/c9eff919-c9ef-514a-9593-e5407401c9dd,How to Care for Yourself as a Caregiver,2024-05-16
nyt://article/ed8a9b32-56ff-5926-a52c-9dcee38e737c,‘Melissa Clark Could Make a Phone Book Delicious’,2024-05-16
nyt://article/dd5c99ea-bb2c-5eda-a8a6-6fcb70995a0f,Senator Menendez’s Wife Is Being Treated for Breast Cancer,2024-05-16
nyt://article/cab46ca0-f20f-5dc0-9472-45e247956cd9,"Line Outside Trump Trial Is Packed, as Seats in Court Become Hot Commodity",2024-05-16
nyt://article/7f41a81e-d5ee-5415-a785-d0906f58b6ea,N.F.L. Player Draws Rebukes (and Trolling) for Graduation Speech,2024-05-16
nyt://article/9105f356-1e59-5b14-8beb-e29f07ae9712,Civilian Prosecutors Rejected Evidence in 9/11 Case That Military Calls Crucial,2024-05-16
nyt://article/9d345f49-9853-536f-8e73-84693c79853d,Review: Lise Davidsen Achieves Strauss’s Ideal in ‘Salome’,2024-05-16
nyt://article/d52c8238-0112-5c63-b46c-805caca1c0e6,Venezuela’s 2024 Presidential Vote: What to Know,2024-05-16
nyt://article/6d3b0b58-0ecc-5483-9e40-79fa690417bf,Satellite Images Show Widening Destruction Amid Israeli Push Toward Central Rafah,2024-05-16
nyt://article/3a607c52-9e93-5b83-a924-ff58f06473a6,‘Terraces’ Review: A Stunning Tragedy Revisits the Paris Terror Attacks,2024-05-16
nyt://article/69bf63f2-57ba-5987-a01c-5e81f9362449,‘The Strangers: Chapter 1’ Review: Crowded House,2024-05-16
nyt://article/82b784d4-f3e2-5f3b-8a3d-7e4870a876f2,Here’s What Makes WordleBot Tick,2024-05-16
nyt://article/2b486b25-0ce1-58eb-a94d-5c35d3b8a9ab,"Justices Speak, and Are Greeted With Dissent",2024-05-16
nyt://article/26fd910c-0c6b-5001-9abf-56951c2776c7,"Wild World of Sports: When Raccoons, Cats and Iguanas Upstage the Action",2024-05-16
nyt://article/a15cc770-25f8-5c41-93ab-01f947a2443e,When Donald Trump Met Hannibal Lecter,2024-05-16
nyt://article/63cd12a4-2bc0-5ec9-a0b7-2819c116c54f,"Hogan Backs Codifying Roe, Tacking Left on Abortion Ahead of a Tough Race",2024-05-16
nyt://article/75b9f60f-cdaa-595f-8450-370b0fe84d08,What Do You Do When A.I. Takes Your Voice?,2024-05-16
nyt://article/de25af51-ccef-5b5d-b02e-19f98f8b7c75,Gov. Gavin Newsom Accuses Trump of ‘Open Corruption’ at Climate Meeting,2024-05-16
nyt://article/fc2692c7-8301-529d-a22b-a92844929a21,"Overlooked No More: Bill Hosokawa, Journalist Who Chronicled Japanese American History",2024-05-16
nyt://article/22505ecd-610c-52f0-8c35-e83f4b3f8caf,"Despite War, Ukrainian Wines Are Finding a Global Audience",2024-05-16
nyt://article/89b65b97-832b-558b-8570-7a7e49fc919b,What Is Your Favorite Sports Video Game? We Want to Know.,2024-05-16
nyt://article/cb461697-fb78-5070-bd3a-c4ef9cab3f55,Chickpea Anxiety,2024-05-16
nyt://article/a760b1d7-74c9-58f4-8b38-e1d6544c2044,C.D.C. Warns of a Resurgence of Mpox,2024-05-16
nyt://article/1380d61a-233a-5690-bb52-c9ae9b3586b8,"Republicans Flock to Trump’s Trial, Risking Control of the House Floor",2024-05-16
nyt://article/25942ab2-0ec2-586e-82c7-836bfe051e8c,"As Russia Advances, NATO Considers Sending Trainers Into Ukraine",2024-05-16
nyt://article/40f40295-0f71-5d24-9295-0bc52a43f384,How Media Outlets Are Covering Michael Cohen’s Testimony,2024-05-16
nyt://article/813cf173-c478-5704-bdc3-0f0a3f93eb66,"35 Years Later, the Remains Known as ‘Chimney Doe’ Have a Name and a Face",2024-05-16
nyt://article/abcbc521-21e6-5cd3-bfa0-303f46b64094,Managing Your Debt,2024-05-16
nyt://article/63d1ac95-7527-509a-a542-2613829c383e,Scientists Calculated the Energy Needed to Carry a Baby. Shocker: It’s a Lot.,2024-05-16
nyt://article/624ab9d8-b85d-5c82-9888-8d97d69cbccd,Protesters Clash With Police as U.C. Irvine Encampment Is Cleared,2024-05-16
nyt://article/6a776799-d172-5d4b-848b-e797bbb855b7,"In South Texas, Henry Cuellar’s Case Stirs an Old Feeling: Distrust",2024-05-16
nyt://article/90c8ccad-96b2-5dd0-9a2d-82ee09247eee,The U.S. Is Easing Marijuana Restrictions. Here’s How It Works.,2024-05-16
nyt://article/e4abfd78-8a07-5252-9d25-70c523547dae,"Hochul Meets the Pope, and Reflects on Her Father and Irish Catholicism",2024-05-16
nyt://article/26cfa68a-1e23-5f7f-9ba8-e1cb56251154,Russia Expels British Diplomat After U.K. Booted His Counterpart,2024-05-16
nyt://article/97f1bdb7-9d34-5d17-a79f-15c358da4334,The View Within Israel Turns Bleak,2024-05-16
nyt://article/4d2dee4e-f2aa-5dd9-9df0-70f8ec064d47,What Students Are Saying About Making School Lunch Healthier,2024-05-16
nyt://article/97551978-43e3-56cd-b5ce-9abfd3b4cc32,Cohen Holds His Temper in Check During Hours of Cross-Examination,2024-05-16
nyt://article/3c169138-ffd1-56f5-b823-5e7b130e5757,Lets Chill Out About Apostrophes,2024-05-16
nyt://article/9d2fb890-56a3-5af1-9bd8-abeaf02358e5,The Cost of Competing With China,2024-05-16
nyt://article/fdb7b5da-41fa-5d1b-86da-4c398a0b6f31,Teen Who Died After Spicy ‘One Chip Challenge’ Had Enlarged Heart,2024-05-16
nyt://article/be8591fb-0fef-569c-b280-e19cf7ab5a43,‘Past Lies’ on Hulu Is a Swirly Spanish Mystery,2024-05-16
nyt://article/241d024c-9c90-53bf-a4b8-3d3d2b0805cc,"Snow Lifts Great Salt Lake From Record Lows, but Dangers Persist",2024-05-16
nyt://article/14e6f16e-23aa-5c1a-a252-23ea045d1795,Francis Ford Coppola’s ‘Megalopolis’: What to Know,2024-05-16
nyt://article/0a65ddc8-e28b-58c3-83b9-9c673150f8d4,What to Know About CNN’s Presidential Debate,2024-05-16
nyt://article/b7ad3d09-4de0-5ca4-b910-130f4a8d39c0,Michael Cohen and Todd Blanche Clash Over 2016 Call to Trump’s Bodyguard,2024-05-16
nyt://article/59de4a88-f0a4-58ca-a353-8a773c3ae310,Pizza Boxes Finally Get Their Own Recycling Bin,2024-05-16
nyt://article/f7a7d94b-14ca-5810-a44e-fb97ed8602af,"After Outcry, Concertgebouw Will Allow Jerusalem Quartet to Perform",2024-05-16
nyt://article/ed712eff-bbcf-5831-abc9-2a7708a84a76,"Charles Gaines, by the Numbers",2024-05-16
nyt://article/2a54c3d1-ca58-5e0d-8d34-23881faf690c,Heat Stress Is Hitting Caribbean Reefs Earlier Than Ever This Year,2024-05-16
nyt://article/10be9d17-4562-553c-86b9-e62b06f5e977,Trump’s Lawyer and Cohen Match Wits in Crucial Cross-Examination,2024-05-16
nyt://article/542bd963-d3b3-5e7b-8097-db082605f363,Three Men Charged in Wildfire at Isle Royale National Park in Michigan,2024-05-16
nyt://article/8a1bb9f0-64aa-59b8-bb8e-5db54970062f,6 New Books We Recommend This Week,2024-05-16
nyt://article/c40b844d-b41a-5cc2-9344-fc72f3565279,Trump Says He Has ‘No Problem’ Including R.F.K. Jr. in Debates,2024-05-16
nyt://article/f2d8ff84-c6f0-5c69-8218-e26ee187b7c3,Texas Governor Pardons Man in Fatal Shooting of Protester in 2020,2024-05-16
nyt://article/a64534d0-70e7-59e5-8ad0-8bc6f8271678,And the Defense Calls … the Pizza Guy,2024-05-16
nyt://interactive/4e07311a-db72-571c-bac2-92bdfa1cfceb,Read the Texas Governor’s Pardon,2024-05-16
nyt://article/267ed7bd-ffe0-5f76-ac33-2b7a1c428dd2,Slovakia’s Politics Were Toxic Long Before Its Prime Minister Was Shot,2024-05-16
nyt://article/a3d2cf63-86c7-5997-aae0-c2c7a0ce7da5,"Saintly, Seductive or Sadistic? Why We Can’t Make Up Our Minds About Nuns.",2024-05-16
nyt://article/c2a1fe2b-e631-5b50-8b9d-8f52a119024b,"Harvard Ignored Antisemitism Advisory Group’s Recommendations, House Committee Says",2024-05-16
nyt://article/3d76b31a-404f-5d3e-8e6b-3913b17eca0c,Friday Briefing: NATO Considers Sending Trainers to Ukraine,2024-05-16
nyt://article/ae48ae22-e16b-5e0c-a0b9-8b036a7be401,F.D.A. Approves Drug for Persistently Deadly Form of Lung Cancer,2024-05-16
nyt://article/fea72235-68d9-5424-aa83-2dd5c7cfd351,She Almost Went on a Mormon Mission. She Became a Journalist Instead.,2024-05-16
nyt://article/8da9f04e-d2df-5d16-b305-a00d7de75c9b,"In Symbolic Vote, House Passes Bill to Force Biden to Reverse Israel Arms Pause",2024-05-16
nyt://article/0bd1230c-da66-5fa3-a379-6aec8af14b69,"Tense Exchanges, but Cohen Doesn’t Crack",2024-05-16
nyt://article/0c95252e-6b06-5076-8c29-e78999d44d64,Your New Favorite Hangover Foods,2024-05-16
nyt://article/ae360d5d-cf15-505f-a15a-9ba91ecf6f0d,The End Is Near: 5 Takeaways From Trump’s Criminal Trial,2024-05-16
nyt://article/067bcaaa-8aac-54cb-bb52-23a694948f35,"At Justice Alito’s House, a ‘Stop the Steal’ Symbol on Display",2024-05-16
nyt://article/74bec8f4-f7bb-50b3-a554-e9ea1ceb680f,Trump’s Lawyer Assailed Michael Cohen’s Credibility,2024-05-16
nyt://article/fbd3adbe-db75-5047-9d4d-dc66baca44e3,"Jasper White, Chef Who Lifted New England Cuisine, Dies at 69",2024-05-16
nyt://article/208d5cab-b4c7-5b95-973a-732b8f4c0ffc,How Biden and Trump Might Try to Win Their Debates,2024-05-16
nyt://article/eaffc2f1-98c8-518d-b192-29abadf29d66,"Samm-Art Williams, Playwright, Producer and Actor, Dies at 78",2024-05-16
nyt://article/d0ef9729-6629-5878-8086-d29f414a9a4f,Why a New Yorker Story on a Notorious Murder Case Is Blocked in Britain,2024-05-16
nyt://article/113e01fc-b850-5c1c-834b-9cd5fb4a673b,I Was a Republican Partisan. It Altered the Way I Saw the World.,2024-05-16
nyt://article/79af8f5a-b24a-5253-93dd-00d2302218e9,New Editing Layer Adds Angst Inside NPR,2024-05-16
nyt://article/1b1ee0cc-54c3-5570-847f-a960f1d4ff29,The Authoritarians Have the Momentum,2024-05-16
nyt://article/86b3b071-1064-541f-944d-50a6525d6360,Beware the Pettiness of the Powerful,2024-05-16
nyt://article/d69a7a83-ce70-5e79-b26a-13cb8f4ad3fd,Biden Marks Landmark Desegregation Anniversary as Black Support Slips,2024-05-16
nyt://article/5d19aea9-8443-52c2-b027-9df9aaac4b6a,What the Supreme Court Ruling Means for Other Consumer Bureau Actions,2024-05-16
nyt://article/8a629789-1685-5ec7-adcc-6b909cff0ce9,"Robert Dennard, IBM Inventor Whose Chip Changed Computing, Dies at 91",2024-05-16
nyt://article/35356a6a-efd4-5cb0-a6c6-db935c533a05,"M.T.A. Worker and Wife Participated in Jan. 6 Capitol Riot, U.S. Says",2024-05-16
nyt://article/e6723ebe-1500-5fe3-b8ab-e4dbe437bb9b,Menendez Jurors See the Gold Bars at the Heart of a Bribery Case,2024-05-16
nyt://article/c2b28c4d-28fa-5e19-bcee-edef3c6dfdce,"In Emotional Hearing, Maine Shooter’s Relatives Describe Efforts to Get Him Psychiatric Help",2024-05-16
nyt://article/9ce580e6-c823-56aa-b18c-4c09a13039c9,Israel Sending More Troops to Rafah Amid Warnings of Famine in Gaza,2024-05-16
nyt://article/30845d66-b7d5-58aa-af7b-9f4c91cf0721,Columbia Professors Host an Alternative Graduation for Students,2024-05-16
nyt://article/bd7aefa0-8161-5a3a-9d15-d0379a1cdabc,Arab League Calls for U.N. Peacekeepers in Gaza and the West Bank,2024-05-17
nyt://article/e06f6a83-10d9-5980-9927-8c0d78fac296,‘Megalopolis’ Premieres at Cannes: First Reaction,2024-05-17
nyt://article/d90af9eb-6f81-5e73-b782-c67281c5a1a5,"Taiwan, on China’s Doorstep, Is Dealing With TikTok Its Own Way",2024-05-17
nyt://video/1b585959-e94b-5f85-bae8-27fefd05ee7c,Trump’s Lawyer and Cohen Match Wits in Crucial Cross-Examination,2024-05-17
nyt://article/dfb40e33-5b57-562b-9bf4-91bacdc31ad9,Comes Out on Top,2024-05-17
nyt://article/095bc5aa-efd5-5478-be95-d87eeec03f67,David Trone Torched $60 Million of His Own Money. He’s Not the Only One.,2024-05-17
nyt://article/71ab07a8-f1bf-518c-9b78-0f0fa19950b7,"Storms Batter Houston, Leaving at Least 7 Dead",2024-05-17
nyt://article/b279c98f-31fa-5374-85c6-610816663c2b,At Least 12 Arrested at U.C. Berkeley After Police Order Protesters to Disperse,2024-05-17
nyt://article/cd107b51-c34c-5b5b-98ea-483e52d3a4c4,"After a Season of Protest, PEN America’s Literary Gala Goes Forward",2024-05-17
nyt://article/2ae7a2e3-fdf1-590f-a5fe-42f583c21ea7,A Day to Remember for Two ‘Star Wars’ Fans (Lightsabers Included),2024-05-17
nyt://article/417500c9-6d2a-500c-8af6-6b88e05d6247,"On Her Second Chance to Swipe, She ‘Finally Got It Right’",2024-05-17
nyt://article/1cb287f3-554c-5e50-ae49-bf4f3fa0d187,He Brought Two Toothbrush Kits on Their First Date,2024-05-17
nyt://article/c812e523-f7ab-5497-ab80-aa549aab15f4,My Twisted Path to a Meaningful Life,2024-05-17
nyt://article/4f75ec98-88c9-57a1-9334-29196e412d28,"Corrections: May 17, 2024",2024-05-17
nyt://article/ac8d27c4-2174-54a5-95a3-4c936b168d4b,Quotation of the Day: The United Nations Inspector Becomes an Authoritarian Whisperer,2024-05-17
nyt://article/e2ab388f-6e3e-568d-9fa8-0e2884812753,The Kiwi Makes a Startling but Careful Comeback,2024-05-17
nyt://article/67d90da6-97ca-5e4a-b8a0-3020b5fc159c,Friday Briefing,2024-05-17
nyt://article/10876a61-36b3-55d9-a8bc-ef20a581510a,The Premier League’s Asterisk Season,2024-05-17
nyt://article/bf268904-1562-5497-bc5c-76d69f2bfd99,"Struggling on Front Lines, Ukraine Strikes Harder at Russian Energy",2024-05-17
nyt://article/3fb6c823-e6e4-53f6-bbd7-97c12d084459,Word of the Day: veranda,2024-05-17
nyt://article/0aaa1339-a814-5d19-91f5-6964a97ffb63,Seth Meyers Slams Republicans Supporting Trump at His Trial,2024-05-17
nyt://article/f4a02677-c565-5ee0-8c86-ebb0772c92ee,Spelling Bee Forum,2024-05-17
nyt://article/3d8e3fab-f4fa-54f1-97d6-ccba7f1f2727,"Today’s Wordle Review No. 1,063",2024-05-17
nyt://article/64bfe46b-2443-5cb5-8792-21fab982cd88,Does a Smash Hit Like ‘Lion King’ Deserve a $3 Million Tax Break?,2024-05-17
nyt://article/9f5b12e1-f034-5a61-b85f-5f07211ecb27,The Connections Companion No. 341,2024-05-17
nyt://article/0bb6e4ae-366d-5408-9287-9f20ff9d6ae3,"New York City Budget Would Produce Fewer Affordable Homes, Critics Say",2024-05-17
nyt://article/0d537f44-ab32-507d-89f6-242598c98ebd,Why Is N.Y.U. Forcing Protesters to Write Apology Letters?,2024-05-17
nyt://article/b4a1590d-6bc7-5cd1-bd5a-50c760f0ec60,"Up, Up and Away!",2024-05-17
nyt://article/50a334dd-6852-5571-af1a-1da508e41a93,China Says It Will Start Buying Apartments as Housing Slump Worsens,2024-05-17
nyt://article/d108fcbb-670e-589b-a95f-e421fb619157,Putin’s China Visit Highlights Military Ties That Worry the West,2024-05-17
nyt://video/75107b7a-1116-500c-8a4e-6f6e17da0edf,Unrest Continues in New Caledonia,2024-05-17
nyt://video/b169e884-d4b5-5450-9b00-2e897ebb614f,Americans Love to Shop Online. TikTok Is Making It a Live Sport.,2024-05-17
nyt://article/3b2671e5-aa2d-5927-aa75-20a59a452fb8,Minecraft Is an Infinite Sandbox That’s Being Beaten in Minutes,2024-05-17
nyt://article/bd78c977-1f7e-5fd5-a0ea-433844c4ee92,"Now One Fast Train From Tokyo: Culture, Crafts and Hot Springs",2024-05-17
nyt://article/1564bf5f-9ec4-5b9c-88a0-88e2a4b4275c,How Kite Surfing in Remote Colombia Changed a Boy. And a Village.,2024-05-17
nyt://article/e5e02751-8cd7-5a2d-b3df-2d58788800e9,How to Exercise for Lower Blood Pressure,2024-05-17
nyt://article/27afc260-63dd-5823-ba2d-8219d89fd2a1,Openwashing,2024-05-17
nyt://article/2ab0ac1e-3e6d-5a9a-a458-5ab4561880dd,He Bought a 1953 Trailer on Impulse. But What to Do With It?,2024-05-17
nyt://article/71e27366-f031-5d91-8784-65896d4e93e7,Ethereal Dresses Inspired by Spring Flowers,2024-05-17
nyt://article/03ad07b8-0873-56cb-8f58-ec1d9872addb,The 25 Essential Pasta Dishes to Eat in Italy,2024-05-17
nyt://article/a34ac8b7-c879-57f6-a1f6-a8b09d0ee166,Whose Folk Tale Is It Anyway?,2024-05-17
nyt://article/ab591255-7ae5-5093-be06-3c769d4627fc,A Forest Retreat in ‘Tokyo’s Backyard’,2024-05-17
