_id,headline,pub_date
nyt://article/f7264035-dbba-5966-a03e-0d5114d125ec,Developing World Sees Double Standard in West’s Actions in Gaza and Ukraine,2023-10-23 09:02:02
nyt://article/062b11ac-5a3b-5c88-ace1-a00999701929,"If Trump Trial Isn’t Broadcast Live, a Plea to Record It for Posterity",2023-10-23 09:02:05
nyt://article/29ba918c-5136-5ce4-af3b-0a94a75a45a9,Fight for Speaker Reveals Four Types of House Republicans,2023-10-23 09:02:07
nyt://article/5d4bd098-2a07-538c-b8ce-3a707418f0c1,Kill and Be Killed: Ukraine’s Bloody Battlefield Equation,2023-10-23 09:02:22
nyt://article/b12f1989-0693-59cf-b431-9c60d6c064a9,The People Who Broke the House,2023-10-23 09:02:23
nyt://article/054b186a-3970-5fa7-a06a-27939acd7a3f,‘The Headlines’ in the A.M. Will Return Soon,2023-10-23 10:00:02
nyt://article/c789da99-8095-5fef-9a2c-f6875f072dab,Editors’ Note: Gaza Hospital Coverage,2023-10-23 10:00:02
nyt://article/0bd0fb56-68ff-50cc-80dd-981ab5c0c58c,The Problem With a $2 Trillion Deficit,2023-10-23 10:00:06
nyt://article/ae22508b-ba12-5182-bc4f-57165d1d0f92,Chevron to Acquire Hess for $53 Billion in Latest Major Oil Deal,2023-10-23 10:17:43
nyt://article/264d1880-a87a-5dd1-ad0c-6cac6114bb63,A Delayed Invasion,2023-10-23 10:48:30
nyt://article/78133554-52e3-5688-a15c-87f243a634a1,Companies Are Caught in the Israel-Hamas War’s Crossfire,2023-10-23 11:46:40
nyt://article/8989ddd8-061c-5908-8960-2863e2d351b1,How to Win Your Next UNO Game,2023-10-23 13:00:02
nyt://article/b10ef91e-8720-5e8a-aa7c-724e7ecb3e15,California Boosts Minimum Wage for Health Care and Fast-Food Workers,2023-10-23 13:09:08
nyt://interactive/bb7607d4-6600-51ec-a84f-1704454e38ce,Do You Recognize These Passages From Classic Books?,2023-10-23 14:00:32
nyt://article/f387c527-e2a9-5401-b41e-ef80e47df959,Iranian Teenager Reported Brain Dead by State Media,2023-10-23 14:03:22
nyt://article/20e3c6f1-e9ae-5cbf-b9a9-66e85651df55,War Has Smashed Assumptions About Israeli-Palestinian Conflict,2023-10-23 14:09:50
nyt://interactive/18a01b3a-0296-59df-9f97-b52384ec2746,Tracking the Remnants of Otis,2023-10-23 14:15:47
nyt://interactive/847f4cd2-9a07-5385-a5f7-7ddeebbd43a9,"As Abortion Access Shrinks, Hospitals Fill in the Gaps",2023-10-23 14:17:47
nyt://article/5aa30bee-b371-5cbb-8554-b0ff3dc61f62,Nonunion Workers Are Playing a Big Role in the Autoworkers’ Strike,2023-10-23 14:27:34
nyt://article/c9bce5e2-da70-5a8a-8b1e-16e214277e0a,Women in Iceland Go on Strike Against Gender Inequality,2023-10-23 14:42:19
nyt://article/ac1b48a4-9744-581e-a285-2762ea1a86b2,Aleksei Navalny Forcibly Removed From Jail Cell After Protest,2023-10-23 14:51:25
nyt://article/a389ca74-8f4c-5ea9-887d-8e1af3954d4d,U.A.W. Expands Strike to a Ram Plant in Michigan,2023-10-23 14:52:15
nyt://article/3c6450f9-8f4a-5d6c-8982-69338737c148,Our Beloved Lemony Shrimp and Bean Stew,2023-10-23 15:00:03
nyt://article/62976a0b-b6e7-51ac-9f56-20f5dcb9ef84,The Doyenne of Classical Publicists Takes on a Final Client: Herself,2023-10-23 15:00:16
nyt://article/520cc900-61b0-589f-be79-b35145b9e70f,"Rapid Antarctic Melting Looks Certain, Even if Emissions Goals Are Met",2023-10-23 15:00:50
nyt://article/6b933596-2345-5c3d-b86f-30f7819bb805,The Stratospheric Rise of Lionel Messi’s Pink Jersey,2023-10-23 15:16:59
nyt://article/4b910e40-6059-504c-b77d-25a3b0a90e86,Lying All the Way to the Bank in ‘America Fantastica’,2023-10-23 15:25:22
nyt://article/69bc32a6-f6ac-5eb1-85d8-2d713879f3d6,Were the Fake Trump Signs a Prank? Or a Political Dirty Trick?,2023-10-23 15:43:26
nyt://article/fff9ce45-3a9a-5e55-b546-2132956dd12c,Flight of the Drones Lights Up Central Park,2023-10-23 15:50:30
nyt://article/7ef30fb1-0c9e-596e-bda2-207c189e9ed9,Turkey’s President Sends Sweden’s NATO Bid to Parliament for Ratification,2023-10-23 15:57:08
nyt://article/b637aa21-1c5e-5f33-b18e-f55ee989a60e,Review: The Great Emerson String Quartet Takes Its Final Bow,2023-10-23 15:57:08
nyt://article/5163fb43-7b8b-504c-9173-b7ff2d64835d,Thelma Golden Wins Gish Prize,2023-10-23 16:00:08
nyt://article/c5d4adf5-e1c9-5dfe-bbbc-cfa54b452e8b,"Review: Years Late, a Young Pianist Finally Gets to Carnegie",2023-10-23 16:13:21
nyt://article/f6e285a8-49fe-5518-abf4-dd5e5098086e,Face Search Engine PimEyes Blocks Searches of Children’s Faces,2023-10-23 16:52:24
nyt://article/5b616e32-52d1-563d-8dd1-20744d2ed426,How the Israel-Hamas War Imperils Action Against Global Warming,2023-10-23 16:54:30
nyt://article/56435d0d-7ae6-572a-93ee-27766fe6f5f0,Off-Duty Pilot Accused of Trying to Cut the Engines on an Alaska Airlines Flight,2023-10-23 17:03:30
nyt://article/a725ffd4-62fa-5e0c-9efb-0fcef62e3066,Chicago’s Newest Must-Have Fashion Accessory,2023-10-23 17:18:27
nyt://interactive/da9b8e65-25a2-5508-b081-f5a91376c0c2,Read the document,2023-10-23 17:21:54
nyt://article/634ac1db-c6ec-50eb-ae7c-3fd5d0ea6b73,"Federal Investigators Widen Tesla Inquiry, Company Says",2023-10-23 17:29:14
nyt://article/0a5cd15b-819e-576a-80e4-cf4692603e91,"War With Hamas Hits Israel’s Economy, Central Bank Says",2023-10-23 17:29:45
nyt://article/dadc1f4d-74e2-598a-aa1f-9e52a59e39eb,Love Letter: When Google Search Reveals Too Much,2023-10-23 17:42:14
nyt://article/ded0a947-6d6e-55b8-994c-984fc506e632,"In ‘Seafood Simple,’ Eric Ripert Includes Techniques and Not-So-Simple Recipes",2023-10-23 17:51:03
nyt://article/a1862849-8a84-5b2f-af5a-29b5d28f33ef,Taylor Swift’s ‘Cruel Summer’ Hits No. 1 After Four Years,2023-10-23 17:54:06
nyt://article/dd438217-09d3-5deb-a4c9-918b8002ee95,Leftist Upstart Threatens to Shake Up German Politics,2023-10-23 18:10:52
nyt://article/a255cd5d-4345-5f60-9d0b-2d3768b546f4,Gavin Newsom Wants to Export California’s Climate Laws to the World,2023-10-23 18:18:40
nyt://article/3e20b70d-cc48-50d8-ba7d-c1d830dbe988,Israel’s Moral and Political Dilemmas,2023-10-23 18:34:10
nyt://article/14665ee7-9481-5816-993c-58609c391c7e,Review: These Art-Historical Nudes Become Bodies in Time,2023-10-23 18:35:25
nyt://article/b0cb3bf4-49be-51bc-a375-afffbe28e6a7,"Who Is Jackson Mahomes, and Why Are Swifties Concerned?",2023-10-23 18:53:22
nyt://article/ac863176-d041-5e4a-b29e-075c4bc891dc,5 Takeaways From Argentina’s Election,2023-10-23 19:22:25
nyt://article/aa8781e0-4330-5d6b-9092-736bfa7a0c7e,Biden Administration Moves to Ban a Solvent Linked to Cancer,2023-10-23 19:44:24
nyt://article/6909ca1b-5f71-5924-b3b6-6c0b4a281075,"The Rock’s Wax Figure Will Get Redo, Museum Says",2023-10-23 20:03:15
nyt://article/a2723199-c8cb-5f00-ba25-344a08400b1e,‘I Have Your Back’: Doug Emhoff Draws on His Faith After Hamas Attack,2023-10-23 20:05:43
nyt://article/953c0513-63a3-5c4b-99f1-f7215c6750f6,Plea Hearing Set for 2024 in Indonesian Bombings Case,2023-10-23 20:09:10
nyt://article/fd8bcd12-f820-51f3-805d-0c761580b1d9,Israel Shares Raw Footage of the Oct. 7 Attacks,2023-10-23 20:10:07
nyt://article/abed4cd6-0156-5913-8f68-308c773af494,92NY Halts Literary Series After Pulling Author Critical of Israel,2023-10-23 20:17:45
nyt://article/f3628c9b-80f0-5753-bf50-96b82c98c300,Train Collision in Bangladesh Leaves at Least 17 Dead,2023-10-23 20:25:48
nyt://article/d46905b1-b222-5cda-9cde-8069d852ccc4,Trance Music Is Coming Back. Evian Christ Is Part of the Revival.,2023-10-23 20:26:42
nyt://article/c5996953-c133-5617-b3f9-9a2bbd87d7f9,"Natalie Zemon Davis, Historian of the Marginalized, Dies at 94",2023-10-23 20:30:53
nyt://article/349f54db-e0b9-54cd-978d-00e6469b6e70,‘5 Families’ and Factions Within Factions: Why the House G.O.P. Can’t Unite,2023-10-23 20:39:26
nyt://article/aae9319d-cadc-5902-ac7c-2239674ab5a4,"‘Persons of Interest’ Identified in Killing of Detroit Synagogue Leader, Police Say",2023-10-23 20:47:36
nyt://article/1158fd25-cb17-5678-91c3-29eabe19c445,Tuesday Briefing: Israel Intensifies Gaza Strikes,2023-10-23 20:48:25
nyt://article/deb47d47-d99a-58fd-a72b-59fce7513b76,A Push for Tech Hubs in Overlooked Places Picks 31 to Vie for Money,2023-10-23 20:50:08
nyt://article/66bac183-8350-5124-b45e-26de7c868dc9,"Mary Lou Retton Is Released From Hospital, Daughter Says",2023-10-23 20:59:20
nyt://article/cad8e9e6-6e42-52f0-9662-3c1f3a3b95f7,Menendez Pleads Not Guilty to Plotting to Be an Agent of Egypt,2023-10-23 21:11:20
nyt://article/071cac02-b8f9-5c33-9b58-11ea5a56e506,"No Longer Scotland’s Leader, Sturgeon Focuses on Learning to Drive",2023-10-23 21:41:10
nyt://video/451242e0-85a4-5711-8bbc-749055e5eb55,Israel Intensifies Airstrikes on Gaza,2023-10-23 21:48:15
nyt://article/c5bc3c5d-f4e6-5765-bd2e-8a481d7d7e17,Hamas Released Two More Hostages,2023-10-23 21:50:13
nyt://article/1a68701a-f9e4-5564-bce3-5e3992c2ff13,"Park Seo-Bo, Whose Quiet Paintings Trumpeted Korean Art, Dies at 91",2023-10-23 21:58:04
nyt://article/71b3af56-5cae-515c-88d5-0066df39fc1c,Death Toll in New Orleans ‘Super Fog’ Pileups Rises to Eight,2023-10-23 22:01:29
nyt://article/15f6e9ab-3fa4-56ff-aa98-3b24953ec250,Behind the Editors’ Note on Gaza Hospital Coverage,2023-10-23 22:10:03
nyt://article/dbd39dc3-d042-5f61-8238-5dae4fe95308,Writers Guild Faces Backlash for Not Condemning Hamas Attack,2023-10-23 22:57:14
nyt://article/2db6a3b8-d652-59c6-b9f4-3e6203848fbf,The Secret of America’s Economic Success,2023-10-23 23:00:07
nyt://article/2474e181-0722-51c6-b337-cb5496084a91,"With Their Soldiers Poised to Attack, Israelis Try to Decipher the Delay",2023-10-23 23:06:17
nyt://article/cd1d1b88-00e5-5ae7-adf1-24eee351e33a,"With War in Israel, the Cancel Culture Debate Comes Full Circle",2023-10-23 23:07:39
nyt://article/9016c821-ae7c-5619-a5e1-f39cdda2e922,"U.S. Raises Concerns About Israel’s Plan of Action in Gaza, Officials Say",2023-10-23 23:22:30
nyt://article/0a60be9a-98d8-5a93-bcfe-99be74a029fe,Israel Intensifies Strikes on Gaza as Its Allies Call for More Palestinian Aid,2023-10-23 23:24:57
nyt://article/7544c836-a5b4-58fb-a4d1-63ebaeae665c,All In on Iowa and a Speech on Race: Tim Scott Looks to Revive Struggling Campaign,2023-10-23 23:38:33
nyt://interactive/afc28388-829d-5146-a7b7-212aa553196f,How to Win the Restaurant Reservation Game,2023-10-24 00:21:10
nyt://article/142b6f37-cf66-549b-a2f7-ccfdc1a563d3,Light Spray,2023-10-24 02:00:09
nyt://article/cdd59786-682e-508b-882c-8ed417ed2856,13 Law Enforcement Officers Killed in Ambush in Mexico,2023-10-24 02:40:49
nyt://article/1cca6579-520c-534a-a15d-0f9731cb51e9,Quotation of the Day: Borrowers Start to Process High Rates Won’t Fall Soon,2023-10-24 03:43:50
nyt://article/9ef60979-b93b-556d-b975-1afc7c470158,Quotation of the Day: Assumptions on Israel and the Palestinians Are Smashed by War,2023-10-24 03:44:00
nyt://article/3548e341-e03f-5759-b239-51339467a0d5,"Corrections: Oct. 24, 2023",2023-10-24 03:44:20
nyt://article/d3071645-533b-5438-822b-1f0b0327c984,"Energy Agency Sees Peaks in Global Oil, Coal and Gas Demand by 2030",2023-10-24 04:01:10
nyt://article/445afea9-c0fd-57ac-b65a-bdfbfffef0a6,Jamaica Fears Brain Drain as Teachers Leave for U.S. Schools,2023-10-24 04:01:39
nyt://article/c41cf43e-f62d-5e9a-8c15-2610f409161b,What It’s Like to Be Young in Ukraine Now,2023-10-24 04:02:32
nyt://article/97f4e553-2d6b-5bb5-b3ed-0160b3c39254,Tuesday Briefing,2023-10-24 04:03:34
nyt://article/9fda22e8-6860-567d-9ba1-f8707e445ba7,Word of the Day: quirky,2023-10-24 06:00:02
nyt://article/1a36cbfc-6ab0-5d99-b835-7463b645b985,"‘Honest Mistake,’ Says U.S. Politician Arrested on Gun Charge in Hong Kong",2023-10-24 06:18:10
nyt://article/185a401d-f087-56cc-b38b-5a57bcc4b82e,Late Night Finds the House Speaker Pool Lacking in Diversity,2023-10-24 06:35:34
nyt://article/7277e8e4-35cc-5eb5-8a36-8848450d7d5b,"See You Later, Not-An-Alligator",2023-10-24 06:58:20
nyt://article/38cdbfc3-c84d-5c8d-ba68-f127f9336e16,Today’s Wordle Review,2023-10-24 07:00:03
nyt://article/e1aa1775-28d1-5f50-854b-effa06d53811,Spelling Bee Forum,2023-10-24 07:00:07
nyt://article/a9a46459-8bab-541c-b8a9-0e032ad49404,The Connections Companion,2023-10-24 07:00:08
nyt://article/42651fca-d77e-5761-a93c-9f43047b5298,"With Rent Out of Reach, a Back Seat Becomes a Bedroom",2023-10-24 07:00:16
nyt://article/514ce2f6-8ae6-539c-846f-8000436d9af5,"How Aid in Dying Became Medical, Not Moral",2023-10-24 07:00:18
nyt://article/5b3e6e08-7d3f-50e1-b176-060471505b7a,New Normal or No Normal? How Economists Got It Wrong for 3 Years.,2023-10-24 07:00:18
nyt://article/2a7185a8-94bb-570d-b24a-77c0c48f864c,Carving Pumpkins,2023-10-24 07:00:19
nyt://article/16e3ad22-4fec-5c6b-812d-41c03c98fd64,How to Enforce a Landmark Pollution Law? It’s Complicated.,2023-10-24 07:00:23
nyt://article/1fa9df11-f2bb-5c6a-8fca-45e5101ce367,Cohen Denounces Trump During Courtroom Face-Off,2023-10-24 07:00:24
nyt://video/f53e2016-7f7b-5e71-b88a-4033fe114c6c,Stabbed. Kicked. Spit On. Violence in American Hospitals Is Out of Control.,2023-10-24 08:50:07
nyt://article/4558b9d5-9d65-51f3-ae95-21b8c4bdaf18,A Book Critic as Wild for Food as He Is for Literature,2023-10-24 09:00:14
nyt://article/32b43aa6-aaf6-5edc-8c2f-746c2a1376aa,"A New, Feminist Retelling of ‘1984’",2023-10-24 09:00:26
nyt://article/34459524-a9ff-5c52-88b3-70c8303b09e0,"Under the Leather Jackets: Anxiety, Bravado and the Keys to TV Stardom",2023-10-24 09:00:26
nyt://article/75b5c159-5ade-5b27-bbfb-a542254faa65,"In ‘Organ Meats,’ Best Friends Cling to Each Other Like a Dog Pack",2023-10-24 09:00:29
nyt://article/0b80d825-5aaf-5f8f-ae95-5dc378790895,Why My Fall Made Me Feel So Ashamed,2023-10-24 09:00:33
nyt://article/d2739b6f-7bcc-5f47-8b37-5d9509712798,Unhappy Animals Languish in Overcrowded Shelters,2023-10-24 09:00:40
nyt://slideshow/26eb2745-50d6-593c-b9cf-f1237f1bd3eb,At Home With Roz Chast,2023-10-24 09:00:45
nyt://article/7691be52-c2b9-5f5c-8c5e-0c01d334bf5b,Stabbed. Kicked. Spit On. Violence in American Hospitals Is Out of Control.,2023-10-24 09:00:46
nyt://article/c3765df8-adc6-5ea2-8b45-f6fb50104ce1,Is Pumpkin Good for You?,2023-10-24 09:00:46
nyt://article/7e9afc85-9353-5298-9b17-e11bff154dd2,Is Roz Chast ‘Terrible at Decorating’? You Decide.,2023-10-24 09:00:51
nyt://article/47ca1c34-3073-5654-9433-e6f99ca6f190,"Carolyn Bessette Kennedy, Ghost Influencer",2023-10-24 09:01:03
nyt://article/18094ab5-fc1d-543b-a063-aa846193386d,Is the American Dream More Dead Than Alive?,2023-10-24 09:01:14
nyt://article/fd2240a8-0cf3-5185-b2fc-61fcf2c45480,How Columbia Sportswear Is Loosening Its Ties to Asia,2023-10-24 09:01:16
nyt://article/b061c88a-20c5-57f6-a970-23943b76c52a,She Heeded Biden’s Warning to Migrants. Will She Regret It?,2023-10-24 09:01:35
nyt://article/3a298f29-b8fe-51db-8d53-4d52ae7bd16f,"Clean Energy, Cherished Waters and a Sacred California Rock Caught in the Middle",2023-10-24 09:01:42
nyt://article/c8f293dc-965b-5c26-84b5-854f326a1f5a,Do You Think Any of These Mythical Creatures Might Be Real?,2023-10-24 09:01:53
nyt://article/6c159308-f1dd-518a-a505-7fcba60f5f12,"Stop, Before You Close This Tab (or Any Others) …",2023-10-24 09:01:58
nyt://article/37d881af-e6de-5b29-bb43-88e6a1b2acbc,The Jewish Left Is Trying to Hold Two Thoughts at Once,2023-10-24 09:01:59
nyt://article/9f052e99-aaec-5d9c-9a56-d6ecc4bd8100,When a Book Deal Feels Like ‘Winning the Middle-Age Lottery’,2023-10-24 09:02:04
nyt://article/af2a09a9-b80b-52b7-9fc4-acbbcfd0f7e9,This Is What Keeps My Eco-Anxiety in Check,2023-10-24 09:02:14
nyt://article/18339690-aaa9-535d-be76-645376014879,How the Right’s Purity Tests Are Haunting the House G.O.P.,2023-10-24 09:02:15
nyt://article/a10fccda-d133-5eba-bb76-e15e6b78779f,Two Illinois Parishes Live on Either Side of a Catholic Divide,2023-10-24 09:02:15
nyt://article/381b081c-3afc-5afc-ac2c-0c74632641ce,‘It’s Like Our Country Exploded’: Canada’s Year of Fire,2023-10-24 09:02:28
nyt://article/4d02cbf9-a1c8-574a-80ad-d2e41fd140ae,We’re Disconnected and Lonely. David Brooks Has a Solution.,2023-10-24 09:02:31
nyt://article/cf47c7a5-c98f-5790-aebf-acd1c3020a3a,Israel Says It Will Destroy Hamas. But Who Will Govern Gaza?,2023-10-24 09:02:34
nyt://article/5d5bd1b1-a004-57e4-bb4c-e9bfd121f13b,"In Tight G.O.P. Primary in Ohio, Newt Gingrich Picks His Candidate",2023-10-24 09:02:38
nyt://article/4dc5f3db-5190-5f67-b434-a594fbd37da6,Millennials and Gen Z Are Tilting Left and Staying There,2023-10-24 09:02:44
nyt://interactive/8b1aa332-ac9a-5b0e-89e8-6b64eae7b9b4,Inside Poland Spring’s Hidden Attack on Water Rules It Didn’t Like,2023-10-24 09:12:24
nyt://article/03710256-b1c1-5124-aaa3-815bc5d3345b,She Made Pesto. People Started Spilling Their Secrets.,2023-10-24 09:55:08
nyt://article/e3aead55-1e20-583a-89f0-28dee687be51,Something Wicked This Way Paddles,2023-10-24 09:59:29
nyt://article/767ecc9c-48ec-5f4a-9dbb-06f205f09965,The Lawyers Now Turning on Trump,2023-10-24 10:00:12
nyt://article/6f666be1-d6d5-5644-97f4-1b4025286231,G.M. Profit Down 7% in Strike-Affected Quarter,2023-10-24 10:30:07
nyt://article/53231f0b-bf99-516b-a0d2-5d216531b8a5,Reviving the American Dream,2023-10-24 10:33:56
nyt://article/fa799bb1-d18f-5ab8-995a-cb9c008b5fe2,"‘Miss Juneteenth,’ ‘Dredd’ and More Streaming Gems",2023-10-24 11:00:02
nyt://article/ecb181be-506d-56f6-8856-7465899e4e7b,‘Milli Vanilli’ Review: Blame It on the Fame,2023-10-24 11:00:11
nyt://article/5f3eb3df-b4bb-5d52-9d0b-d0a93ffabae4,"Despite State Bans, Legal Abortions Didn’t Fall Nationwide in Year After Dobbs",2023-10-24 11:00:12
nyt://article/5bc4f1fb-4958-54b8-8f06-89028cad27d2,China Dismisses Defense Minister Amid Swirl of Speculation,2023-10-24 11:41:06
nyt://interactive/398e361b-67de-548a-a292-1b09587af1b1,"Weekly Student News Quiz: The Israel-Hamas War, a Viral Video, SAT Data",2023-10-24 12:01:30
nyt://article/53718d40-9271-518e-911c-9f7c37202d64,Several People Hospitalized in Austria After Taking Suspected Fake Ozempic,2023-10-24 12:09:24
nyt://article/3e366553-76ad-5589-b1af-16fbe259be73,Is E.S.G. Falling Out of Favor?,2023-10-24 12:14:26
nyt://article/6e9b383c-41ad-5891-97d3-6b9d4ae7c6dc,Trump Files More Motions to Derail Federal Jan. 6 Case,2023-10-24 12:26:05
nyt://article/8434e824-8424-550c-ac58-d339bfc77ee2,G.O.P. Nominates Mike Johnson for Speaker After Spurning Emmer,2023-10-24 12:49:07
nyt://article/0a2d67a0-984a-55f1-893d-8ca4e32ff7d0,Louis Vuitton Strikes Another Major Deal in Sports,2023-10-24 13:00:08
nyt://article/4c650551-d607-5a33-a6f4-4ea541d67c5c,Behind a Proposal to Create a Marine Sanctuary Along California’s Central Coast,2023-10-24 13:00:15
nyt://article/41f1da20-e06f-5866-8e32-7a7828ffe77e,Black Sabbath Ballet Turns Up the Volume on a Varied London Season,2023-10-24 13:15:38
nyt://article/10fd4ac3-d9c1-5656-8412-457eb9d60b37,Macron Says Israel Must Fight Hamas ‘Without Mercy but Not Without Rules’,2023-10-24 13:40:37
nyt://article/4f516aae-e379-5aca-a73f-cb0457081405,María José Llergo’s Songs Have Flamenco Roots. They Raise a Ruckus.,2023-10-24 13:49:07
nyt://article/8fbc80a5-9383-5e6d-84af-ea3d1aadbadf,"Jenna Ellis, Former Trump Lawyer, Pleads Guilty in Georgia Election Case",2023-10-24 13:52:46
nyt://article/c300eddf-0eb4-58c8-af9b-1171691f8d61,British Freighter Sinks in Fatal North Sea Collision,2023-10-24 14:10:02
nyt://article/c6102513-4138-5f61-bdef-e690b0e6af72,Media Companies Eye Cricket-Loving Diaspora in the U.S.,2023-10-24 14:17:31
nyt://article/1ce79f21-6e20-58ce-80ef-d63c3687c0bd,The ‘Devil’s Playground’ of Urban Combat That Israel Is Preparing to Enter,2023-10-24 14:22:32
nyt://article/f2280720-d2fd-5c6c-a75b-4e46d596892b,"After a Long Intermission, a New Act for a Flagship Paris Theater",2023-10-24 14:27:23
nyt://article/689dcddc-f15f-57fa-9fac-e3eac5d2acd9,U.A.W.’s Expanding Strikes Could Signal an Endgame or a Long Struggle,2023-10-24 14:35:23
nyt://article/668b5e81-815a-593d-beac-5a857a7ee067,"Amid Intense Fighting, Ukraine Orders Evacuation of Children",2023-10-24 14:41:00
nyt://article/b3061175-71b7-5e24-a309-d28099c00938,Five Quick Fall Pastas,2023-10-24 15:00:03
nyt://article/feb0f86a-c9eb-5c67-88ac-8a03c38baca2,Feeling Stressed? These 5 Books Can Help.,2023-10-24 15:00:06
nyt://article/e6f283a8-8563-57ba-a15b-931995a563f9,Edwaard Liang Appointed Artistic Director of Washington Ballet,2023-10-24 15:00:07
nyt://article/4196ed47-e767-554a-b17d-2a621a9a051b,Men Accused of Stealing 2 Million Dimes Face Federal Charges,2023-10-24 15:00:08
nyt://article/832ce06d-8b6f-5d56-b354-92d0ef8a74de,85-Year-Old Held Hostage in Gaza Says She ‘Went Through Hell’,2023-10-24 15:16:51
nyt://article/e6f0b8e9-6460-559d-81c5-e8dd6de055a0,Georgia Supreme Court Allows State’s Six-Week Abortion Ban to Remain in Effect,2023-10-24 15:38:04
nyt://article/568a8b06-0490-5fcb-a552-38e5d45db37d,"To Star at the Venice Biennale, Artists Need Patrons’ Deep Pockets",2023-10-24 16:04:15
nyt://article/02672d0d-c9e1-5e0e-9d2f-84e7ef191b4c,Meta Accused by States of Using Features to Lure Children to Instagram and Facebook,2023-10-24 16:08:30
nyt://article/6f38bf8c-3efb-565a-8b00-3721d17629d1,Democratic Group Steps Up Warnings Over a No Labels Third Party Bid,2023-10-24 16:26:34
nyt://article/0f054260-ea72-59d3-a816-91447ce6a417,‘Elephant’ at 20: A Drama About a Mass Shooting Remains Chilling,2023-10-24 16:42:18
nyt://article/7dd67d66-bbcd-5049-a9ba-b67728c8ce3c,New York Has Regained Its Lost Jobs. Why Doesn’t It Feel That Way?,2023-10-24 16:50:09
nyt://article/6ca740b6-c617-5aca-94f9-7eb3086098b4,"Who is Tom Emmer, the latest Republican nominee for speaker?",2023-10-24 17:11:58
nyt://article/129d58d0-f9ad-57d7-8980-2bab7753b2b1,Donald Trump and Christian Nationalism,2023-10-24 17:14:59
nyt://article/45e8721c-d23d-51da-bb9b-091abf5fc986,K-Pop Group Celebrates Wrong Rangers at Texas Show,2023-10-24 17:16:18
nyt://article/f3374a89-bd9b-515f-aba6-52868330aa64,Latest Figure to Flip in Election Case Had Direct Ties to Trump and Giuliani,2023-10-24 17:24:21
nyt://article/2a6b0912-d125-592b-8002-3438d2d3e9ea,Panera Bread’s ‘Charged Lemonade’ Is Linked to Death in Lawsuit,2023-10-24 17:28:03
nyt://article/ebc0e083-7c58-5df5-8561-aa6c5a7543ea,Morgan Freeman Would Like to Tell You the History of Everything,2023-10-24 17:49:59
nyt://interactive/553535cf-ce99-51ec-9f1f-64720989acf7,Read the document,2023-10-24 17:54:40
nyt://article/bea1abe9-153f-521c-87f9-70c94d47f55b,The Rolling Stones Played Old! They Played New!,2023-10-24 18:00:04
nyt://article/59eb7085-5e7c-5fc9-bfa1-a3bb98f5c66c,"Pilot Who Disrupted Flight Said He Had Taken Psychedelic Mushrooms, Complaint Says",2023-10-24 18:28:35
nyt://article/d051d3ff-3c22-5a23-be2d-8b53ed87749a,Columbia University Postpones a Fund-Raiser as Divisions Over War Deepen,2023-10-24 18:32:58
nyt://article/2859854f-107a-51bc-af4a-268c4654e9e2,Clean Energy’s Powerful Momentum,2023-10-24 18:38:54
nyt://article/a8ea2737-3522-5736-b918-560705a5e82d,Cruise’s Driverless Taxi Service in San Francisco Is Suspended,2023-10-24 18:39:09
nyt://article/ffe584d7-a317-58eb-81e6-20464fdf1b2e,"Dr. Donlin Long, Wide-Ranging Medical Innovator, Is Dead at 89",2023-10-24 18:43:23
nyt://article/2dbfb092-4c0f-59f4-8ffd-511ce7694f2e,Tiny Love Stories: ‘You Have Me Now’,2023-10-24 19:00:10
nyt://article/b2ee7171-d179-52cc-b75c-204425c18670,Dining’s Past Is on the Menu at Clara in the New-York Historical Society,2023-10-24 19:02:08
nyt://article/baa62f49-7984-5091-9a7b-be34c9c4d841,This Is Your Brain on Crime,2023-10-24 19:07:57
nyt://article/8c73364f-32b2-5e69-8b23-7ad575c96ee2,Covid Shots May Slightly Raise Stroke Risk in the Oldest Recipients,2023-10-24 19:08:28
nyt://article/5d44e298-8f15-52b5-8575-c53daf1ffefe,"To Go Viral on TikTok, Do This",2023-10-24 19:20:44
nyt://article/8eccb115-3a67-538a-b05a-0c3205801cd4,"In Texas, Local Laws to Prevent Travel for Abortions Gain Momentum",2023-10-24 19:28:50
nyt://article/24023abb-5d83-5709-8280-48d53c16bce1,Watchdog Says Trump Didn’t Influence Decision on F.B.I. Headquarters,2023-10-24 19:30:20
nyt://article/9a746730-e354-53cf-8f8b-25608f490377,Transcript: Ezra Klein Interviews Spencer Ackerman and Peter Beinart,2023-10-24 19:34:39
nyt://article/896e8976-3cf1-5de9-af8b-a5f1f83f39b2,Our 9th Annual Student Review Contest,2023-10-24 19:50:44
nyt://article/2cd5b24e-3933-5de2-a907-337f6b7937de,"Snap Reports 5% Revenue Increase, Reversing Declines in Growth",2023-10-24 20:12:13
nyt://article/a5b8300a-ef18-5bc7-ae0a-c38b5e58e06c,"As Gaza Barrage and Deaths Surge, Angry Accusations Fly at U.N.",2023-10-24 20:18:33
nyt://article/833cfa26-1fe1-5c31-9f84-587bc5c93c04,"Joseph J. Kohn, Who Broke New Ground in Calculus, Dies at 91",2023-10-24 20:21:25
nyt://article/3ab0f892-0730-5bac-80b3-44665ad473ab,Microsoft’s A.I. Investment Stabilizes Its Cloud Business,2023-10-24 20:22:20
nyt://article/ae706293-9219-5dfe-97cc-3c5a012c9192,Alphabet Has Strong Ad Sales but Cloud Business Disappoints,2023-10-24 20:44:12
nyt://article/4a577ee7-93f7-5ff5-b715-1c5cbb4972fe,"On the Agenda for Australia’s State Visit: China, Trade and a U.S. Marine Band",2023-10-24 20:48:09
nyt://article/04304e85-5089-5e85-ba65-cd0f3156c644,Wednesday Briefing: Gaza Death Toll Climbs,2023-10-24 21:11:48
nyt://article/26a518d3-080e-5afc-bf07-495a572a2081,What to Know About Dengue Fever as Cases Spread to New Places,2023-10-24 21:15:38
nyt://article/808007ce-03f7-5d77-ac21-457a857e0890,Why Health Care Workers Are Burning Out,2023-10-24 21:17:28
nyt://article/da71cea3-06c3-5001-b365-5731c3586434,Dave Chappelle’s Remarks on Israel Draw Cheers and Walkouts in Boston,2023-10-24 21:24:13
nyt://article/bfebaaf6-d5ac-5388-9224-570b76504320,"Ukrainian ‘Artifacts’ Seized in Spain May Not Be Treasures, Experts Say",2023-10-24 21:31:07
nyt://article/4c8dd781-e82a-5f27-a7bd-2d03a53e4a09,"‘I Went Through Hell,’ Freed Israeli, 85, Says of Subterranean Captivity in Gaza",2023-10-24 21:31:41
nyt://article/c3e5771b-dfcb-5db8-bbea-87496a7e1ea2,Britney Spears Doesn’t Need to Narrate Her Memoir for It to Sing,2023-10-24 21:32:55
