_id,headline,pub_date
nyt://interactive/1764754f-52ea-5750-b9c5-80f7ea08a6c3,"Racing to Land, or Crash, on the Moon",2023-08-22 21:48:00
nyt://article/faa09602-6d4b-592a-ba40-3fbbf6179b41,Delving Into the Debate Over State Flags,2023-08-22 22:00:09
nyt://article/1ed41daf-7427-5d99-a028-3a2f68e332e3,U.S. Officials Blamed Ukrainian Struggles on Tactical Mistakes,2023-08-22 22:00:12
nyt://article/0b315c10-f2c5-50bf-9782-f8be8c740b77,"Central U.S. Swelters Under Heat Dome, Forcing Cancellations and Precautions",2023-08-22 22:03:30
nyt://article/8b2628c3-d825-5729-a2cb-9ad2d1a3542a,"At a Much-Watched BRICS Summit, Putin Tries to Rally Support",2023-08-22 22:05:38
nyt://article/03306030-bd81-521b-be29-a6495f023bb3,Canadian Officials Condemn Facebook for News Ban as Wildfires Burn,2023-08-22 22:05:52
nyt://article/05b04f49-e135-500b-a127-5a42115f8dc6,Bear Attack Sends New York Boy to the Hospital,2023-08-22 22:15:20
nyt://article/f442939a-59f5-54ca-be69-df5703547ae1,"To Trump, Foreign Business Is Scandalous, Unless It’s His Own",2023-08-22 22:54:57
nyt://article/08f7ce25-a2ac-51ac-ab3d-a56b34694d4d,"One of the World’s Fastest 1,500-Meter Runners Just Wants to Be an Orthodontist",2023-08-22 23:07:27
nyt://article/1ba19699-03cb-5fa0-9c6f-c9ebce6d463c,"Tulsa Superintendent to Step Down, in a Showdown With State Officials",2023-08-22 23:28:05
nyt://article/e761821c-afe3-54d6-96c5-a435e9c6dca5,"‘Don’t Kiss or Snuggle Your Turtle,’ C.D.C. Warns Amid Salmonella Outbreak",2023-08-22 23:57:35
nyt://article/3bd1918c-3e95-54c1-a6d3-206fd83f2c2c,"Witness in Trump Documents Case Changed Lawyers, and Then Testimony",2023-08-23 00:27:35
nyt://article/06b12106-66ed-5f2c-8720-f2840f8666c2,"With Hundreds in Maui Still Unaccounted for, Search Grows Desperate",2023-08-23 00:48:39
nyt://article/52fed8bb-4298-5ec3-ab19-ee8f3b24cef1,Puts on the Books,2023-08-23 02:00:11
nyt://article/7353daf1-820e-53bb-8b38-4814326c160a,Drowning Death of Obama Family Chef Is Ruled an Accident,2023-08-23 02:21:49
nyt://article/8725cdee-02c8-5e68-a184-336f8a3910ec,"In Several California Communities, Recovery Efforts Continue After the Storm",2023-08-23 02:48:47
nyt://article/4b69071f-a3e3-52c1-a386-9593b05e3ab0,The First Chinese American Movie Star and the Cost of Glittering Fame,2023-08-23 04:00:07
nyt://article/3fd8c681-bf21-5026-b6e0-7a72644dcbc8,What to Know as Zimbabwe Elects a President,2023-08-23 04:01:39
nyt://article/7e32f283-3e4f-5207-b45a-5c79aa283e0b,Who can seize the spotlight from Trump? Here’s what to watch for.,2023-08-23 04:01:39
nyt://article/dc443078-31b9-5b19-b280-7e6490195c51,Can Shrinking Be Good for Japan? A Marxist Best Seller Makes the Case.,2023-08-23 04:01:39
nyt://article/4a7a868f-1c11-5e30-a346-5c9f463c2dc2,Wednesday Briefing,2023-08-23 04:02:04
nyt://article/208dc2bd-72ca-54be-9a2c-1b65cf5474af,"With Reported Missing in Maui Topping 1,000, Officials Will Release Names",2023-08-23 04:07:29
nyt://article/c941b50d-c811-5066-aa44-33c538f936c8,Adams in Jerusalem: An Emotional and Strategic Visit,2023-08-23 04:10:05
nyt://article/e84dc59e-e5b7-5d82-b34a-396b20f8e625,"Corrections: Aug. 23, 2023",2023-08-23 04:13:37
nyt://article/84290116-2b25-59d8-852d-b49c9c80f094,Hollywood Studios Disclose Their Offer on Day 113 of Writers’ Strike,2023-08-23 05:08:14
nyt://article/f7671de3-ddb2-5ff4-9524-d87ae9b1cccd,Word of the Day: iteration,2023-08-23 06:00:02
nyt://article/e5a64097-d999-5ab0-94e3-cbc0c9e2667b,Spelling Bee Forum,2023-08-23 07:00:04
nyt://article/6476b635-d454-54ef-b052-d420c1363d83,Today’s Wordle Review,2023-08-23 07:00:09
nyt://article/2e67d392-73ac-5a60-97f9-3100147a4468,The First Big Stop on the Campaign Trail,2023-08-23 07:00:11
nyt://article/36b14617-9c4e-5749-9b34-2f144937e5b0,"In a Hot Job Market, the Minimum Wage Becomes an Afterthought",2023-08-23 07:00:19
nyt://article/0771249d-8f36-5188-8265-269251122558,A Filmmaker Honored Bella Abzug. Her Daughter Says He Took Advantage.,2023-08-23 07:00:21
nyt://article/f76cab6f-8824-5c6e-af83-7e8d98a1da06,"Beyond the Debate, Republicans Are Deep in the 2024 Ad Wars",2023-08-23 07:00:21
nyt://article/951cff31-71e1-5b61-a07e-59f87719ae39,"Quotation of the Day: In Hot Job Market, Minimum Wage Isn’t Enough to Lure Workers",2023-08-23 07:07:02
nyt://article/fcb03c8b-97fa-5d10-9a6b-0fccb8895a57,"Ukrainian Drones Target Moscow and a Russian Border Region, Officials Say",2023-08-23 07:17:13
nyt://interactive/fbb9817d-b515-5d02-8f18-c8628e3220db,‘I’d Like to Reinvent What Closeness Means’,2023-08-23 09:00:01
nyt://article/53c5f763-69fc-559f-81a2-6c3a1db165eb,It Is No Longer Possible to Escape What We Have Done to Ourselves,2023-08-23 09:00:08
nyt://article/328cfca5-052c-527d-b778-b3bd97de0f8e,The Thrill of Watching a Film That Isn’t Online Anywhere,2023-08-23 09:00:09
nyt://article/96fd3018-1673-501f-83fd-f6492afdb4f9,The Trump-Free Debate That’s All About Trump,2023-08-23 09:00:09
nyt://article/d33a27f9-eb4b-50db-8316-af2b59d845e0,Damselfish in Distress: Warmer Seas Might Be Clouding Their Brains,2023-08-23 09:00:11
nyt://article/a3528873-8586-5ce7-9580-b8f5a64661df,The First Debate and the Race for Second Place,2023-08-23 09:00:15
nyt://article/859d4a10-b69f-5bbc-bb5d-fda9db70950a,"Speakeasies, Golf and a Pool: 5 Baseball Parks That Go Beyond Baseball",2023-08-23 09:00:25
nyt://article/92713f83-1502-5b47-bfa4-0c7bee31830e,The Best Relationship Advice We’ve Gotten So Far This Year,2023-08-23 09:00:36
nyt://article/810185f1-3338-5052-8b75-866b946fe7c7,Designed to Be Buggy,2023-08-23 09:00:42
nyt://article/7b019384-de0a-5d30-8530-1fb6126ec605,"$500,000 Homes in Indiana, Kentucky and Oregon",2023-08-23 09:00:48
nyt://article/dffdb9e0-8fe0-5eb3-b746-7d436f82daf3,Lahaina Inferno Began After Firefighters Departed a ‘Contained’ Scene,2023-08-23 09:00:49
nyt://article/fcaafa30-f00f-5021-b25c-d245fc7f345d,‘I Don’t Think Trump Will Be the Nominee’: Three Writers Preview the First G.O.P. Debate,2023-08-23 09:00:49
nyt://article/11dfdf79-7713-516a-a495-5c40a565f74b,Already Missing Summer? You Can Preserve It in Your Freezer.,2023-08-23 09:00:50
nyt://article/1857e024-ba10-5ea8-ac02-8f70e9d60e4b,Can This Deck of Cards Make Your Partner Do More Chores?,2023-08-23 09:00:50
nyt://article/0b3d2e22-0570-5473-915a-bc3fd38d2f83,‘Aren’t You a Man?’: How Russia Goads Citizens Into the Army,2023-08-23 09:00:51
nyt://article/3952948c-2234-5f4d-ba05-c04ecd766b5f,Trump Voters Can See Right Through DeSantis,2023-08-23 09:00:51
nyt://article/7cd0ed73-d8b8-586d-86f5-091a5195b388,The Inheritance Case That Could Unravel an Art Dynasty,2023-08-23 09:00:52
nyt://article/2849b72e-e4b3-5f2d-a62f-e0b240f51663,"In the Heart of the Outback, Safeguarding a Sacred Land",2023-08-23 09:01:05
nyt://article/c6547494-b0fc-56ac-8f13-edc767ac49b4,The Secrets of Debate Swag,2023-08-23 09:01:05
nyt://article/f4e64b8d-87e2-5682-9234-1841b4805c59,First They Appeased Poseidon. Then They Ate Lobster.,2023-08-23 09:01:05
nyt://article/cb966fba-ea0c-522a-82fe-0cbbfada87cf,How a Small Gender Clinic Landed in a Political Storm,2023-08-23 09:01:06
nyt://article/46756a63-f880-5c8c-a036-636353575de7,The Secret to the Greenest Pesto,2023-08-23 09:03:13
nyt://article/bc67a55d-3af8-5ccd-9bf0-060033e43f44,China Tries to Increase Its Clout in Africa Amid Rivalry With the U.S.,2023-08-23 09:08:08
nyt://article/e1145e44-aeca-5cfd-b24d-a695c58e63ae,At Least 26 Die as Bridge Collapses While Under Construction in India,2023-08-23 09:44:46
nyt://article/16bcbf7b-c8d1-5b67-ad8f-7d71a8c9b0cb,"Today’s Top News: The First G.O.P. Presidential Debate, and More",2023-08-23 09:45:08
nyt://article/7e81db47-ff3e-583c-b83c-fdea1766830f,"Ready or Not, Driverless Cars Are Here",2023-08-23 10:00:06
nyt://article/c76262d7-a5e5-533b-a49b-aabd8a8d168e,"YouTube Improperly Used Targeted Ads on Children’s Videos, Watchdogs Say",2023-08-23 10:00:10
nyt://article/54f84bef-9d90-52d6-93e3-3abb407242cb,Finding Climate Havens,2023-08-23 10:38:35
nyt://article/3cf312d8-cf3d-51a1-9e5c-56c227dc1963,Florida Approves Tough Discipline for College Staff Who Break Bathroom Law,2023-08-23 11:05:12
nyt://article/a2bd5091-93b4-5684-ada4-fa506f157e85,"In Speech to BRICS Nations, Putin Again Blames West for Ukraine War",2023-08-23 11:37:46
nyt://article/88852ae6-ab4a-550f-8609-264cb5544726,‘BS High’ Review: Greed and Football,2023-08-23 12:00:09
nyt://article/0c5f86dd-03ba-5f7f-a429-4e183fd2102f,"Eight Videos With Writing Advice for Teens, From Teens",2023-08-23 12:55:13
nyt://article/7a99556a-92ef-52f5-bff4-f31906815347,‘Retribution’ Review: Stay Out of the Car Pool Lane,2023-08-23 13:00:06
nyt://article/9ae878f8-cb14-54e6-81d7-2ec8b19833d8,My Daughter’s Ex-Mother-in-Law Won’t Stop Calling. Help!,2023-08-23 13:00:10
nyt://article/752a10f4-744e-52df-9ebf-087fc387ab9d,What the Rain From Hilary Means for California’s Fire Risk,2023-08-23 13:00:15
nyt://article/96fece33-9030-5e9d-a6ab-6abc1a28ea16,What’s Next for India in Space Exploration,2023-08-23 13:02:56
nyt://article/ce0af322-d766-5065-a953-cbb1c022a181,A’ja Wilson’s 53-Point Game Ties the W.N.B.A. Record,2023-08-23 13:32:29
nyt://article/123e0f9a-2c1c-5ffe-b14e-eca04fd412f4,Doug Burgum Will Participate in G.O.P. Debate Despite Basketball Injury,2023-08-23 13:39:42
nyt://article/aad2e85d-1721-5e20-be6b-fbea4903e29a,"Over 3,100 Charged With Pandemic Relief Fraud, Justice Dept. Says",2023-08-23 14:30:09
nyt://article/0e70a631-848c-51c7-a3df-971ba62f05c4,Greece Battles Its Most Widespread Wildfires on Record,2023-08-23 14:33:32
nyt://article/e1762665-4454-5f86-b3d9-283c821e0ee1,Giuliani Surrenders at Jail in Georgia Election Case,2023-08-23 14:41:03
nyt://article/ca5bdccb-07c4-538d-941e-cdb06319b969,"Scenes From Greece, Where Hundreds of New Fires Burn",2023-08-23 14:44:03
nyt://article/b99f5f91-39ca-5676-9c67-7d3196937ea3,What to Know About the 6 Nations Invited to Join BRICS,2023-08-23 14:46:30
nyt://article/beb22028-1528-5d6c-861d-0f3bdf986992,To Seize the Fleeting: Making Clarice Lispector Dance,2023-08-23 14:53:01
nyt://article/45591d6e-6b20-5173-be03-c25dd5237775,California Rolls for a Crowd,2023-08-23 15:00:07
nyt://article/1ffb3b4e-a1c2-5c10-a777-8dcda4f4bee8,"A Novel Therapy, Using Writing, Shows Promise for PTSD",2023-08-23 15:00:08
nyt://article/e692399f-ce6e-5176-b933-e50f2c22c2e0,A Stroke Stole Her Ability to Speak at 30. A.I. Is Helping to Restore It Years Later.,2023-08-23 15:00:25
nyt://article/01329d04-2883-5d87-b08f-0ebd4b42f893,"Robert Paulson, Long-Term A.L.S. Survivor, Is Dead at 86",2023-08-23 15:04:59
nyt://article/94db2c54-5f7e-569d-b514-4aee5c334fae,"Flying High at the Beach: Birds, Dancers, Merce and Michelson",2023-08-23 15:05:02
nyt://article/2fe4fb30-988a-5fc6-a90e-9bdbe6e4c8c8,"On the Moon’s South Pole, a Quest for Ice",2023-08-23 15:19:11
nyt://article/ca475e6c-b25b-5052-952e-1e052aaecbcd,Fresh Look at Data Shaves Just a Hair Off U.S. Job Growth,2023-08-23 15:39:20
nyt://article/ec7bcd08-d1e7-58ef-940e-df8bea0a563c,Jennifer Weiner’s New Novel Covers Plenty of Ground,2023-08-23 15:39:45
nyt://article/2df3bc65-ece9-5637-850f-723e11c56134,‘India Is on the Moon’: Lander’s Success Moves Nation to Next Space Chapter,2023-08-23 15:51:11
nyt://article/33b4660a-355b-59e8-9999-c434dbe81e83,How Menopause Affects Women of Color,2023-08-23 16:00:21
nyt://interactive/db763a9c-31e2-42e3-b475-7147c56ce5c2,What Goes Into an E.V. Battery? ,2023-08-23 16:16:01
nyt://interactive/0fe9d54b-4f84-4ba9-a0b5-56bd8b14dd58,‘Heartstopper’ Is a TV Love Story With the Soul of a Comic,2023-08-23 16:16:30
nyt://interactive/e191b4a7-8933-4533-969e-ea1a58f76c0e,The Best Sheets for Hot Sleepers,2023-08-23 16:18:32
nyt://interactive/6c0f8c23-cd17-4f59-b287-8c31562b78f9,The Best Portable Air Conditioner,2023-08-23 16:19:10
nyt://interactive/1ec1cc7d-d966-485b-8b24-ffb3bbc3afec,Cheap(ish) Things to Bring to the Beach,2023-08-23 16:21:49
nyt://interactive/cdcea66a-320c-4913-a902-ff474e3c01a0,These are the best fans according to our experts,2023-08-23 16:22:59
nyt://article/60f33a67-b27c-5b0e-86f8-4643b1426f64,Fixing America’s Health Care System,2023-08-23 16:34:05
nyt://article/5a57f024-6b03-563f-8e3d-13611740879c,Our Summer Intern Brags About His Illegal Hobby. Should I Tell H.R.?,2023-08-23 16:35:35
nyt://article/9c3b3a7f-235c-5a0f-af1b-4fd99abe9bf8,"South Carolina Supreme Court Upholds Abortion Law, Reversing Earlier Decision",2023-08-23 16:37:40
nyt://article/d24c9334-e174-556b-ae34-4a17f9d1a583,Facial Recognition Saw Through Man Who Stole Dead Brother’s Identity,2023-08-23 16:39:15
nyt://article/1a64e1ca-9839-586a-b142-245ce78a3feb,DeSantis’s Debate Mission: Prove He’s Still the Top Trump Alternative,2023-08-23 17:12:06
nyt://article/18f532cb-015d-5b74-958c-f80b0e2eb32b,Woman Who Fatally Shoved Broadway Voice Coach Pleads Guilty,2023-08-23 17:21:51
nyt://article/d79a3855-2f6c-5abe-8eec-4ceb034b36b8,"A Dad Disappears, and His Family Cracks Open",2023-08-23 17:40:37
nyt://article/6f677e73-627e-5199-a9d5-0fa826442bc7,What Can Replace China as a Global Economic Engine?,2023-08-23 18:00:07
nyt://article/0b4e9fc3-cb3e-55c3-9e6f-9ff0c816a0a9,"Atop an Underwater Hot Spring, an ‘Octopus Garden’ Thrives",2023-08-23 18:00:19
nyt://article/a03397cd-ffdf-5d91-b7c1-118a05f8f680,Biden Incentives for Foreign Investment Are Benefiting Factories,2023-08-23 18:11:01
nyt://article/15ea5301-7e85-5197-b2f8-4b4d75e8bbaf,"Gender Surgeries Nearly Tripled From 2016 Through 2019, Study Finds",2023-08-23 18:14:04
nyt://article/f41e7e10-4a06-5fbf-aa4a-33b5820c3e4a,"Toto Cutugno, Singer Whose ‘L’Italiano’ Struck a Chord, Dies at 80",2023-08-23 18:51:42
nyt://article/6882312d-404f-58e2-8234-e20b1d49521b,"To Fight Climate Change, We Need a Better Carbon Market",2023-08-23 19:00:02
nyt://article/7d794c0b-383c-5be8-973a-3fdd390e22e7,A Fan Made a Spider-Man Film. The Fallout Has Been Unexpected.,2023-08-23 19:30:50
nyt://article/7b1225e9-a42f-5647-8adf-b340a6aff09b,How Multiple Warnings About a Killer Nurse Went Unheeded,2023-08-23 19:55:46
nyt://article/3c6d437d-5208-5dbc-abb2-1caef3af8a9e,Mandatory Composting Is Coming to New York City: What You Need to Know,2023-08-23 20:17:26
nyt://video/9d1ea9ab-5d9a-5735-be62-593b244f9fc4,Plane Linked to Prigozhin Crashes in Russia,2023-08-23 20:20:12
nyt://article/3d4a6224-a77c-56d8-9676-84cea13eb40b,Opioid Maker’s Bankruptcy Plan Would Cut Payments to Victims by $1 Billion,2023-08-23 20:33:07
nyt://video/cab13b72-859f-52c3-90c3-ba37d7cea9a9,"Transforming Sustainability: If We Can Do It Here, We Can Do It anywhere.",2023-08-23 20:46:16
nyt://article/e5ab5b26-aa9c-5c10-8744-67c6e6e3b87a,"Nvidia Revenue Doubles on Demand for A.I. Chips, and Could Go Higher",2023-08-23 20:47:57
nyt://article/a60dcd99-5936-5af9-bc07-e86e28c1906e,Preparing to Fact-Check the First G.O.P. Debate: A Misstatement Sampler,2023-08-23 20:49:26
nyt://article/2e80d709-eaaa-5553-8f31-1ffdeefe5ac4,"‘Scrapper’ Review: You’re on Your Own, Kid",2023-08-23 20:51:28
nyt://interactive/d7ca6c78-9754-5f7c-8a5c-68bc6fc30391,Which Candidates Got the Most Speaking Time in the Republican Debate,2023-08-23 20:56:25
nyt://article/9fd1c073-7309-540f-a108-c4c6e881465d,Thursday Briefing: Prigozhin Listed Aboard Crashed Plane,2023-08-23 21:02:21
nyt://article/de5d7cca-5613-52b7-8a78-e6b125c0827a,Judge Orders New Trials for 2 Men Convicted in Grisly ’93 Murder,2023-08-23 21:26:52
nyt://article/2ae69326-d574-52e6-bc50-514ef36808c6,"After 122 Years, a Lost Edith Wharton Play Gets Its Debut",2023-08-23 21:39:52
nyt://article/9c770bac-cac7-5268-b2bc-54e3b36bd8b4,Popcast (Deluxe): A Shocking No. 1 Hit and Addison Rae’s New EP,2023-08-23 21:42:15
nyt://article/9a027a71-9672-5cab-9448-e8758bd955a6,Famed Conductor Accused of Striking Singer at Performance,2023-08-23 21:45:17
nyt://article/29183e2a-e073-51c1-bc5a-eab8cec763cb,Man Charged With Murder in Hammer Attack on Mother and 2 Children,2023-08-23 21:59:03
nyt://article/85c4e70c-1910-5093-81e7-d7ab30c7fc0d,Prigozhin May Have Been Aboard a Crashed Plane,2023-08-23 22:10:52
nyt://article/38bfef0a-6cb8-5d4a-bde6-6a58657d4d82,"Mark Thompson, Former New York Times C.E.O., Among Candidates to Lead CNN",2023-08-23 22:17:48
nyt://article/357bec05-9077-5d2c-8357-a32c53681d0f,"No Opening Statements, One Minute for Answers: The Debate Format",2023-08-23 22:50:21
nyt://article/0c9f5245-b01e-59ad-86b6-11a642c2c254,Trial Opens for Men Accused of Aiding Plot to Kidnap Michigan’s Governor,2023-08-23 22:53:38
nyt://article/55204bbc-7164-5ec5-93ba-7c06225afb6d,America Is Losing Religious Faith,2023-08-23 23:00:08
nyt://article/a4f3f556-d864-5adc-8121-37f55274cb5a,"Warren Hoge, Who Covered Wars and World Crises for The Times, Dies at 82",2023-08-23 23:02:23
nyt://article/2fd23fe3-da36-5d63-aa3e-dd11672c3e2e,California Workers on Strike Could Get Unemployment Pay Under New Bill,2023-08-23 23:13:59
nyt://article/4141b1df-d24c-54c7-b911-0225b3dd381f,"Law School That Covered Slavery Murals Didn’t Violate Artist’s Rights, Court Rules",2023-08-23 23:21:19
nyt://article/e1a78e7b-985b-5fe6-b416-1ee95854e65e,"Johaar Mosaval, Who Broke Free of Apartheid for Ballet, Dies at 95",2023-08-23 23:30:27
nyt://article/3e5414fd-ed1e-5d21-8894-309300c05d8c,"​North Korean Satellite Launch Fails, Again",2023-08-23 23:30:51
nyt://article/814931e6-9809-5165-ae54-9fac30896b74,"The Republican Debate Will Be a Test for the Moderators, Too. Who Are They?",2023-08-23 23:59:08
nyt://article/176a5b0d-1cf0-51be-93da-a832872d4095,"Terry Funk, Hard-Core Hall of Fame Wrestler, Dies at 79",2023-08-24 00:49:17
nyt://article/2d9c4f3f-8c70-535b-8ff0-58990943f0c8,"‘Rich Men North of Richmond,’ Viral Country Song, Gets a Debate Moment",2023-08-24 01:54:14
nyt://article/7e33c0c5-fd69-5fc9-b71d-652ea0221329,Wagner Leader Believed to Be Aboard Plane That Crashed in Russia,2023-08-24 02:09:42
nyt://article/1a3ab040-9f94-5a84-bd44-fe84eae7fd5f,How Vivek Ramaswamy Broke Through: Big Swings With a Smile,2023-08-24 02:15:00
nyt://article/263b8475-9bec-56df-ae16-b5dc7e7c47d1,"Pence and Haley Clash, Underscoring the Republican Divide on Abortion",2023-08-24 02:42:43
nyt://article/1e9ee0b5-b9a0-568d-ad7e-471433b05f85,Chaos Erupts When Republican Candidates Are Asked if They Believe in Climate Change,2023-08-24 02:53:21
nyt://article/3fedb880-8978-50f7-a334-4d31e64c566f,"Trump, During Tucker Carlson Interview, Belittles Republican Rivals",2023-08-24 03:15:58
nyt://article/83c49d74-ee97-5146-9594-b5040c7d6886,Which Red Tie Did the Most?,2023-08-24 03:46:28
nyt://article/c0be370d-6e87-588f-b072-2bf1f7dbff20,The Quest for a Crocodile Dictionary,2023-08-24 04:00:09
nyt://article/f03b4bec-70fd-506d-a2ff-d1c486437500,Casino Operators and Children: The Strategy for Local Support,2023-08-24 04:03:05
nyt://article/04121e5f-8413-5b90-ac4b-4b9a2bf38c2d,Thursday Briefing,2023-08-24 04:05:57
nyt://article/db7fc789-55a4-5268-9be1-30fc08ae4b12,Japan Begins Releasing Treated Radioactive Water at Fukushima,2023-08-24 04:15:18
nyt://article/ec27ed3d-6752-5085-bbbf-faf5606b7e5b,"Gunman Kills 3 at Biker Bar in California, Then Dies in Shootout",2023-08-24 04:22:25
nyt://article/8844fd84-d8b0-53a0-b2cd-4970280e76ec,What Prigozhin Did in Putin’s Russia Was the Ultimate Betrayal,2023-08-24 05:00:13
nyt://article/7c05f706-f661-5dfe-9d26-6605a71e5500,A Fox News Debate That Skimped on ‘the Elephant Not in the Room’,2023-08-24 05:04:53
nyt://article/b197fbfd-eac2-5857-87ef-37324bc0f062,"From a G.O.P. Stronghold, Debate Watchers Cheered Signs of a Post-Trump Era",2023-08-24 05:07:26
nyt://article/97228a20-7c23-5112-bbb5-ff7d90614778,What I Saw on That G.O.P. Debate Stage Was Complete and Utter Moral Cowardice,2023-08-24 05:37:59
nyt://article/ad161199-f150-56aa-8ab1-190ad38b3e63,Ramaswamy Seizes Spotlight as DeSantis Hangs Back: 7 Debate Takeaways,2023-08-24 05:57:37
nyt://article/ad4f2fda-0472-5056-a046-95b6beddeaf5,Word of the Day: paterfamilias,2023-08-24 06:00:02
nyt://article/cf8695a5-5a94-545e-9863-a820837b855d,What a Few Seconds of Hand Raising Said About Trump’s G.O.P.,2023-08-24 06:03:56
nyt://article/1ec17aff-7d45-57cc-bf9c-1feb1bd4b1b8,Who Won the Debate? Political Observers Weigh In.,2023-08-24 06:11:24
nyt://article/5d8ccbee-5c29-5c16-8111-b3bb86f0cf63,Ukraine Observes Independence Day With Subdued Celebrations,2023-08-24 06:30:33
nyt://article/86d25125-47e3-5e32-b5a4-7ec23436a668,Quotation of the Day: A Stroke Silenced Her. A.I. Is Helping Her Talk.,2023-08-24 06:52:17
nyt://article/c53b21aa-88e9-5b9c-949e-e71cb65fce23,"Corrections: Aug. 24, 2023",2023-08-24 06:52:22
nyt://article/131516bb-0b53-5861-b864-4b01b2e1242f,Today’s Wordle Review,2023-08-24 07:00:03
nyt://article/14999a9e-ef8b-5593-bcb0-ec298518c7b1,"In Ecuador, an Assassination Brings a Turning Point",2023-08-24 07:00:03
nyt://article/80ef756c-4623-5584-a54a-94fd0c45a555,Spelling Bee Forum,2023-08-24 07:00:03
nyt://article/5dff19e0-7921-5465-83db-d99f26617618,A State Plagued by Bear Encounters Turns to an Old Solution: Guns,2023-08-24 07:00:12
nyt://article/51736b54-025f-5b59-ba90-406f5e18ada6,"For Mayors of New York City, a Political Pilgrimage Awaits: Israel",2023-08-24 07:00:23
nyt://article/c3441e22-76bd-539f-9167-eec66d189f20,We’re Having a Cowboy Moment,2023-08-24 07:00:24
nyt://article/50c16c7a-a243-5fc9-a4b4-3cbeb4a7d571,Escape China by Jet Ski? A Dissident Is Said to Have Planned It for Years,2023-08-24 07:10:08
nyt://article/a1542eac-8509-5cb6-a24d-68f052ab83f7,"After Thais Vote to Move Forward, the Old Guard Just Shifts Its Grip",2023-08-24 07:40:59
nyt://article/6354f0ee-a3db-55d0-a4d7-806aaff9b24e,"Iran, Saudi Arabia and Egypt Invited to Join Emerging Nations Group",2023-08-24 08:35:57
nyt://article/0970e383-0844-5f4d-ad03-9df221a3253c,Russia Extends Pretrial Detention of Evan Gershkovich,2023-08-24 08:46:36
nyt://article/22d01c0c-941e-5d9b-ae4c-417c2fcd0b8a,Ex-Principal of Australian Girls’ School Sentenced to 15 Years for Abuse,2023-08-24 08:55:48
nyt://article/b1598a4d-11a4-563e-a258-ec5b2843b646,"Jacobite Hero Bonnie Prince Charlie Gets a Fresh Face, Acne and All",2023-08-24 08:55:50
nyt://interactive/a32da58a-30db-5068-852c-dfbd7f0957fa,"36 Hours in Cartagena, Colombia",2023-08-24 09:00:01
nyt://interactive/e4d9eac2-81d4-5507-8bcb-6fdb7f53a08f,"Our Writers Pick the Winners, Losers and ‘the Star of the Evening’ From the First Republican Debate",2023-08-24 09:00:02
nyt://article/ff3fb5b5-6083-5de3-b8fd-807a4d9c0d1e,Judge John Hodgman on the Confusing Acronym,2023-08-24 09:00:03
nyt://interactive/89f9a1bb-7064-53f0-8f6e-180892d5f914,"In Orlando, Looking for a Move-In Ready House Near All the Fun",2023-08-24 09:00:13
nyt://article/82e91930-e015-5c86-9355-1e44e0329c4a,‘Gran Turismo’ Review: Once Upon a Pair of Sticks,2023-08-24 09:00:17
nyt://article/7925b651-2111-580c-b8bf-260fa771cd3b,How Jackson Hole Became an Economic Obsession,2023-08-24 09:00:21
nyt://article/b80183a4-f7c5-5f7a-b591-d84ca01edefa,Jaimie Branch Adds to a Brilliant Legacy With Fly or Die’s Final LP,2023-08-24 09:00:22
nyt://article/1d4e8f37-90bb-5f9f-a68d-735e6b9242a5,James McBride Doesn’t Read Reviews. Here’s Why.,2023-08-24 09:00:26
nyt://article/22bba0b3-1abd-502e-85d0-1057d6ad179f,Imprinted by Belief,2023-08-24 09:00:28
nyt://article/5379e960-3f1b-5a8c-ae8e-403be9e8eb37,Untitled poem from ‘Starlings’,2023-08-24 09:00:33
nyt://article/0b273810-8f1c-570e-8b02-ff2e588abab5,The Book That Made R.J. Palacio Cry on the Subway,2023-08-24 09:00:42
nyt://article/6179e6d3-19f7-5d11-8f92-ae39ec3484fe,Does Wildfire Smoke Cause Sinus Issues?,2023-08-24 09:00:44
nyt://article/03684e35-bb6b-5a93-a6b6-ae014abdddb8,"In Reversal Because of A.I., Office Jobs Are Now More at Risk",2023-08-24 09:00:48
nyt://article/6586f4de-31e7-5c82-9a4c-d13ba73fd4da,Can A.I. Detect Wildfires Faster Than Humans? California Is Trying to Find Out.,2023-08-24 09:00:48
nyt://article/a9628bca-3bc3-57d6-90b0-b2753b92f617,How Schools Can Survive (and Maybe Even Thrive) With A.I. This Fall,2023-08-24 09:00:50
nyt://article/affae557-d177-5c0a-9a89-b82b35eb3f5e,Tiny Forests With Big Benefits,2023-08-24 09:00:50
nyt://article/610004f6-57b5-5607-b4b4-1f44e2e007fd,"The U.S. Regulates Cars, Radio and TV. When Will It Regulate A.I.?",2023-08-24 09:00:56
nyt://article/d7bea821-9e02-5c91-8bb3-60ac863091f1,"Olivia Rodrigo, Pop’s Brightest New Hope, Just May Be a Rock Star",2023-08-24 09:01:03
nyt://article/86248f7b-5f58-5cb8-a1db-0bbde12fc5ba,A Speck of Old Iceland in Ice-Cold Lake Michigan,2023-08-24 09:01:28
nyt://article/02cf9f01-d917-5071-8f48-2cda278d1cdd,How China Made Its Housing Crisis Worse,2023-08-24 09:01:33
nyt://article/a9f9d7b8-60c4-5eb7-a8a4-64d89eac2f30,From School Bells to Wedding Bells,2023-08-24 09:01:33
nyt://article/ca7cd8a9-d49a-5e84-8b34-c4b5d7ae018c,What Can Literature Teach Us About Forgiveness?,2023-08-24 09:01:33
nyt://article/e6774474-d9c9-5216-b0ca-cc1765aed273,How a Harvard Professor Became the World’s Leading Alien Hunter,2023-08-24 09:01:33
nyt://article/ee99daae-a72e-5df4-9208-72e37f304586,"It’s Clear That Ron DeSantis Is No Longer on the Rise, but Someone Else Is",2023-08-24 09:01:33
nyt://article/f61fc352-5704-51c1-ae69-87025b2837ac,"On Immigration, Republican Candidates Show Little Disagreement at Debate",2023-08-24 09:01:33
nyt://article/40a48419-b5bd-555d-a911-b20718793bc9,"Despite Cheating Fears, Schools Repeal ChatGPT Bans",2023-08-24 09:01:34
nyt://article/45fc9497-2d97-5514-9dbd-8ba73ffa9379,"One Year Later, Powell Faces a Changed Economy and Market",2023-08-24 09:01:37
nyt://article/dc3b0f2b-aca0-53cc-89a7-a54066b5d94c,The Unusual Legal Agreement Behind ‘The Blind Side’,2023-08-24 09:01:38
nyt://article/f4badcde-262b-58d3-b2da-06c8b33d91ec,Republicans’ Onstage Clashes Highlight Fault Lines Within the Party,2023-08-24 09:09:39
nyt://article/0728012e-9f2b-5bd7-8aac-b2ba1a1c08ea,How teachers and students feel about A.I.,2023-08-24 09:11:23
