_id,headline,pub_date
nyt://article/a23099da-9921-5d43-a840-2e19073290f2,A Palestinian Restaurant Perseveres in War’s Shadow,2023-10-15 07:01:05
nyt://article/f66eddd7-8466-5c83-8bef-ae2f03102ed8,"Corrections: Oct. 15, 2023",2023-10-15 07:25:37
nyt://article/b013bf24-f08a-578c-a8bb-7ee828525d6d,Powerful Earthquakes Hit Afghanistan for the Fourth Time in Just Over a Week,2023-10-15 07:33:51
nyt://article/1f63dba5-084b-5682-8a9b-11ae3cd87c76,8 Sex Myths That Experts Wish Would Go Away,2023-10-15 09:00:21
nyt://article/2763b25b-dc93-5279-9f9d-8ae0434bdef7,‘Big Jim’ and Babydog Go to Washington?,2023-10-15 09:00:25
nyt://article/190a581a-58b2-5be7-89a1-097d5471fff2,"Good Mom, Bad Mom, Possessed by Evil Mom",2023-10-15 09:00:26
nyt://article/0dd505f3-2264-5c47-ae56-b208c21582ab,Looking Beyond a Dancer’s Confident Grace in ‘States of Hope’,2023-10-15 09:00:38
nyt://article/b89c9984-3a3b-5802-a08a-213a20ba9ec5,Goodwill Tries to Figure Out Online Commerce,2023-10-15 09:00:38
nyt://interactive/7f9da82c-2a2d-5402-ac65-e03264aa6392,A Wildlife Oasis Opens Atop a Notorious Former Dump,2023-10-15 09:00:50
nyt://article/a4ba6f83-d0da-5244-a378-a529e3605fd8,The Essential Vladimir Nabokov,2023-10-15 09:00:56
nyt://article/9255d2f2-027e-51a4-bb27-56b4cda8cb5a,Nikki Haley’s Past Stance on Israel Could Be Key to Her Campaign’s Future,2023-10-15 09:01:08
nyt://article/23750be4-e5b6-555d-8ac7-0f48265c5f60,Is There Fascist DNA in the U.S. Body Politic?,2023-10-15 09:01:19
nyt://article/6150d35a-0fcc-5947-bc05-921066f8d19a,"Tanya Chutkan, an Unflinching Judge in the Trump Jan. 6 Trial",2023-10-15 09:01:38
nyt://article/567838b6-7c37-5b1e-b6d1-6501744cf317,How Megafires Are Remaking the World,2023-10-15 09:02:12
nyt://article/b0a0d5cb-2758-58de-93b8-2af42212d01b,‘I Have to Do Better.’ A Young Father Was Rebuilding His Life When the Flames Came.,2023-10-15 09:02:12
nyt://article/e68c4ba2-0ed5-5ffd-88ba-07af370dcb7c,How a Fertilizer Shortage Is Spreading Desperate Hunger,2023-10-15 09:02:12
nyt://article/c5692b3d-6a7e-5ec5-9a30-69d4f9eb6a6b,What Pain Will a New Wave of Student Loan Payments Bring?,2023-10-15 09:02:38
nyt://article/847a4a17-92ad-5032-95f8-3af456b2549b,‘I Want to Be Forgiven. I Just Want to Be Forgiven.’,2023-10-15 09:02:50
nyt://article/88d91ba5-9fb8-5bfb-b8da-07ac1665ebcc,"When Roz Chast Closes Her Eyes, Chris Rock and Nasty Babies Open Theirs",2023-10-15 09:02:50
nyt://article/d14f6614-e5af-5c19-a746-cccfb49dfb49,"Facing Scrutiny, a Museum That Holds 12,000 Human Remains Changes Course",2023-10-15 09:02:56
nyt://article/fc926c4a-95d5-5283-b195-c08cf2c71907,A New Membership Club Bets on Black Business,2023-10-15 09:02:58
nyt://video/dbe649f2-240b-5e14-90f7-e4ff97c8cf46,‘A Day of Horror:’ Kibbutz Massacre Survivors Recount Hamas Attack,2023-10-15 09:03:39
nyt://article/e0a1a796-9211-5dd9-8e8e-9e7e173febcc,"Wearables Track Parkinson’s Better Than Human Observation, Study Finds",2023-10-15 09:03:47
nyt://article/a4bcd7c5-8361-5ed3-bc50-f102a598795e,"Daniel Noboa, Scion of a Banana Empire, Wins Ecuador’s Presidency",2023-10-15 09:04:01
nyt://article/5f8f34e4-e5a5-5620-af6a-85f0cac6db51,The Schoolyard,2023-10-15 09:04:03
nyt://article/3aa09df9-8d89-5721-849f-ffca2dbc5fae,Slaughter at a Festival of Peace and Love Leaves Israel Transformed,2023-10-15 09:04:24
nyt://article/275aa84d-0103-53fe-8a33-3d358eba4d52,Why the Safety of Israeli Hostages Must Come First,2023-10-15 10:00:03
nyt://article/3a3655ea-39d8-5b41-ab72-32dd21cbf80a,The U.S. Should Think Twice About Israel’s Plans for Gaza,2023-10-15 10:00:09
nyt://article/9849f546-03b8-5f5c-9d8d-0aa05631cdaa,Why New York Needs a Right to Shelter,2023-10-15 10:00:09
nyt://article/3f6910e3-5a47-5459-bfd2-8ffaf420d0df,The Moral Questions at the Heart of the Gaza War,2023-10-15 10:00:10
nyt://article/954b4bd4-52a1-5785-86df-910c4a895f4d,The Sunday Read: ‘Is Måneskin the Last Rock Band?’,2023-10-15 10:00:12
nyt://article/40ae2117-0934-5961-a3ee-59af3317a3f8,Ukraine Worries That Prolonged War in Gaza May Dilute Global Support,2023-10-15 10:39:36
nyt://article/97c7a4c8-da31-57bc-a76b-636cb66283be,A Parade of Strikeouts,2023-10-15 11:53:03
nyt://article/2d597f36-4bd6-523e-b3be-82e727009918,"Biden Campaign Raises $71.3 Million, Far Outpacing Trump and Republican Field",2023-10-15 12:00:07
nyt://article/9b4940a9-b1a1-5a53-ac09-aa6c59af1306,Famed Iranian Filmmaker Is Killed in His Home,2023-10-15 12:13:50
nyt://article/ea5a31ac-4165-5848-963d-697621ad9967,Gaza’s Hospitals Face ‘Impossible’ Choices With Israel Evacuation Order,2023-10-15 12:49:43
nyt://article/6d2cc89c-b7b7-58d9-a131-af9d41df54be,Australia Fines X for Not Providing Information on Child Abuse Content,2023-10-15 13:00:09
nyt://article/49e898de-4287-5a52-b3c3-e4e3dc6b0f76,Suspect in Natalee Holloway Case Expected to Plead Guilty to Extorting Her Mother,2023-10-15 13:07:59
nyt://article/f1acb9bf-8e5d-5145-8a28-698f90973cd3,Is a Women’s Museum Still Relevant?,2023-10-15 14:38:21
nyt://article/458fda3f-2fd2-5521-b6eb-ccce6e4a3943,"Phyllis Coates, the First Lois Lane on TV’s ‘Superman,’ Dies at 96",2023-10-15 14:42:22
nyt://article/04c5f1af-73e8-5be9-b03b-1241da9a9e50,"Buttery Roti, Velvety Avocado Pasta and Chewy Chow Fun",2023-10-15 15:00:02
nyt://article/fc07a6a7-aaa8-5c1f-996e-2c736ee492c1,"An Israeli Doctor, Off to War: ‘We Have Nothing Against the People of Gaza’",2023-10-15 15:38:04
nyt://article/abec8e39-400f-5544-ab4d-753c981b48a1,U.S. Expanding Military Presence Near Israel,2023-10-15 15:52:20
nyt://article/871a9e9b-c2e3-5615-93f2-05cdaa31e862,Taylor Swift’s ‘Eras’ Is Easily the Biggest Concert Film Opening Ever,2023-10-15 16:03:05
nyt://article/c7161597-75af-5113-9908-0fe5270602a9,"In Conservative Media, Biden Is to Blame in the Hamas-Israel War",2023-10-15 17:01:04
nyt://article/6f1be9be-b071-5caa-9e25-18272ccf8fe9,DeSantis Will Participate in Nevada Caucuses Despite Criticizing Them,2023-10-15 18:19:44
nyt://article/454b9dfb-2f37-5c91-9a16-d4d2e284384e,Help for Gaza Refugees Creates a Flashpoint for DeSantis and Haley,2023-10-15 18:46:03
nyt://article/81647249-03f5-53a6-952f-a9a9fadabdf4,"Suzanne Somers, Star of ‘Three’s Company,’ Is Dead at 76",2023-10-15 20:38:26
nyt://article/b375cf29-624e-526d-879d-075ee87a7736,Monday Briefing: A Race to Ease the Gaza Crisis,2023-10-15 20:43:43
nyt://article/c574a65d-64f7-513e-8098-9446aeb69a17,F.B.I. Tracks Increased Threats to Jews and Muslims After Hamas Attack,2023-10-15 20:52:02
nyt://article/0d3bfe72-345d-5257-89ae-1ba0675c8295,"Warning of ‘Grave’ Errors, Powerful Donors Push Universities on Hamas",2023-10-15 21:00:54
nyt://article/02772441-60d6-5d06-88c8-cbaf6f54d889,"6-Year-Old Boy Fatally Stabbed in Anti-Muslim Attack, Authorities Say",2023-10-15 21:05:32
nyt://article/21399257-416b-5336-b28c-d8d72a061eca,Israelis Gird for a Deeper War Amid a Crisis of Trust in the Government,2023-10-15 21:34:37
nyt://article/33ccb0a6-be19-56d0-bb93-f95ac998f3d5,Finish School,2023-10-15 22:00:07
nyt://article/98a16904-e7ce-5863-9369-c73d6876ea32,Centrist Parties Poised to Oust Poland’s Nationalist Government,2023-10-15 22:04:48
nyt://article/8ce981a3-5909-5d28-87d4-bf66eadc4ad3,Gaza’s Hospitals Face ‘Impossible’ Choices With Israel Evacuation Order,2023-10-15 22:25:37
nyt://article/2ab9cf61-c64e-5bd2-a23e-c2d47c3a62f7,"For American Evangelicals Who Back Israel, ‘Neutrality Isn’t an Option’",2023-10-15 22:42:45
nyt://article/dca0b83e-ea40-5b46-a635-eeaf383b1031,Biden Warns Israel Not to Occupy Gaza,2023-10-15 23:00:09
nyt://article/36465168-dde9-5ae1-b85f-2eaf3048d6da,"As Israeli Invasion Looms, Diplomats Seek to Meet Gaza’s Dire Human Needs",2023-10-16 00:00:10
nyt://article/71127e62-5c8c-507f-9d9e-c6926cc66ec3,"Fearing Escalation, Biden Seeks to Deter Iran and Hezbollah",2023-10-16 00:55:55
nyt://article/00ffe819-5c16-583b-9b78-d92bef15371f,Biden administration seeks emergency aid package for both Israel and Ukraine.,2023-10-16 00:57:12
nyt://interactive/40c4e546-9b49-5420-bbcc-09d8e7bc75e5,Inside a High-Security Virus Lab,2023-10-16 01:40:39
nyt://article/7950f379-1ba9-5a89-be76-3b2372f022cc,"Rite Aid, Facing Slumping Sales and Opioid Suits, Files for Bankruptcy",2023-10-16 02:34:18
nyt://article/05d99db6-9ab0-528f-9c31-c78fccea8357,"Trump’s Giant Lead Is Financial, Too: 6 Takeaways From 2024 Filings",2023-10-16 03:36:27
nyt://article/e9dea624-f0b2-5f2c-bead-04309ce519c3,China Got a Big Contract. Nepal Got Debt and a Pricey Airport.,2023-10-16 04:01:44
nyt://article/79ced2b9-9105-589f-a183-9958440320ce,Quotation of the Day: Museum Reckons With Remains Collected From Racist Research,2023-10-16 04:13:32
nyt://article/2a50c2c2-7dd7-515f-b37a-5c86f36d1795,"No Corrections: Oct. 16, 2023",2023-10-16 04:14:56
nyt://article/4b1f22ed-ba5e-5ef9-978f-b18169de27cc,Monday Briefing,2023-10-16 04:43:08
nyt://article/8ac68168-d325-5be4-9075-b2518dc25209,This Is What America Is Getting Wrong About China and Taiwan,2023-10-16 05:00:19
nyt://article/1020a1f4-cc71-5ba8-a3ab-cd1dda04a6d0,What’s on TV This Week: ‘aka Mr. Chow’ and Some Spooky Movies,2023-10-16 05:00:21
nyt://article/c7bdcc7f-14e7-556b-856e-5a82256510ec,Word of the Day: paragon,2023-10-16 06:00:03
nyt://article/f5a36e2b-0656-54c2-97c3-e8c024301c8f,Today’s Wordle Review,2023-10-16 07:00:03
nyt://interactive/627f83df-2202-55c0-b53d-e1a2e21a5beb,Inside the DeSantis Campaign 2.0 ,2023-10-16 07:00:05
nyt://article/f6135557-6f53-5a5b-b954-0de9f0ee0ffd,Spelling Bee Forum,2023-10-16 07:00:14
nyt://article/6c8d3dc1-905a-5a57-8552-452b4a8315a1,The Real Estate Tycoon Whose Fingerprints Are on the Menendez Indictment,2023-10-16 07:00:21
nyt://article/a06724ca-996f-5f15-bdb8-056e18e520f2,‘Kidnapped’ Posters Express Anguish Over Israeli Hostages,2023-10-16 07:00:30
nyt://article/60063d76-4a7e-5314-b624-b833d9035a28,"A Father, an Earthquake and the Desperate Search for a Missing Son",2023-10-16 07:00:31
nyt://article/b0c51acf-044a-5ab7-9ee0-90c0a462683e,How to Finish Marathon Training Strong,2023-10-16 09:00:15
nyt://article/80894888-155d-5688-9ad5-d53099be4be2,How ‘A.I. Agents’ That Roam the Internet Could One Day Replace Workers,2023-10-16 09:00:20
nyt://article/d568db7c-862f-5193-8ee0-e521031679ec,Teju Cole Knows His New Novel Resembles Autofiction. Please Don’t Be Tempted.,2023-10-16 09:00:22
nyt://article/64064003-6719-5be0-8c81-be296777b34a,Robert Sapolsky Doesn’t Believe in Free Will. (But Feel Free to Disagree.),2023-10-16 09:00:31
nyt://article/0be6eb1e-9d43-5295-b3a5-7f95fe836727,Lab Leak Fight Casts Chill Over Virology Research,2023-10-16 09:00:33
nyt://article/55dbef3b-83f0-5aeb-8484-0d1cf6c606cb,Harvard Cozies Up to #MentalHealth TikTok,2023-10-16 09:00:35
nyt://article/bdb2ad4b-7ef1-59f9-a837-ba74f46d36a5,Is It a Moral Awakening or Just One Man’s Midlife Crisis?,2023-10-16 09:00:42
nyt://article/8628f043-3c27-5ff4-8834-d3433c60b885,"After ‘Taylor Swift: The Eras Tour,’ Stream These 8 Great Concert Movies",2023-10-16 09:00:53
nyt://article/983605e0-f09d-5cbc-8aa9-19bfd08d3231,Earrings That Channel the Irregularity of the Universe,2023-10-16 09:00:53
nyt://article/12eb6148-08f0-53b2-9f87-bde97a561c71,Please Don’t Eat This Fruit,2023-10-16 09:01:03
nyt://article/e8ab6592-3795-5f0f-84d3-e0eb29073dfb,The Secret to Unlocking One of the Universe’s Greatest Mysteries,2023-10-16 09:01:03
nyt://article/0a08e336-c1cd-5a79-a3c5-d63c753e3171,This Is What My Belly Looks Like,2023-10-16 09:01:04
nyt://article/348bcbff-e08e-5d90-8590-9779324a2fb6,A Tequila Distiller Turns a House into a Showcase for Mexican Design,2023-10-16 09:01:13
nyt://article/691035cd-f5ed-53dc-959e-eede4b0581d7,Swashbucklers of Comic Con: Please Report to the Lost and Found,2023-10-16 09:01:17
nyt://article/3cad580a-3141-59e8-ba38-77ac5a8e3fc6,"Coyotes in Queens? Yes, There Are a Few.",2023-10-16 09:02:15
nyt://article/ffc6abb0-2f19-5d09-a985-d16f4fa2a0ab,"As the Strike Wears On, Actors Turn to a Familiar Fallback Job",2023-10-16 09:02:16
nyt://article/130559a4-b118-5413-ae87-d2e7a4506fb7,"After Devastating Floods, Vermont Is ‘Very Much Open’",2023-10-16 09:02:17
nyt://article/3fcd07f6-0fc5-5b1d-863a-b3fd93709c51,"Annie Leibovitz, Now an Empty-Nester, Lists Upper West Side Duplex",2023-10-16 09:02:17
nyt://article/60975903-d514-5470-adb9-3ebb5f8669c7,The Five-Day Office Week Is Dead,2023-10-16 09:02:31
nyt://article/0b016f47-82d6-5155-ab20-7edafb5f9f1a,$1.9 Million Homes in California,2023-10-16 09:02:43
nyt://article/8ab32de9-7c39-5b37-9639-4a730bef9023,He Called the Pope a ‘Filthy Leftist.’ Now He Wants to Be President.,2023-10-16 09:02:45
nyt://article/b80f5e18-26a7-52d7-9ee4-205ed97d518a,The 25 Best Restaurants in New Orleans Right Now,2023-10-16 09:02:57
nyt://article/88c05e9a-8d12-58d7-a425-d660a5e22f70,Should Schools Teach Students Kitchen and Household Skills?,2023-10-16 09:03:40
nyt://article/95b576be-1dca-53c4-8258-4eba416d6861,The Plot Trump Lost,2023-10-16 09:03:45
nyt://article/491fedee-4e07-5fb3-9f5a-fa36c765b46c,Can I Wear Cowboy Boots Without Looking Like I’m in Costume?,2023-10-16 09:03:46
nyt://article/a62125f8-372d-5b1c-903d-da8c7309faaa,Judge Imposes Limited Gag Order on Trump in Election Case,2023-10-16 09:03:47
nyt://article/9df8d751-14dc-57fb-96e7-527fbe439c38,Climate Advocacy Group Plans to Spend $80 Million on Ads to Aid Biden,2023-10-16 09:03:48
nyt://article/5e288aa2-6eae-5792-9327-da255868b361,A Legal Fight Over Whether Governors Can Deny Thousands the Vote,2023-10-16 09:03:54
nyt://article/955b431a-c35c-5fd4-9a3a-c9ce13315821,I Saw What Happened to America’s Postwar Plans for Iraq. Here’s How Israel Should Plan for Gaza.,2023-10-16 09:04:00
nyt://article/604d0c4d-33b1-5e61-aeed-5e7944bb95b2,There’s Still No House Speaker. What Happens Now?,2023-10-16 09:04:01
nyt://article/4b820c7d-8e5b-549d-a093-bc42760f9c5c,"Hundreds of Thousands Flee Northern Gaza, and More",2023-10-16 09:45:02
nyt://article/13888b95-703c-5ef4-8449-784c03a1ca44,Voices From Gaza,2023-10-16 10:00:09
nyt://article/39a18778-a4a6-5786-8a70-c2d1b221f95e,A Shift in Gerrymandering,2023-10-16 10:49:27
nyt://article/63cba3bf-f5e1-5250-87d5-02dc82247566,Twins Are Born in Gaza After Their Mother Flees to the South,2023-10-16 10:50:35
nyt://article/90f47ffc-2a26-5361-988f-cc7216fcb75c,Israel’s Corporate Defenders Grow Louder,2023-10-16 12:02:51
nyt://article/9a01acb7-94c9-5574-ad4e-50c1b0156884,What’s in Your ‘Spend the Night’ Bag?,2023-10-16 12:10:07
nyt://article/60428dd5-43ad-513e-8fa8-9504c16fa5c4,"For Hostages’ Families, an ‘Endless Loop of Hope and Despair’",2023-10-16 12:42:59
nyt://article/310830be-ba92-5b51-be0b-f9d9399c16b3,Four Ukrainian Children Abducted to Russia Return Home After Qatar Intervention,2023-10-16 12:56:56
nyt://article/58ab787d-1069-51c2-8db3-cf7b999eb44b,The Past 12 Months in California Were Among the Wettest Ever,2023-10-16 13:00:06
nyt://article/807bf9e5-0a76-5781-a3bd-cae23746db74,What Is a Gag Order and How Is One Enforced?,2023-10-16 13:01:11
nyt://article/23751385-9953-5304-83e7-5e2f92560ad1,The Connections Companion,2023-10-16 13:12:43
nyt://article/9af21806-48ee-5a84-aa71-e15ddce5a028,Israel Will Evacuate Towns Near Its Border With Lebanon as Tensions Escalate,2023-10-16 13:22:42
nyt://article/4e366ef0-f118-5ebb-81ea-f2e429c15c8b,"Margot Polivy, Champion of Women in College Sports, Dies at 85",2023-10-16 13:29:18
nyt://article/74c743d5-a4fa-5fad-8b5f-31aab653e6cc,"Martti Ahtisaari, Conflict Negotiator Given Nobel Peace Prize, Dies at 86",2023-10-16 13:50:21
nyt://interactive/bf602793-ab1a-4117-a34a-1e53782ef1a6,Our Best Eggplant Parmesan Recipe,2023-10-16 13:54:06
nyt://interactive/d0c05829-9b94-4fca-90ac-84e6faa12b4b,"Oscar Isaac, Rachel Brosnahan and the Draw of a Neglected Hansberry Play",2023-10-16 13:54:37
nyt://article/d8fbfaf1-2d64-58e5-92a9-f005bc776c12,"A History of Chinese Food, and a Sensory Feast",2023-10-16 13:54:46
nyt://interactive/84655eee-b694-4f93-be5d-476e91caec17,A Walking Safari in Zambia,2023-10-16 13:56:00
nyt://interactive/da510122-254a-4730-9874-3ce5bb7f83d7,Dave Matthews Band’s ‘Walk Around the Moon’ Review,2023-10-16 13:57:30
nyt://interactive/3e3cfdab-e3eb-4155-88e6-11b9f0485954,Sync Your Calendar With the Solar System,2023-10-16 13:57:54
nyt://article/cdc53f35-0d22-5093-973c-c5de15b812d0,Drake Streams His Way to No. 1 Yet Again With ‘For All the Dogs’,2023-10-16 13:59:58
nyt://interactive/caf23de3-4fa2-4720-b478-328794e231ad,Pedro Almodóvar’s Answer to ‘Brokeback Mountain’,2023-10-16 14:04:07
nyt://interactive/5f676f60-359f-4191-809b-1429f038cbe3,Superman Is Driving DC Studios’ New Strategy,2023-10-16 14:04:25
nyt://interactive/56877570-3349-4139-90aa-11ee6476829e,Adam Driver Calls Out Netflix and Amazon Amid Strikes,2023-10-16 14:05:30
nyt://interactive/ade6ab29-67d1-4c3a-973a-4f52304c14a6,5 Places to See Spectacular Foliage This Fall,2023-10-16 14:05:58
nyt://interactive/f8b4c715-fcfa-5b8f-b768-384048871a4a,Can You Pair These Books With Their Settings in U.S. Cities?,2023-10-16 14:30:05
nyt://article/79c3fef1-4524-5906-ba49-f15ab08dc9f2,China Bet It All on Real Estate. Now Its Economy Is Paying the Price.,2023-10-16 14:39:15
nyt://article/02cc0987-c8a2-5626-bef8-84a02b5108ea,"Yahya Sinwar, Hamas’s Leader in Gaza, Is at the Top of Israel’s Target List",2023-10-16 14:41:52
nyt://article/e9ed8785-0c1e-542d-8dc9-3b1c79b36177,"French Onion Soup, but Make It Chicken",2023-10-16 15:00:03
nyt://article/0af5a281-8000-503f-9c16-ccd29446f61d,Scientists Offer a New Explanation for Long Covid,2023-10-16 15:00:08
nyt://article/9b18be42-a1bb-59e2-b835-81f157b77cef,‘The Lights Are On’ Review: Catastrophizing About the Future,2023-10-16 15:07:46
nyt://article/603dea9b-0666-57b6-8c96-f304fd245c03,"Muslim Boy, 6, Is Mourned After Illinois Attack Linked to Mideast War",2023-10-16 15:21:57
nyt://article/8852ae53-7f44-5fe0-8da6-85c00cc81a27,This N.Y.C. Building Is in the Bird-Killing Hall of Shame. It Wants Out.,2023-10-16 15:43:31
nyt://article/085b7307-05cd-54d0-b0af-404b9e31e4b6,Families Separated at Border by Trump Reach Settlement,2023-10-16 16:09:42
nyt://article/6977170f-65ee-54ff-9eaf-2ed11dc5ee3c,Consulting Firm That Works With Nikki Haley Faces a Sexual Assault Lawsuit,2023-10-16 16:10:04
nyt://article/1fb704be-938a-55ee-a8ea-7013662d6022,The Salmon on Your Plate Has a Troubling Cost. These Farms Offer Hope.,2023-10-16 16:13:49
nyt://article/ef9fb6a3-87a2-5e1e-a3b6-7ee3df9b7962,Yellen Assures Europe That U.S. Will Provide More Funds for Ukraine,2023-10-16 16:28:48
nyt://article/d6074e4a-32cd-5ecf-a253-2ac7bb275a3b,"Deer Are Everywhere, but We Barely Know Them",2023-10-16 16:31:17
nyt://article/4ce12229-8a27-57ee-b06d-daaeb4108e06,Stark Gender Imbalance at U.S. Opera Companies Extends Beyond Podiums,2023-10-16 16:44:32
nyt://article/81aeb518-90e8-57b3-a64b-cb6fabfff677,"At Menendez’s Island Resort Fund-Raiser, Donors Were Scarce. So Was He.",2023-10-16 16:54:52
nyt://article/c0cb13d2-e07f-5637-84d7-f4f0237f2048,Why a Gaza Invasion and ‘Once and for All’ Thinking Are Wrong for Israel,2023-10-16 17:13:10
nyt://article/e0739f76-d3d0-5a3c-8f76-28c82bf6edba,"Before Goop, There Was Suzanne Somers",2023-10-16 17:14:13
nyt://article/18cb24f7-589e-5297-bc5c-6a3af3c5254b,Top FTX Executive Says Sam Bankman-Fried Used Customer Money for ‘Excess’ Spending,2023-10-16 17:27:52
nyt://article/a2a00bb2-b880-5117-b7ea-f624437141c5,Ethical and Strategic Issues Facing Israel,2023-10-16 17:27:56
nyt://article/dfc41edb-aa1b-53b3-a3f7-2869992c2c83,Saving Yellowstone for the Grizzlies,2023-10-16 17:40:20
nyt://article/d64aa3a6-6db1-5618-8039-c269cc037c22,Satellite Photos Show How Russia Could Be Shipping Arms From North Korea,2023-10-16 17:49:20
nyt://article/e905f3fe-a0bc-5703-9616-937f22478a97,James Beard Celebrates Día de los Muertos With Ana Castro and Fany Gerson,2023-10-16 18:03:59
nyt://article/116de88a-deee-5b9f-bf4f-e2e140947df3,Confusion and Frustration Reign at Egypt-Gaza Border,2023-10-16 18:04:59
nyt://article/4c7d3a37-f23d-5610-bdef-84ce524ac156,"‘The Sea Beyond’ Review: Juvenile Detention, Italian-Style",2023-10-16 18:15:18
nyt://video/18c9c16a-fc7c-55bd-8459-d4ede27182b5,Stuck at Gaza’s Border With Egypt,2023-10-16 18:18:19
nyt://article/3ea5980c-7a2b-59e1-8ae5-d57f4fb57ec5,Bad Bunny Looks Back and Hunkers Down,2023-10-16 18:24:18
nyt://article/d8a93068-0ce5-5472-a710-378b07261305,Biden Faces Risks in Wartime Visit to Israel,2023-10-16 18:31:35
nyt://article/ec0d8e75-17e5-58ae-9af8-ec89e0710736,What Have You Wanted to Know About Crosswords?,2023-10-16 18:48:07
nyt://article/daaddec7-9df5-5fe7-9aea-eea65ecdff74,Bill Ford Says U.A.W. Strike Is Helping Tesla and Toyota,2023-10-16 18:53:26
nyt://article/19f415e0-027b-58a3-9b36-978a3da50720,An X-Wing Model From the Original ‘Star Wars’ Sells for $3.1 Million,2023-10-16 18:59:35
nyt://article/56e4d15a-6272-5aad-ae91-85b360ba323d,Tim Scott’s Super PAC Pulls the Plug on Fall Ads,2023-10-16 19:00:21
nyt://article/2bf603da-c7cb-5d06-afb4-620e10cf9c9f,Social Media Users Accuse Facebook and Instagram of Suppressing Pro-Palestinian Posts,2023-10-16 19:03:45
nyt://interactive/b7438cf2-0f86-58f0-bda6-1b0ae02d77df,Getting Dressed with Beenslackin,2023-10-16 19:04:32
nyt://article/75250118-169f-50a7-b03f-0ce2d609b835,"With Opposition Gains, Poland Looks to Unwind an ‘Illiberal Democracy’",2023-10-16 19:34:57
nyt://article/0fe58a08-f13d-5301-9a6f-b5d901db01fd,"More Than 400,000 Student Loan Borrowers Had Wrong Monthly Payments",2023-10-16 19:38:17
nyt://article/a500dfe5-ae75-5d53-aedd-ccc15c82d6b8,"Jordan Inches Closer to Speakership, but Republican Holdouts Remain",2023-10-16 19:42:33
nyt://video/60910465-3171-569c-b7b1-0b016ae4688b,100-Year-Old Shipwreck Is Discovered in Lake Superior,2023-10-16 20:03:16
nyt://article/d953f078-fec2-5dfa-b24e-c39153b2ef43,"Dog Rescued After Freighter Crash (To Be Clear, It Was 100 Years Ago)",2023-10-16 20:03:19
nyt://article/42bd0eeb-8bfe-51b8-948e-ab08b0caafdf,"Andy Bean, 11-Time Winner on the PGA Tour, Dies at 70",2023-10-16 20:06:11
nyt://article/886b9fb5-f47e-5327-ab8f-4bfa1f19c391,"For Book Fairs, Scholastic Will Separate Titles That Deal With Race and Gender",2023-10-16 20:12:50
nyt://article/692831f8-328b-5cba-aae3-8688e2703180,Down the Rabbit Hole With Miffy,2023-10-16 20:18:54
nyt://article/edf744f8-517a-5219-81ec-a50a178bf859,U.S. and Israel Focus on Hezbollah’s Next Move After Hamas Attack,2023-10-16 20:21:25
nyt://article/ce1246c1-1268-5c61-9f2c-23ff0c7c6e6d,Suspect in Brussels Attack Had Been Known to Belgian Authorities for Years,2023-10-16 20:30:34
nyt://article/c5028240-4834-57cf-9d60-6ff53cc7761d,Supreme Court Again Lets Biden’s Limits on ‘Ghost Guns’ Stand,2023-10-16 20:38:14
nyt://article/cf299528-055c-5a54-b754-5d7d577fb6c7,"In Legal Peril at Home, Trump Turns to a U.K. Court for Vindication",2023-10-16 20:43:11
nyt://article/be005701-4d5f-5a60-ab27-cc41268ae81a,Tuesday Briefing: Biden Weighs a Visit to Israel,2023-10-16 20:44:11
nyt://article/da5be581-5ea7-5fad-83c2-f6492a37b3c2,LinkedIn Cuts 668 Jobs in Second Layoff Round This Year,2023-10-16 21:02:08
nyt://article/b72945e1-36e5-5e54-8369-0826afe46b96,F.D.A. Plans to Ban Hair Straighteners With Formaldehyde,2023-10-16 21:29:58
nyt://article/da4575b9-7388-5d93-8d3c-fc65ca172112,W.H.O. Chief: Doctors and Patients Face Impossible Choices in Gaza,2023-10-16 21:34:04
nyt://article/f5f373e4-df01-5787-836e-f4f3a583b560,Biden Weighs Visiting Israel,2023-10-16 21:40:20
nyt://article/f72928f5-d53c-5cb5-805a-d5a421a02c7c,"Tracking Cellphone Data by Neighborhood, Israel Gauges Gaza Evacuation",2023-10-16 21:59:56
nyt://article/5e8e748b-9b8d-5be8-a26e-1f2233a5a149,"Oprah Floated a 2020 Presidential Ticket With Mitt Romney, Book Says",2023-10-16 22:15:26
nyt://article/8e3dadf8-b569-510a-8596-0ea1b328e5e1,Hamas Posts Hostage Video of Woman Abducted From Israeli Music Festival,2023-10-16 22:55:04
nyt://article/52891b20-020f-5528-ae0b-002d8571f1d5,Piling Horror Upon Horror,2023-10-16 23:00:08
nyt://article/297b8944-911e-55f8-b81d-c7af0c52e1f0,The Strange Decline of the Pax Americana,2023-10-16 23:00:10
nyt://article/95e2f8c3-4546-5ccf-a347-d1f43e85df26,Biden to Visit Israel as Gaza’s Crisis Worsens Under Siege,2023-10-16 23:00:25
nyt://article/d9f5e89b-b336-5fcd-82db-d0bc6db58642,Trump Vows to Reject Gazan Refugees After Israel Attack,2023-10-16 23:07:26
nyt://article/c2880951-8518-580d-abb1-bbdb77c1bd08,"10 Stops in 5 Days, Plus an Air Raid Shelter, for Blinken",2023-10-16 23:27:52
nyt://interactive/604d0167-5516-5391-96da-1e9da95e7820,An American Puzzle: Fitting Race in a Box,2023-10-16 23:29:24
nyt://article/89ca2a80-ea52-5d05-9655-5ece8ccab4e4,Murders in U.S. Fell 6 Percent in 2022 as Violent Crime Declined,2023-10-16 23:33:02
nyt://article/b3a52978-8630-5261-989e-4fa843904788,"Biden, Trolling Trump, Joins Truth Social: ‘Converts Welcome’",2023-10-16 23:34:13
nyt://article/3615b988-3229-5c4c-8267-054b5c9e4203,"Please, New Yorkers Beg, Make the Weekend Rain Stop",2023-10-16 23:37:12
nyt://article/67167c9c-a35a-5e52-a470-634d4b2f149a,"Amid Migrant Influx, Massachusetts Will No Longer Guarantee Shelter",2023-10-16 23:41:45
nyt://article/310ceace-6d3c-52fc-aad7-6b6ea3895b59,Justice Barrett Calls for Supreme Court to Adopt an Ethics Code,2023-10-17 01:00:12
nyt://article/83b829fd-bf3e-55ba-9a0f-1e64d333b39c,Iran warns of ‘multiple fronts’ if Israel’s Gaza attacks continue.,2023-10-17 01:55:59
nyt://article/0b689555-148b-5ffe-bd0d-22670a3de486,Disorderly Pile,2023-10-17 02:00:07
nyt://article/7499a527-c02c-5090-86d0-abdcdb8fab5b,"Four Men, Including One Held on a Murder Charge, Escape From a Georgia Jail",2023-10-17 02:09:24
nyt://article/99f919d4-08b0-5143-9f07-9927a3b2f152,China Invested $1 Trillion to Gain Global Influence. Can That Go On?,2023-10-17 02:32:42
nyt://article/76b08c34-c92d-5c6c-aaac-87d61fdcefcf,New York’s governor heads to Israel on Tuesday.,2023-10-17 02:52:41
