_id,headline,pub_date
nyt://article/570a9228-687b-5c5a-bbf2-cdb22117a64a,What Happens Next for Kendrick Lamar and Drake? Let’s Discuss.,2024-05-08
nyt://article/eaef915c-48d8-58f9-b195-e26fc9c75b9f,Review: Need Good Dances? Try Tharp,2024-05-08
nyt://article/9e7ae247-f648-5b80-b648-0b5d9f4826e7,"Milton Diamond, Sexologist and Advocate for Intersex Babies, Dies at 90",2024-05-08
nyt://article/24af86c9-62b3-5b3c-9104-df7200cd9653,An Inside Look at the Student Takeover of Columbia’s Hamilton Hall,2024-05-08
nyt://article/b84359df-7160-5731-bd0c-23e203af5855,House Republicans Attacked. New York’s Chancellor Defended His Schools.,2024-05-08
nyt://article/b887b512-3094-50d0-af29-a8d5f92f51c9,Why Did Camille Charrière Pick a Fight With Kim Kardashian?,2024-05-08
nyt://article/954c3f66-9620-59b2-9e11-939b1b81731e,Grover Cleveland Didn’t Lie About His Sex Scandal,2024-05-08
nyt://article/ab87f036-0a7d-5798-960d-860b8a40cc62,What We Know About the Weapons the U.S. Sends to Israel,2024-05-08
nyt://interactive/61111d92-af07-53a7-8034-b0130a828db1,A Satellite View of Israel’s New Front in Gaza,2024-05-08
nyt://article/1152f285-9ba6-5c1e-bcfb-a7e94bbdb981,‘It Feels Like I Am Screaming Into the Void With Each Application’,2024-05-08
nyt://article/74fb699d-92a0-5960-8c88-acf8a365a2dd,How the Kendrick Lamar vs. Drake Beef Crashed the Genius Lyrics Website,2024-05-08
nyt://article/bc4de71b-7661-5ddd-8953-8ef0fecaf2d2,"Dick Rutan, Who Flew Around the World Without Refueling, Dies at 85",2024-05-08
nyt://article/f6b1d71d-9b89-5163-af4e-2c25687afb9f,Images of a Brazilian City Underwater,2024-05-08
nyt://article/c0a9fba7-f0ad-506d-aff2-a0002c161a74,Homeowners Who Planned to Demolish Marilyn Monroe House Sue Los Angeles,2024-05-08
nyt://article/339fec5f-6511-50b1-b1c2-f893a67d14d7,Britain to Expel Russian Defense Attaché and Close Some Diplomatic Sites,2024-05-08
nyt://article/b0a1f790-997f-5642-848f-041dfebbf9c0,Tornadoes Are Coming in Bunches. Scientists Are Trying to Figure Out Why.,2024-05-08
nyt://article/8fce8cd0-c7ec-5c20-bc5a-0c5340c3d8c2,The Words That Defined This Week in Donald J. Trump’s Trial,2024-05-08
nyt://article/c0ed7e55-5463-57e2-8b98-b9a92480f831,G.M. Will Retire the Chevrolet Malibu to Make More Electric Cars,2024-05-08
nyt://article/6be8558c-e660-5019-b942-88e9b411741e,Judge’s Decisions in Documents Case Play Into Trump’s Delay Strategy,2024-05-08
nyt://article/fe728faf-3eb7-5422-ad57-a660a6f147dc,Israel’s Rafah Incursion Helps No One Except Netanyahu,2024-05-08
nyt://article/4e75331d-5e78-5116-a557-6da3a63299d3,Ukraine’s Parliament Passes Bill Allowing Some Convicts to Serve in the Army,2024-05-08
nyt://article/b1af8a92-e259-5ddc-8581-449917c2cc0a,House Republicans Clash With Leaders of Public Schools Over Antisemitism Claims,2024-05-08
nyt://article/6983e9c0-b6d4-50fa-82ac-ea8ff63bfd57,Houston Police Chief Departs Amid Inquiry Into Suspended Cases,2024-05-08
nyt://article/2758c5c7-794f-5334-90d2-0a7178f84d42,Suspect in Laken Riley’s Killing Indicted on Murder and Other Charges,2024-05-08
nyt://article/992d3da4-36d1-5e6e-abe6-c6ec70685124,"Pete McCloskey, Republican Who Tried to Unseat Nixon, Is Dead at 96",2024-05-08
nyt://video/f9993140-72b9-549f-94b9-02d7f505cc4f,Police Use Pepper Spray on Protesters on G.W.U.’s Campus,2024-05-08
nyt://article/5df930e0-83e7-5be4-88c2-fe8f4e0490eb,"Biden Pressures Israel for Cease-Fire, and Threatens to Withhold Arms",2024-05-08
nyt://article/f833a4ec-5bd7-5842-9c48-90e737539287,Most Wrongful Death Lawsuits Tied to Astroworld Festival Are Settled,2024-05-08
nyt://article/a5534c8f-007e-563b-bf96-39ed1c602321,Thursday Briefing: Biden Pressures Israel,2024-05-08
nyt://article/a3dfbde5-abe9-5f6f-bfa9-ff0eabacfc66,"Miss Teen USA Resigns From Her Post, Following Miss USA",2024-05-08
nyt://article/d8f88b63-0a21-5dfa-84f0-77f2ddbcf53d,Johnson Survives Greene’s Ouster Attempt as Democrats Join G.O.P. to Kill It,2024-05-08
nyt://article/793cc46d-b7b5-52f6-bdba-accdb1407784,Turning Point or Breaking Point? Biden’s Pause on Weapons Tests Ties to Israel.,2024-05-08
nyt://article/5ef11d4c-ce0b-5e87-958f-660eb659eb91,"Barbara Stauffacher Solomon, Pioneer of Supergraphics, Dies at 95",2024-05-08
nyt://article/a8411ffd-c47d-584f-82eb-d7dca3efbd48,But How Does the Worm Get in Your Brain?,2024-05-08
nyt://article/25a6e8a0-9ac0-5bdc-ba5b-ea3a797f6976,Betye Saar Remains Guided by the Spirit,2024-05-08
nyt://article/f794fabd-00b0-5c54-8925-0b7fde75767a,The U.S. Increased Its Pressure on Israel to Reach a Truce,2024-05-08
nyt://article/f0d56c8c-0f83-5816-bdac-0b4e4794e8e3,Antiwar Protest Camp in Dublin Is Dismantled After College Agrees to Divest,2024-05-08
nyt://article/88c83a26-9427-57a8-a672-82d559cdb743,I Asked South Dakota Dog Trainers About Kristi Noem,2024-05-08
nyt://article/b509244f-838d-5166-b741-ea00bfe619bc,‘Someone’s Going to End Up Dead’: Settlements Over Fatal Astroworld Concert,2024-05-08
nyt://article/3a6c42fb-cbd6-5145-aed7-3499a20949c9,"Disney, Hulu and Max Streaming Bundle Will Soon Become Available",2024-05-08
nyt://article/7e26dc35-9932-5c49-b024-bbf10371d6e8,Young Voters Aren’t Happy With Biden. But Will They Abandon Him?,2024-05-08
nyt://article/c5846733-45f5-5682-8423-10ab07486726,Sony and Apollo’s Plan for Paramount: Break It Up,2024-05-08
nyt://article/baaf8188-4958-5da5-abd5-10cbe2e68c32,Sunak to Urge University Leaders to Protect Jewish Students on Campus,2024-05-08
nyt://article/4fa704b0-01de-501d-8e21-15a88637378b,Biden Says the U.S. Will Not Supply Israel With Weapons to Attack Rafah,2024-05-08
nyt://article/0fbd14d2-119e-5ca2-8337-d6f5f0e58d6e,"Fighting in Rafah and Closure of Gaza Crossings Threaten Aid Operation, U.N. Says",2024-05-08
nyt://article/ff114665-2a9a-5a7a-a158-c14c59fb7296,Ex-Soccer Chief in Spain to Face Sexual Assault Trial for Kissing Player,2024-05-08
nyt://article/6d000e40-5a89-59eb-834f-90b5be57c032,2 Sentenced to Decades in Prison in 1-Year-Old Brooklyn Boy’s Killing,2024-05-08
nyt://article/8ad996f4-bb65-53df-8ee6-8389a31a119d,Apple’s New iPad Ad Leaves Its Creative Audience Feeling … Flat,2024-05-08
nyt://article/c289b1bb-58e1-5957-8d81-332a9481a9ff,Man Sentenced to 25 Years in Stabbings of 3 Homeless Men in Manhattan,2024-05-09
nyt://article/f1ec4f84-32a7-5f71-a6a2-d0e065373daa,"U.C.L.A. Protesters Had Metal Pipes and ‘Occupation Guide,’ Police Say",2024-05-09
nyt://interactive/2e11f040-46f7-5888-bbe9-e786f01e3980,House Vote Count: How Speaker Mike Johnson Survived Motion on Ousting,2024-05-09
nyt://article/c8dbc8cd-f115-57c0-af59-031be52213ef,44-Foot Whale Found Dead on Bow of Cruise Ship Coming Into New York,2024-05-09
nyt://article/f00869a3-910b-57bc-8870-bfa763116208,"Doctor Is Found Guilty of Sexual Abuse of Patients, Including 5 Minors",2024-05-09
nyt://article/36b12181-fb25-5356-b7f4-a47f4868f981,Pro-Trump PAC Joins TikTok Amid Fight Over Its Chinese Ownership,2024-05-09
nyt://article/0ce50ce1-d147-58a0-ae76-54e754dbe95d,Always Ready to Order,2024-05-09
nyt://article/b492c253-fa4e-583f-beef-600c01fab149,Steve Albini’s 10 Essential Recordings,2024-05-09
nyt://article/12019d4e-3e7e-5775-a805-0affbffdc848,U.S.C. President Censured by Academic Senate After Weeks of Turmoil,2024-05-09
nyt://article/31fd7ea1-12c5-59f8-a2ea-3af9eba4e31a,"Quotation of the Day: Haitian Gangs Force 360,000 to Flee Homes",2024-05-09
nyt://article/d5aaa654-8182-5222-9282-b24c5120d288,"Corrections: May 9, 2024",2024-05-09
nyt://article/fcf07b72-f9e2-5d23-9eba-e44957ba7c33,The Tiny Nation at the Vanguard of Mining the Ocean Floor,2024-05-09
nyt://article/84e5c97c-de4d-5d9f-a7e8-4c284e7ff59f,A Guide to Eurovision 2024,2024-05-09
nyt://article/a7cf1125-fd56-5e4c-a698-133785f5d45c,What Happens When a Happening Place Becomes Too Hot,2024-05-09
nyt://article/cf70b248-9a59-5812-86c0-8cb6f1f19a5d,Fencing Rattled by Suspensions and Accusations Ahead of Olympics,2024-05-09
nyt://article/bf9ce864-0bbf-5dcc-a2e2-ea6cbd1c8261,Thursday Briefing,2024-05-09
nyt://article/02cb299e-2f1a-5e6b-b1d7-f373f43703ca,One of the Most Successful Parties in the World Is Staggering to Inevitable Defeat,2024-05-09
nyt://article/7605eb63-df61-5454-8bb4-3873dcfa16b0,Word of the Day: haughty,2024-05-09
nyt://article/3e275142-5d50-5b8e-bdbc-bf6d99066d19,Spelling Bee Forum,2024-05-09
nyt://article/8f719398-8303-54c9-986f-9b5910e41a4b,The Connections Companion No. 333,2024-05-09
nyt://article/955431b7-f5bd-550e-acea-318823ad1246,"Today’s Wordle Review No. 1,055",2024-05-09
nyt://article/66b28559-0bca-549e-9a1b-489a1cd90a59,"A Plan to Help Harlem Students Build Wealth: Start Them Off With $10,000",2024-05-09
nyt://article/a3fcad50-5bc1-5abf-968f-7bd08b95b118,One Seat,2024-05-09
nyt://article/f6a93fe0-57cb-549c-91ef-2d4bf6a529fa,Trump’s Defense Lawyer Argues That Stormy Daniels Was In It for Money,2024-05-09
nyt://article/e91a80de-c176-51f8-955f-66271e548467,Late Night Reacts to the Worm in R.F.K. Jr.’s Brain,2024-05-09
nyt://article/68e56a24-b5b9-57f6-9a04-4420dee9c680,Loneliness Can Change the Brain,2024-05-09
nyt://article/72f3ea5c-7a3e-59c3-92ac-96cbc0538eb0,What Happens When Abusive Parents Keep Their Children,2024-05-09
nyt://article/d15df848-970c-5e53-add9-6e2f3424bd4e,"A New Civil Rights Exhibit Asks: Honestly, What Would You Have Done?",2024-05-09
nyt://article/7c0f7e77-e60a-5ae8-9318-5de175e29bae,Eugene Levy’s Toronto,2024-05-09
nyt://article/083a53a9-40d7-54eb-9fef-e4dc3c12049b,A Former Guantánamo Prisoner’s New Life,2024-05-09
nyt://article/30902785-e649-5c44-ae8a-2a333c06afbe,"In Mexico, a House That Returns to the Well",2024-05-09
nyt://article/15fc5e12-7f17-5660-bf79-f96c5a613f91,These Boots Were Made for Walking (Down the Aisle),2024-05-09
nyt://article/91f66e99-3a18-5f4c-a0d8-6edf0791cabc,"If You Want to Get Stronger, Routine Is the Enemy",2024-05-09
nyt://article/231d1bdc-7eb2-5d81-94f3-4ca75a276f45,"Lawns Draw Scorn, but Some See Room for Compromise",2024-05-09
nyt://article/d100953f-cfd7-5f7c-923a-659325841222,9 Home Designs That Evoke the Flow of Water,2024-05-09
nyt://article/20559b43-1455-5f05-a1d9-1f010e941644,Is It Candy?,2024-05-09
nyt://article/aae700bb-6fe3-5c53-a181-70a2ff3caabe,"At the Met, Sleeping Beauty Wakes Up in the Chemistry Lab",2024-05-09
nyt://article/03479a70-16d8-5b28-8e0b-0b471119a988,How Vision Zero Made New Yorkers Safer and Saved Money,2024-05-09
nyt://interactive/8e1b2a6d-ea16-585b-a525-582d3f0db9ef,36 Hours in Colorado Springs,2024-05-09
nyt://article/6562f615-6ea6-50a1-87ed-2fb24c3bfbe0,The Ever-Resilient Pupfish Makes a Comeback in Death Valley,2024-05-09
nyt://article/d7830b6a-444c-58d5-8f3b-a92b091fd9d9,He Sang ‘What a Fool Believes.’ But Michael McDonald Is in on the Joke.,2024-05-09
nyt://video/e8246eb7-ec31-555d-8353-d6400b2efb0b,Have You Made an A.I. Friend Yet?,2024-05-09
nyt://video/d021a776-8957-5a5b-8209-64ece85245db,Why Donald Trump Is Frustrated With His Lawyers,2024-05-09
nyt://article/65b6f835-a3ce-53ab-bca2-5124d1d6544d,Trump on Trial: ‘The Odds of Conviction Have Gone Up’,2024-05-09
nyt://article/dcae7415-537c-5338-bd35-3ce447c680dd,The Part of the Kristi Noem Saga That I Can’t Shake,2024-05-09
nyt://article/96c5281e-cbdb-5e8d-adde-937b2a390fbf,"How Parents, Students Reacted to Their School Leaders Testifying on the Hill",2024-05-09
nyt://article/a92062fe-c30b-59cf-b8a8-834a5e972822,How a Mechanical Songbird Takes Flight,2024-05-09
nyt://article/1f464eae-159d-5ba2-b34e-a1f664cf9094,Cass Elliot’s Death Spawned a Horrible Myth. She Deserves Better.,2024-05-09
nyt://article/1c69a3be-1390-5174-8b0c-83539fc254bb,Office Wear That’s Ready for After Hours,2024-05-09
nyt://article/018476d5-b187-5516-9815-dec40a2a0089,The Case for Hope,2024-05-09
nyt://article/0eccf191-ed01-5dcc-8d9d-bc403abf210d,How Public School Leaders Upstaged Republicans and the Ivy League,2024-05-09
nyt://article/e86e3430-e57f-5eef-9d71-6aa01f9a3e0d,Meet My A.I. Friends,2024-05-09
nyt://interactive/c981f6ba-1aca-5d18-a87f-e10b8cb68861,The Futurist Living Above the Store,2024-05-09
nyt://article/aa04676a-cd9a-57b2-8604-4e9581646494,Inside the College Democrats’ Rebuke of Biden,2024-05-09
nyt://interactive/46f31321-8e58-554c-8348-b436fb1b5ee5,"In Search of New Scenery, an American Took a Chance in France With a $300,000 Budget. Which Home Did She Buy?",2024-05-09
nyt://article/82e2f345-1306-5529-8623-cd26afe848bf,What Kind of Husband Behaves Like Donald Trump?,2024-05-09
nyt://interactive/dcc0d5ae-b402-5e9f-a1a3-885401f6eef8,This Quiz Will Change the Way You Think About Dog Breeding,2024-05-09
nyt://article/7b613c31-bca1-5373-a75b-c09e02d55bc7,Harris Warns of Supreme Court’s Future Rulings: ‘I Worry About Fundamental Freedoms’,2024-05-09
nyt://article/88160288-9487-55e0-ae0c-75baba28b2ac,‘Gasoline Rainbow’ Review: We’re on a Ride to Nowhere,2024-05-09
nyt://article/1d95994c-eb3a-5a32-8f43-228cb3444962,"10 Big Biden Environmental Rules, and What They Mean",2024-05-09
nyt://article/c667878c-4f7c-5324-8ffb-e3e34199348d,How Andy Serkis Gave Owen Teague the Keys to the ‘Planet’,2024-05-09
nyt://article/32d7a68b-42fe-51e3-8ecd-df2ed57bbcbb,Homes for Sale in New York and Connecticut,2024-05-09
nyt://article/5ede757a-16ea-5a8e-a9f1-2ffdc7cb41d4,Homes for Sale in Manhattan and the Bronx,2024-05-09
nyt://article/7f1319bb-dd59-50cb-89ad-b81e5e031709,How Republicans Echo Antisemitic Tropes Despite Declaring Support for Israel,2024-05-09
nyt://article/b85479ff-4abd-5d08-8f7b-c7562e7a5042,The Cities With the Most Dog-Friendly Rentals,2024-05-09
nyt://article/e4e1b8e1-f834-5a89-876e-a9a1761c634d,Elite Colleges Walked Into the Israel Divestment Trap,2024-05-09
nyt://article/44f68633-cf3a-59d5-abd1-c5e4bec133ab,The C.E.O.s Who Just Won’t Quit,2024-05-09
nyt://article/ed761d0b-0332-536d-9177-f8f68aa464e4,Israel’s Shutdown of Al Jazeera Highlights Long-Running Tensions,2024-05-09
nyt://article/ff961446-8f44-5a36-8334-4a76032fcf99,"Stormy Daniels Faces Trump’s Lawyers, and Biden Blocks Weapons for Use in Rafah",2024-05-09
nyt://article/ae66fd77-4b49-5cc1-95a2-0da732dc1a63,"One Strongman, One Billion Voters, and the Future of India",2024-05-09
nyt://article/6be7731e-4820-5326-a5c1-8810a210bcd1,Biden’s Warning Over Rafah Sharpens a Problem for Netanyahu,2024-05-09
nyt://article/51cdeece-1692-5f91-b540-f6bd3dc9f592,"Tens of Thousands Have Fled Rafah Since Monday, U.N. Says",2024-05-09
nyt://article/96f8d6d6-d25a-58cf-a8e3-f3a1f32dfaef,Artificial Intelligence ‘Friends’,2024-05-09
nyt://article/b14d4b93-5bb0-5cd8-84ff-98a4189be1d6,Why You Can Hear the Temperature of Water,2024-05-09
nyt://article/0512c780-2892-5163-bf04-d5f59a1c339a,‘A Prince’ Review: Let New Passions Bloom,2024-05-09
nyt://article/79684b1c-7397-5167-b8bd-7885845c61e2,‘Aggro Dr1ft’ Review: Glow-Stick Dreams and Thermal Nightmares,2024-05-09
nyt://article/a0118978-ae15-5905-b7f9-f2fd0a4de253,‘Aisha’ Review: Seeking Asylum in Ireland,2024-05-09
nyt://article/093c3ee3-94f2-543f-a969-5d1b7e9c5690,Bank of England Signals Rate Cuts as Inflation Eases,2024-05-09
nyt://article/a160551e-c3c6-5c3b-b8cb-72fe380ff34a,A Plan to Break up Paramount,2024-05-09
nyt://article/b67a4201-0860-5088-b423-db578d13176e,Severe Weather Hits the South After 3 Days of Deadly Storms,2024-05-09
nyt://article/849686ae-0cc9-56c4-90bb-dfdb53faacc6,"At Victory Day Parade, Putin Seeks to Keep Ukraine in the Distance",2024-05-09
nyt://article/cc5ec106-be78-51ce-b6f8-9b602f6bff62,Barron Trump Is Picked to Be Delegate at the Republican Convention,2024-05-09
nyt://article/904e3c92-b061-5804-a878-a9b5e3371367,Should Sporting Events Be Free?,2024-05-09
nyt://article/cf25175e-7eff-5387-a3b7-002507641933,Readers Share Why They Love Living in the Golden State,2024-05-09
nyt://article/bdc6ea17-498a-59fe-bad1-564138963ec6,Scarlett Johansson Shares Her Beauty Regimen,2024-05-09
nyt://article/9f236045-5960-562e-8897-75601fe1afdf,"Review: Impressed, but Not Transported, by ‘Spirited Away’",2024-05-09
nyt://article/9d1fd124-8e47-533f-9282-a8c133fc4a8c,Norfolk Southern Investors Reject Plan to Oust Its Management,2024-05-09
nyt://interactive/88db4b3a-5e22-5228-ac60-289b20122355,The Major Supreme Court Cases of 2024,2024-05-09
nyt://article/1e69db92-d668-5d69-8333-bc73e3755bc2,Mike Johnson Becomes the Speaker of the Whole House. For Now.,2024-05-09
nyt://article/b7bd714f-70fb-5d22-af95-f26a8c107f02,Massive Fossil Donation Helps Brazil’s National Museum Rise From the Ashes,2024-05-09
nyt://article/2623273e-d7ce-595c-9440-37ac6ddfe204,What Students Are Saying About Tech in the Classroom,2024-05-09
nyt://article/4084daff-f071-50ef-9c18-9d6ea5adf21d,Make Yourself a Meatloaf,2024-05-09
nyt://article/e01483a8-b2d9-57a1-a1c9-82b0a0c7cec6,A Pithy YouTube Celebrity’s Plea: Buy This Video Game,2024-05-09
nyt://article/73566ba0-d469-5540-92f7-e3e0dce417ad,Review: An Absent Player in the Spotlight at the Philharmonic,2024-05-09
nyt://article/c63c7141-c72f-54b9-86b2-17c42fce7229,‘Mother of the Bride’ Review: An Old Flame in a Tropical Locale,2024-05-09
nyt://article/387cd955-3005-5efa-84e3-5680d87655ba,Senate Approves Bill to Reauthorize F.A.A. and Improve Air Travel,2024-05-09
nyt://article/31f63fb8-c833-5747-a5fc-0fb4ae03501d,Lawyer Calls Daniels Transactional. She Replies: ‘Not Unlike Mr. Trump.’,2024-05-09
nyt://article/f33eb340-9fa8-5cc8-9c23-67a0fb12bedc,Teaching and Learning About the Pro-Palestinian Student Protests on College Campuses,2024-05-09
nyt://article/cfebd001-2c67-5d99-b318-fda97913ffab,"10 Terrific 2022 Beaujolais to Drink Now, or in a Few Years",2024-05-09
nyt://article/8109e5b4-501c-5f50-b10a-f2596b27b862,Stormy Daniels vs. Donald Trump,2024-05-09
nyt://article/c835d764-9095-5b4b-976c-ce438b4defd9,"Judi Dench’s Eyesight Keeps Her From Reading, but Not From Books",2024-05-09
nyt://article/c2705590-eb06-5e27-a9dd-7cfc62682444,Review: ‘Black Twitter’ Looks at Who Gave the Platform Its Voice,2024-05-09
nyt://interactive/bdef9bc4-e136-5adf-af21-d9e76655abcd,"Transcript of Trump Manhattan Trial, May 7, 2024",2024-05-09
nyt://article/5f0650a4-ec83-500b-9b59-f6336d3af394,A Little-Known Way Home Buyers Can Beat High Mortgage Rates,2024-05-09
nyt://article/5cd7c06b-518e-5f8e-bef5-1d2980a4d1bc,Surrealism Reigns at Tefaf Art Fair,2024-05-09
nyt://article/b5687269-3b49-5144-86f2-5dfc225f119a,Supreme Court Rules Against Women Whose Cars Were Seized by the Police,2024-05-09
nyt://article/3fabc432-ef7a-51c3-8297-719d1b468c99,"‘Time, Patience, Cold Blood’: Mexico Prepares for a Potential Trump Win",2024-05-09
nyt://article/0bb84e28-ae95-57e3-888c-284b58834b37,"In Budapest, Xi Hails a ‘Deep Friendship’ With Hungary",2024-05-09
nyt://article/c6542c87-4ea6-5fd9-8878-152fa19fdb46,"Tuna Crabs, Neither Tuna Nor Crabs, Are Swarming Near San Diego",2024-05-09
nyt://article/b2fbac2a-c46e-5d8c-892b-7ca5edaafbc6,"At a Dinner, Trump Assailed Climate Rules and Asked $1 Billion From Big Oil",2024-05-09
nyt://article/5975d40f-8d89-5de4-be63-2ffa6b4b4f36,"In Letter, 540 Jewish Columbia Students Defend Zionism, Condemn Protests",2024-05-09
nyt://article/c7bbd12a-10c4-5a4e-964b-c90eb9f665b7,A Beginner’s Guide to a Spicy Pantry,2024-05-09
nyt://article/ed1edbb4-62cf-5744-a73e-148c8a7c5a13,An Embarrassment of Style at the Independent,2024-05-09
nyt://article/d48c25f4-d36b-5f07-8b05-63f487d2d53c,Financier Found Guilty in Trump Media Insider Trading Trial,2024-05-09
nyt://article/5ef7fef9-a272-5261-a51a-f67245e34136,‘We Still Have Hope’: Rescuers Race to Find Dozens Missing in South Africa Building Collapse,2024-05-09
nyt://article/6e0ca543-96e9-5167-9109-3e6e57929453,"Ramón Fonseca, Cofounder of Law Firm at Center of Panama Papers, Dies",2024-05-09
nyt://article/aa18b06c-8a94-5a9d-ac89-e0d564c12b80,Reality Show Contestants Compete for an Authoritarian’s Campaign Jingle,2024-05-09
nyt://article/b4c2f192-2fe9-58c9-b911-4478e96253f5,New ‘Lord of the Rings’ Movie Will Put Gollum Center Stage,2024-05-09
nyt://article/60286fcd-09f8-5f67-9aa3-32d2aa6cfa6d,How Poor Tracking of Bird Flu Leaves Dairy Workers at Risk,2024-05-09
nyt://article/4fd918b8-c338-5d3a-9ae0-db39d3a0f823,"Maggie Goodlander, Former White House Adviser, to Run for Congress in New Hampshire",2024-05-09
nyt://article/24e0971d-fbdc-523e-ae0d-fa14d166c9d4,Trump Summons Entourage for Moral Support During Mortifying Testimony,2024-05-09
nyt://article/0be8e63f-8c6b-518f-94a6-25cf893f72f4,Ukraine Strikes More Russian Oil Facilities in a Bid to Disrupt Military Logistics,2024-05-09
nyt://article/b17e0ca8-fd67-5be5-9a3d-1a0d161b29f1,"Boeing Plane Goes Off Runway in Senegal, Leaving at Least 10 Injured",2024-05-09
nyt://article/ffa76443-2a08-5e12-b7fc-d6e87c140328,The Chevy Malibu Was So Uncool It Was Cool,2024-05-09
nyt://article/8562ad50-c283-52c5-97c5-db517f408cfc,Stormy Daniels as We Had Never Seen Her,2024-05-09
nyt://article/62b1f4b3-decb-5d3b-80fb-4301d91b9794,Grabbing a Water Bottle Gets a Marathon Winner Disqualified,2024-05-09
nyt://article/1a53ca2e-ac01-5bda-bb4b-95965698dffa,"Herbert Pardes, Who Steered the Growth of a Giant Hospital, Dies at 89",2024-05-09
nyt://article/0f46d3e4-e32d-5512-b76c-5f6f2f184998,2 Skiers Die and 1 Is Rescued After Avalanche in Utah,2024-05-09
nyt://article/3272c276-419b-5f49-8b80-4ce0c8f1ee5c,"Madeleine Westerhout, Trump White House Gatekeeper, Takes Stand in Trial",2024-05-09
nyt://article/dbdcdf3d-f029-5dff-a4a3-8d5fb5bd202a,The Doom vs. Optimism Debate,2024-05-09
nyt://article/968a632f-9bb8-5f50-acee-fff6f41dc95f,Who Owns a Drawing That May Be Nazi Loot? A Judge Will Decide.,2024-05-09
nyt://article/bc08a782-357d-56b3-bee5-70020ea79c3d,"N.Y. Ethics Panel Violates State Constitution, Appeals Court Rules",2024-05-09
nyt://article/086a0a70-c217-590f-a41e-4762ff1dee8f,"Boeing Locks Out Firefighters in Contract Dispute, and Biden Weighs In",2024-05-09
nyt://article/40d820ee-ee1a-5974-bdb9-f057572f04ab,White House Aide Warns Israel Against ‘Smashing Into Rafah’,2024-05-09
nyt://article/3406d3c8-650e-560b-8b9a-7e4bcfe9bf0f,Embrace the Hot Restaurant Dupe,2024-05-09
nyt://article/9f63263e-e8e9-5227-a25b-36901fec31ad,"In a Surprise, Cornell’s President Resigns",2024-05-09
nyt://article/b4124204-6655-5325-872e-5b39443051f3,6 New Books We Recommend This Week,2024-05-09
nyt://article/000194c5-aeba-50c4-bbdd-540863bdacb8,"Stormy Daniels, Echoing Trump’s Style, Pushes Back at Lawyer’s Attacks",2024-05-09
nyt://article/39179b1c-367b-51c4-abe0-862208fcf25e,Ex-Nebraska Lawmaker Faces New Charges in Campaign Finance Case,2024-05-09
nyt://article/7952861b-8440-53d8-9e8b-c12c5cfbd918,She Wanted to Help Strangers. Would They Take Her Up on It?,2024-05-09
nyt://article/1b99b0be-70ac-5dd5-870d-9ea49eb503b6,"Fresh Off Defeat in Speaker Fight, Greene Relishes the Chaos She Wrought",2024-05-09
nyt://article/84125bf1-1e5b-581c-8795-0515199863b4,Why Was This Treasure of Musical Theater All but Lost to the Ages?,2024-05-09
nyt://article/94eadebd-bb09-53b0-8a30-dedd0c8e2304,Man Who Attacked Police Officers With Machete Sentenced to 27 Years,2024-05-09
nyt://article/be86f2a1-2fc4-51ba-a9c7-6a694133af05,"Friday Briefing: Stormy Daniels, Day Two",2024-05-09
nyt://article/72fe7280-19ab-5258-a8e0-903ad989bf36,Paging Senator Schumer …,2024-05-09
nyt://article/5d904386-a172-50df-9077-2e0ed00f17da,Eric Adams’s Brother Has a New Gig: Black-Tie Philanthropy,2024-05-09
nyt://interactive/a2b60c16-53d2-58ba-b7ef-156c0d1a7111,How to Make Retirement Less Scary,2024-05-09
nyt://article/6968c9c3-e2f6-573d-b3b8-7ce861dc64c6,Chinese Magnate in Straw Donor Scheme Agrees to Leave U.S. in Plea Deal,2024-05-09
nyt://article/b524eac4-370a-581f-9ceb-a88e73054d51,Stormy Daniels Fights Back,2024-05-09
nyt://article/dc42f977-b932-5d67-89f1-36047968a91e,Another Sriracha Shortage May Be on the Horizon. What Happened?,2024-05-09
nyt://article/69092805-17dc-5b7b-9381-8182ac013579,Woman Who Says She Inspired ‘Baby Reindeer’ Character Denies Stalking,2024-05-09
nyt://interactive/49d24483-f78b-5400-894a-6504c758a9a7,Those Who Mother Us Are Not Always Our Parents,2024-05-09
nyt://article/61fd2b82-25e9-5dbc-bd23-485e71b5aca8,"Trump Again, and Repeatedly, Denounces Jews Who Support Biden",2024-05-09
nyt://article/ccc030f7-c798-5918-ba09-51553b5e3e17,Breach Grows Between Biden and Israel’s Leaders Over Rafah Invasion,2024-05-09
nyt://article/44e5a569-11f8-5d54-a3f8-984a6e60b852,Donald Trump’s Lawyer Pressed Stormy Daniels,2024-05-09
nyt://article/383d4faf-5895-5727-bd93-f7a67bc9e2d1,Why Higher Fed Rates Are Not Totally Off the Table,2024-05-09
nyt://article/d0bed605-3738-55d7-9b72-0343e3047848,Are R.F.K. Jr. Signature Gatherers Misleading New Yorkers for Ballot Access?,2024-05-09
nyt://article/c48ff6cd-01d4-58ef-8036-ec5554b5923e,Apple Says Destructive iPad Ad ‘Missed the Mark’,2024-05-09
nyt://article/de155143-0443-5051-999c-fb1131c1a53f,"As Gaza Talks Falter, Negotiators Look for a Deal or a Scapegoat",2024-05-09
nyt://article/27b98a0b-fee8-51e7-bbaa-f45c209a5a7e,"Merchan, Denying a Mistrial, Chides Trump’s Lawyers for Their Missteps",2024-05-09
nyt://article/094239bb-5a4b-51a2-9073-f545d11bbeca,Stormy Daniels Is Steady on the Stand: 5 Takeaways From Trump’s Trial,2024-05-09
nyt://article/59e3ab69-df27-5ef8-bffc-b46f7818e79a,Biden Aims to Speed Up Asylum Screenings in Certain Cases,2024-05-09
nyt://article/d880b594-b59d-57b6-b76f-91cd5b2c6adb,U.S. Judge Backs U.K. Request to Extradite ‘Irish Heiress’ Who Swindled Producer,2024-05-09
nyt://article/22df296f-290e-57f8-b24b-af4c81c3820b,"Bernard Pivot, Host of Influential French TV Show on Books, Dies at 89",2024-05-09
nyt://article/6d38b1f4-b21e-5e08-8696-fc28fc63daf7,Pro-Palestinian Encampment at Penn Grows as Commencement Nears,2024-05-09
nyt://article/daa33af3-218b-576e-a020-a609165a5b28,President Biden Just Made His Biggest Blunder,2024-05-09
nyt://article/f64c0bde-6497-5624-a7d8-7eee51e4e300,"In Sex Crimes Cases, New York Weighs Allowing Evidence of Prior Bad Acts",2024-05-09
